id_artigo,ano,titulo,autores,abstract,topic_tfidf,tema_tfidf,topic_bertopic,tema_bertopic
297,2020,Mulheres na Pós-graduação nas Áreas de Exatas: Um Estudo de Caso na Universidade de Brasília,Thayanna Klysnney Moreira Nunes (UnB); Aleteia Patricia Araujo (UnB); Maristela Holanda (UnB),"As áreas relacionadas às Ciências Exatas têm uma baixa representatividade de mulheres. No nível de mestrado e doutorado, a literatura apresenta que existe uma lacuna de diversidade de gênero. Esta é a realidade da área da Computação, que integra a grande área das Ciências Exatas. Desta forma, este artigo aborda a questão de pesquisa: Como está a representatividade feminina nas áreas de Ciências Exatas e da Terra na Universidade de Brasília (UnB)? Para responder esta pergunta foram utilizados os dados abertos e a definição de área Ciências Extasa e da Terra (CET) da CAPES. Como resultado foi possível constatar que Computação é a área das CET com o menor número de mulheres proporcionalmente nos cursos de mestrado e doutorado da UnB.",5,Cluster 5,-1,-1_computação_mulheres_meninas_cursos
298,2020,Onde estão as mulheres nessa história? Uma oficina sobre representatividade feminina nas ciências.,Maria Alice N. Silva (IF GOIANO); Thalia S. Santana (IF GOIANO); Letícia S. Camargo (IF GOIANO); Natália C. Louzada (IF GOIANO); Ramayane B. Braga (IF GOIANO); Adriano H. Braga (IF GOIANO),"O presente trabalho constitui um relato de experiência pedagógica, de oficina de construção de linha do tempo de mulheres na história da Ciência. O objetivo da oficina é recontar a história com a participação feminina, e dessa forma trazer representatividade para áreas tidas muitas vezes como masculinas. Para o desenvolvimento dessa atividade foram pesquisadas oito mulheres das três grandes áreas das ciências: humanas, exatas e biológicas. Com duração de 1h30 minutos, a ação contou com a participação de alunos do ensino médio técnico, em prol da identificação e re(conhecimento) de figuras femininas obliteradas na historiografia.",0,Cluster 0,0,0_stem_projeto_feminina_áreas
299,2020,Perfil dos Egressos de Computação do Interior da Amazônia no Mercado de Trabalho,Luiz Henrique C. Nunes (UFOPA); Josivan R. Reis (UFOPA); Carla M. Paxiúba (UFOPA); Márcio J. M. Ponte (UFOPA); Mariana W. B. Nascimento (IFPA); Roberto  P. Nascimento (UFOPA),"Conhecer o perfil dos egressos de computação no Brasil é uma necessidade e também um desafio. Dessa forma, este trabalho visa levantar dados sobre os egressos de computação das Instituições de Ensino Superior (IES) públicas do Oeste do Pará (Universidade Federal do Pará - UFPA e Universidade Federal do Oeste do Pará - UFOPA) e apresentar o perfil desses egressos desde o primeiro curso de tecnologia da região, Tecnólogo em Processamento de Dados (TPD), até os cursos vigentes. O estudo foi realizado através do método de Survey de pesquisa quantitativa, utilizando questionário. O artigo apresenta ainda um recorte dos ingressos por gênero.",5,Cluster 5,-1,-1_computação_mulheres_meninas_cursos
300,2020,Por que as mulheres são minoria nos cursos de computação? Um estudo de caso desta situação na cidade de Ouro Branco-MG,Simone S. Sidnei (IFMG); Márcio A. Miranda (IFMG); Suelen M. de Paula (IFMG),"O presente trabalho trata-se de um estudo acerca da baixa representatividade do público feminino na área da computação. Foram entrevistados alunos (meninos e meninas) do terceiro ano do Ensino Médio das escolas públicas e privadas em Ouro Branco-MG. A pesquisa analisou se a condição financeira das alunas e o apoio e incentivo que elas recebem da família e da escola são determinantes na escolha por um curso na área de computação. Ao final, foram apontadas questões para um maior aprofundamento.",5,Cluster 5,20,20_desempenho_feminino_meninos_es
301,2020,Projeto Meninas na Computação - UNIFAP: relato de experiência e desafios,Patrícia Araújo de Oliveira (UNIFAP); Aíla  Maciel (UNIFAP); Gabriela Felipa  Souza (UNIFAP),"O Meninas na Computação é um projeto de extensão da Universidade Federal do Amapá e tem por objetivo tanto incentivar o público feminino ao interesse pela área da computação, como também apresentar e discutir os desafios enfrentados por mulheres em áreas que possuem a atuação majoritariamente do sexo masculino. Neste artigo, apresentaremos as estratégias utilizadas para as ações realizadas ao logo do ano de 2019, focadas principalmente na criação de um espaço que permita dar voz àquelas que não se sentem representadas no meio que frequentam e de ações lúdicas para alunas do 6º ao 9º ano do ensino fundamental. Apresentaremos um relato das principais ações, bem como os desafios enfrentados.",1,Cluster 1,22,22_and_to_women_computing
302,2020,TIChers - conscientização e formação de docentes da Educação Básica por mais mulheres na Computação,Sílvia Amélia Bim (UTFPR); Rita C. G. Berardi (UTFPR),"Este artigo apresenta o projeto TIChers que realiza ações de conscientização e formação de docentes da Educação Básica para aumentar a representatividade de mulheres na área de Computação. A estratégia de trabalhar diretamente com docentes ainda é incipiente no contexto brasileiro. Entretanto, vários estudos sinalizam a influência das experiências na Educação Básica na escolha de uma carreira profissional. Os resultados preliminares já se revelam promissores na perspectiva de gerar autoconfiança em docentes para abordar temas de Computação com suas turmas.",5,Cluster 5,-1,-1_computação_mulheres_meninas_cursos
303,2020,Um Estudo sobre as Dificuldades de Inserção de Meninas na Computação,Sarah Barbosa de Deus (IFBA); Steffany   Caroline Carvalho  Freire (IFBA); Carina Machado de Farias (IFBA),"Este trabalho apresenta os resultados de uma pesquisa científica realizada com estudantes concluintes do ensino médio que buscou entender as razões que levam meninas a não escolherem cursos superiores na área de computação. O estudo apontou que os meninos levam vantagem em conhecimentos básicos sobre computação e sugere que a origem do desinteresse feminino pela área pode estar associada, entre outros fatores, à falta de estímulos oriundos da família e da escola.",5,Cluster 5,20,20_desempenho_feminino_meninos_es
304,2020,Uma Análise Cienciométrica das Publicações do Congresso da Sociedade Brasileira de Computação na Perspectiva das Mulheres na Computação,Thalia S. Santana (IF GOIANO); Adriano H. Braga (IF GOIANO),"O presente trabalho realiza um estudo acerca da presença feminina nas produções científicas dos eventos do Congresso da Sociedade Brasileira da Computação (CSBC), o qual é considerado uma das conferências de maior relevância em computação no país. Os dados foram obtidos por meio de técnicas de Web Scraping, entre os anos de 2017 a 2019, mediante a criação de uma base de dados para investigações quanto ao panorama das mulheres na computação, fazendo uso de análises cienciométricas na caracterização da diversidade de gênero na pesquisa em ciência da computação (CSR – em inglês, computer science research).",4,Cluster 4,13,13_wit_publicações_análise_anos
305,2020,Utilizando Oficinas Educacionais de Empoderamento Feminino para Inclusão Digital e Social de Estudantes do Ensino Médio,Maria Roselene A. Lima (UFPA); Geisiane S.  Matos (UFPA); Sara M.  Silva (UFPA); Fabíola Pantoja O.  Araújo (UFPA); Yomara Pinheiro Pires (UFPA),"O objetivo deste artigo é apresentar o uso de tecnologias da informação e comunicação como um meio de empoderamento feminino, para despertar, em meninas do ensino médio, o desejo de conhecer mais sobre áreas da computação. A avaliação foi realizada de dados extraídos de questionários, aplicados durante a execução das oficinas. Como resultado foi identificado a satisfação das alunas participantes e o desejo de aprender mais sobre computação e suas tecnologias, com nível de aceitação em 85%.",0,Cluster 0,16,16_oficinas_ações_meninas_relato
306,2019,Um Panorama da Atuação da Mulher na Computação,Laura Ribeiro (CEFET-MG); Glívia  Barbosa (CEFET-MG); Ismael  Silva (CEFET-MG); Flávio  Coutinho (CEFET-MG); Natália  Santos (CEFET-MG),"Esse trabalho foi desenvolvido com o objetivo de caracterizar – por meio de um portal de visualizações - o panorama e os impactos da atuação feminina na computação no Brasil. Essa iniciativa engloba um escopo nacional, com análise acadêmica e mercadológica, e apresenta como produto final um portal que possibilita e facilita o compartilhamento informação e a disseminação de conhecimento relacionado a atuação da mulher brasileira na computação.",4,Cluster 4,7,7_brasileira_brasileiras_negras_computação
307,2019,Techno Girls: oficinas de programação de jogos para estudantes de escolas públicas,Waine Júnior (UFMT); Lohana  Santos (UFMT); André  Manzano (UFMT); Ângela  Farias (UFMT); Tamyres  Souza (UFMT); Issufi  Badji (UFMT); Soraia  Prietch (UFMT); Roger  Resmini (UFMT),"Este artigo descreve o relato de experiência do planejamento e da execução de oficinas que integram conteúdos sobre mulheres na computação, fundamentos de hardware e software, programação de jogos usando Python e o mercado de trabalho local na área de informática. O Programa ofertou 03 turmas, com 08 encontros de 04 horas cada, dessa oficina, para estudantes de uma escola pública estadual de bairro periférico da cidade. As oficinas foram oferecidas como forma de atrair o interesse de meninas para a área, no entanto, meninos também puderam participar. O uso da abordagem de Aprendizagem Dialógica foi o diferencial desse Programa, uma vez que seus princípios nortearam todas as ações e atividades realizadas.",0,Cluster 0,16,16_oficinas_ações_meninas_relato
308,2019,Análise da participação feminina nos cursos técnicos e de graduação da área de Informática da Rede Federal de Educação Tecnológica e do Cefet/RJ campus Nova Friburgo,Gisele Marinho (CEFET-RJ); Simone  Fagundes (CEFET-RJ); Carolina  Aguilar (CEFET-RJ),"Diversos estudos apontam que as mulheres são minoria nos cursos superiores da área de Tecnologia da Informação, no entanto há poucos trabalhos que investigam sua participação em cursos técnicos. Este trabalho apresenta um panorama da participação feminina nos cursos superiores de Bacharelado e Tecnologia, bem como nos cursos técnicos da Rede Federal de Educação Profissional, Cientı́fica e Tecnológica e em especial dos cursos ofertados pelo Cefet/RJ campus Nova Friburgo. São discutidos aspectos relacionados ao ingresso e à situação academia das estudantes desses cursos.",5,Cluster 5,4,4_the_tecnologia_mulheres_informática
309,2019,Unindo pesquisa e extensão para fortalecer a participação feminina em cursos de Computação de uma universidade: Projeto Meninas Digitais do Vale,Anna Marques (UFC); Valéria  Pinheiro (UFC); Ana  Alencar (UFC); Karina  Branco (UFC); Rhenara  Alves (UFC); Maria  Mendes (UFC),"O fortalecimento da participação feminina na área de TI vem sendo uma preocupação cada vez maior em universidades e empresas. Devido à variedade de ações que podem ser executadas com este objetivo, pessoas interessadas em iniciar projetos nesta temática podem enfrentar dificuldades para selecionar ações adequadas ao contexto no qual estão inseridas. O objetivo deste artigo é relatar a experiência do projeto Meninas Digitais do Vale que uniu pesquisa e extensão para selecionar sistematicamente ações para fortalecer a participação feminina nos cursos de Engenharia de Software e Ciência da Computação em uma universidade. A metodologia adotada envolveu a condução de um mapeamento sistemático, um survey e brainstorming para a seleção de ações adequadas ao campus e aos desafios e necessidades das alunas ativas nos cursos.",1,Cluster 1,-1,-1_computação_mulheres_meninas_cursos
310,2019,Gêneros e suas nuances no ENEM,Viviana Noguera (USP); Kalinka  Branco (USP); Cristina  Ciferri (USP),"Visando investigar a diferença de gêneros no acesso às Universidades na área de ciências exatas, este artigo analisa, sob diferentes fatores, o desempenho dos participantes do ENEM (Exame Nacional do Ensino Médio) nos anos de 2013 a 2017. Os resultados obtidos mostraram que a superioridade de desempenho dos participantes masculinos não é tão evidenciada quando comparada ao desempenho das participantes femininas. Conclui-se que há a necessidade de realização de políticas públicas educacionais e de análises mais pormenorizadas de um conjunto maior de dados, além da integração entre as informações do ENEM com o SISU (Sistema de Seleção Unificada) e ProUni (Programa Universidade para Todos) para auxiliar na obtenção do equilíbrio entre gêneros no acesso às Universidades com foco em ciências exatas.",5,Cluster 5,8,8_preconceito_políticas_dados_homens
311,2019,A História da Condessa Surda de Lovelace: Um Relato de Experiência de Ensino Híbrido e Assistivo de Programação,Márcia Oliveira (IFES); Ana  Leite (IFES); Mônica  Silva (IFES); Clara Marques Bodart (IFES); Gabriel  Nascimento (IFSP),"A História da Condessa Surda de Lovelace trata de um relato de experiência da aprendizagem de programação de uma estudante surda através de oficinas presenciais antes e durante a execução de um curso de programação Python a distância para meninas. O relato realizado por uma professora, uma tutora e uma intérprete de Libras apresenta a experiência da estudante surda em uma abordagem híbrida de ensino de programação e as análises SWOT de assistência à estudante surda em sua trajetória de aprendizagem de programação. Os resultados apontam para progressos, mas a Condessa Surda de Lovelace apresenta uma carta aberta para as Meninas Digitais relatando sua experiência de dificuldades e progressos e apresentando um apelo às Meninas Digitais para compreenderem as necessidades da comunidade surda e desenvolverem mais ações de inclusão de meninas surdas nas carreiras de computação.",0,Cluster 0,-1,-1_computação_mulheres_meninas_cursos
312,2019,Uma análise sobre questões de gênero nos cursos de Computação do municı́pio de Alegrete/RS,Aline Mello (UNIPAMPA); Amanda  Melo (UNIPAMPA); Isadora  Ferrão (UNIPAMPA),"No Brasil, somente 14% do número de mulheres que se matriculam em cursos da área da Computação o concluem. Para reduzir o percentual de de evasão das mulheres, é necessário primeiramente identificar suas causas. Este artigo tem como objetivo principal apresentar os resultados obtidos através da aplicação de questionários contendo perguntas sobre gênero a discentes e docentes dos cursos de Computação do municı́pio de Alegrete. Além dos estereótipos criados desde a infância, comentários ruins, machismo e a desvalorização do trabalho das graduandas foram enunciados como dificuldades, podendo contribuir para a evasão de mulheres.",2,Cluster 2,11,11_mulheres_tecnologia_cientista_escolhas
313,2019,Agindo sobre a diferença: atividades de empoderamento feminino em prol da permanência de mulheres em cursos de Tecnologia da Informação,Natália Louzada (IF GOIANO); Thalia  Santana (IF GOIANO); Ianka  Assis (IF GOIANO); Ramayane  Braga (IF GOIANO); Adriano  Braga (IF GOIANO),"Em seu surgimento, a computação envolveu expressiva participação feminina, dada a inserção social e profissional de mulheres em atividades ligadas à educação matemática e ao secretariado. Entretanto, à medida em que os campos de informática e tecnologia adquiriram maior valorização, a presença feminina nestas áreas diminuiu progressivamente. Esta desproporcionalidade vem sendo atribuída a estigmas de gênero e ao apagamento da contribuição de mulheres à computação, desestimulando e desmerecendo sua atuação nos referidos ramos. Nesse sentido, nos propomos a apresentar iniciativas de empoderamento e capacitação no âmbito de um projeto de extensão junto a cursos de informática, de nível médio técnico e superior, com o objetivo de combater a evasão escolar feminina.",1,Cluster 1,18,18_turmas_história_computação_mulheres
314,2019,Perfil profissional das egressas dos cursos de Computação da Universidade Federal da Paraíba-Campus IV,Jailma da silva (UFPB); Vanessa  Dantas (UFPB); Renata  Figueiredo (UFPB); Sheyla  Medeiros (UFPB); Thaíse  Costa (UFPB),"O artigo tem como objetivo identificar o perfil profissional das egressas dos cursos de Licenciatura em Ciência da Computação (LCC) e Bacharelado em Sistemas de Informação (BSI) da UFPB, considerando suas atuações no campo empresarial e no campo acadêmico. A fim de saber como e onde estão atuando as concluintes desses cursos, foi aplicado um questionário condicional abrangendo os possíveis casos em que essas concluintes se encontram. Com isso obteve-se que a maioria das egressas no mercado de trabalho estão atuando como analistas e as que prosseguiram para pós-graduação continuam realizando pesquisas na área.",5,Cluster 5,17,17_egressas_ciência_perfil_computação
315,2019,Materialidades Discursivas de Mulheres Negras na Computação,Mory Márcia Lobo (UFMT); Karen  Ribeiro (UFMT); Cristiano  Maciel (UFMT),"O artigo em voga busca analisar enunciados discursivos declarados por duas protagonistas negras da computação, em matérias de jornais eletrônicos. Para nortear as inferências a partir da interpretação utilizar-se-á a Análise de Discurso Francesa trabalhada por Pêcheux, visando identificar circunstâncias ideológicas de forças hegemônicas sobre o histórico de luta contra o sexismo e racismo na profissão, tendo como ponto de partida o corpo imagético projetado em um conjunto de contextos que passa pela área profissional e que exige enfrentamento dos mecanismos que fragmentam as identidades de gênero e racial movimentada em uma lógica excludente.",5,Cluster 5,7,7_brasileira_brasileiras_negras_computação
316,2019,Women in Resistance: Relatando o impacto da exposição do IEEE WiEUFRN na Semana de Ciência e Tecnologia da UFRN,Monica Pereira (UFRN); Marjory  Abreu (UFRN),"In celebration of the 60th anniversary of UFRN, we have proposed an initiative by IEEE WiEUFRNat CIENTEC aiming to highlight the female contribution to the STEM (Science, Technology, Engineering and Maths) degrees at UFRNover the last 60 years. The highlights were made through an exhibition, composed of four parts: I) description of renowned female icons and their contributions to the STEM areas. II) History of female participation in STEM courses at UFRN, through graphs showing the percentage of female students in the courses since its creation. III) #euexisto campaign: display of testimonials videos from current students of STEM courses explaining why they chose the course. IV) Tribute to female Lecturers: display all female lecturers names that have taught in STEM courses at UFRN. As a result, the group paid a tribute to those brilliant women and highlighted their contribution to STEM; acknowledged the current students and teachers of the courses; and helped raising awareness about the need to encourage the participation of women in these courses and in order to build a more diverse environment. Our main goal was raise awareness that the degrees of STEM had consistently less women than man and thus, our feminist group had a very important role to play in increasing those numbers. From the informal feedback we received, we believe our goal was achieved.",6,Cluster 6,14,14_the_of_courses_to
317,2019,Uma Iniciativa para Apoiar e Empoderar Alunas de Ensino Técnico e de Graduação em Computação,Kecia Ferreira (CEFET-MG); Glívia  Barbosa (CEFET-MG); Silvia  Albuquerque (CEFET-MG),"Este artigo apresenta um projeto criado por professoras em uma instituição de ensino que possui dois cursos técnicos e uma graduação na área de Computação. É descrito um relato de experiências a partir das ações no âmbito do projeto direcionadas a essas alunas para incentivá-las e apoiá-las a concluir seus cursos e encorajá-las para o mercado de trabalho. Como resultado do projeto, espera-se criar e consolidar uma rede de apoio mútuo entre as alunas desses cursos, bem como um grupo de orientação a elas, com atividades sistemáticas supervisionadas pelas professoras.",1,Cluster 1,1,1_ensino_oficina_programação_alunas
318,2019,Letramento de Meninas em Programação através do Pensamento Computacional para Compreensão de Problemas,Vania Marquiori (IFES); Márcia  Oliveira (IFES); Gabriel  Nascimento (IFSP),"Este trabalho trata da retração das mulheres na carreira da ciência da computação e das dificuldades de compreensão e de suas implicações no processo de formação de programadores. Desta forma o trabalho propõe a oferta de oficinas baseadas nos pilares do pensamento computacional para meninas do quinto ao nono ano do ensino fundamental em escola pública. A proposta é resultante de uma experiência de iniciação à programação com uma estudante surda, e tem como objetivo desenvolver o letramento em programação através do pensamento computacional para compreensão dos problemas despertando o interesse de meninas pela área.",0,Cluster 0,1,1_ensino_oficina_programação_alunas
319,2019,Fatores que Atraem e Afastam as Meninas de cursos da Área de TI,Amanda Martins (UFPB); Joana  Silva (UFPB); Joyce  Santos (UFPB); Ayla  Rebouças (UFPB),Este trabalho tem o objetivo de apresentar os resultados de um levantamento junto a meninas que estão cursando ou já concluíram cursos na área de TI sobre os fatores que atraem ou dificultam a permanência de mulheres em cursos da área. O levantamento foi realizado por meio de questionário online e os resultados mostram alguns fatores que podem atrair meninas para a área e que podem ser mais explorados em ações com este fim. Foram também obtidos alguns fatores que impactam negativamente na motivação das meninas para concluírem seus cursos e que podem ser mais refletidos nos cursos de graduação e mitigados.,5,Cluster 5,6,6_pesquisa_egressas_estudo_viés
320,2019,Triênio do Curso de Iniciação à Programação de Computadores para mulheres: uma análise preliminar das turmas e das egressas,Renata  Sena (UFBA),"Este artigo apresenta e discute resultados da análise do triênio das turmas exclusivas para mulheres do Curso de Iniciação à Programação (CIProg), ação do Meninas Digitais-Regional Bahia que visa aproximar mulheres das áreas de Computação por meio da programação. A discussão que segue passa por um breve histórico dessa iniciativa e do CIProg, além de apresentar uma análise histórica das turmas, suas especificações e particularidades, o perfil de egressas quanto à escolaridade e a política de cotas praticada nos editais de seleção para o CIProg.",2,Cluster 2,23,23_curso_iniciação_professoras_maringá
321,2019,Uma experiência de aprendizagem de lógica de programação com Code.org no ensino médio: uma análise por gênero sobre a percepção dos estudantes,Maria Fiori (UFC); Marina  Rocha (UFC); Anna  Marques (UFC),Levar a programação para estudantes do ensino médio pode facilitar o aprendizado e a compreensão do funcionamento de um algoritmo. Este artigo apresenta uma experimentação com a plataforma Code.org com 28 estudantes de ensino médio da rede pública estadual. O objetivo da experiência foi introduzi-los à lógica de programação e despertar o interesse dos estudantes para os cursos de Computação. O método de avaliação aplicado foi um questionário para avaliação de jogos digitais fornecido pelo modelo MEEGA+ qLevar a programação para estudantes do ensino médio pode facilitar o aprendizado e a compreensão do funcionamento de um algoritmo. Este artigo apresenta uma experimentação com a plataforma Code.org com 28 estudantes de ensino médio da rede pública estadual. O objetivo da experiência foi introduzi-los à lógica de programação e despertar o interesse dos estudantes para os cursos de Computação. O método de avaliação aplicado foi um questionário para avaliação de jogos digitais fornecido pelo modelo MEEGA+ que avalia a experiência do jogador. Uma análise por gênero foi conduzida sobre os resultados da avaliação do Code.orgue avalia a experiência do jogador. Uma análise por gênero foi conduzida sobre os resultados da avaliação do Code.org.,0,Cluster 0,1,1_ensino_oficina_programação_alunas
322,2019,Uma escultura de Ada Lovelace como recurso educativo para trabalhar gênero na computação,Nani Castilho (UFRGS); Clevi  Rapkiewicz (UFRGS); Simone  Fogazzi (UFRGS),Diversos instrumentos e estratégias podem ser usadas para fomenter o debate sobre a baixa participação de mulheres na área de computação. A falta de modelos de referência tem sido usada com frequência. Esse artigo relata a experiência de inserir o debate de gênero na computação em escolas públicas usando como recurso educativo uma escultura de Ada Lovelace feita com lixo eletrônico. Depoimentos de alunas e alunos que tiveram contato com a escultura denotam que integrar ate nesse debate pode trazer bons resultados.,4,Cluster 4,2,2_jogo_história_personalidades_grace
