id_artigo,ano,titulo,autores,abstract,topic_tfidf,tema_tfidf,topic_bertopic,tema_bertopic
193,2022,Mulheres na Ciência: Um Panorama das Publicações no WIT,Gabriela Souza Maximino (UFPA); Isadora Mendes dos Santos (UFPA); Marcelle Pereira Mota (UFPA),"O Women in Information Technology (WIT) é um evento que tem como objetivo disseminar estudos e projetos que incentivam a participação feminina na computação. Nesse sentido, este artigo busca verificar qual o panorama atual das publicações do evento, identificando quais são os temas mais abordados e as regiões que mais publicam pesquisas. Para isso, foi realizada a análise dos artigos publicados nosúltimos seis anos (2016-2021) no WIT. Como resultados, conclui-se que há a predominância de certos temas, além de uma desigualdade de contribuição por parte de regiões e estados, havendo a necessidade do fomento às diversidades temática e regional.",4,Cluster 4,4,4_the_tecnologia_mulheres_informática
194,2022,Mulheres na Computação no Brasil: um ciclo de lives com mulheres de referência na área,Amanda Meincke Melo (Unipampa); Letícia Gindri (Unipampa); Clevi Rapkiewicz (UFRGS); Aline Vieira de Mello (Unipampa); Alice Finger (Unipampa); Alexia Bagesteiro Camargo (Unipampa); Hariel Souza (UFRGS),"No contexto do trabalho remoto, em decorrência da pandemia da Covid-19, projetos de extensão universitária em todo o Brasil foram repensados. Este artigo apresenta a experiência de um ciclo de lives, desenvolvido em 2021, com o objetivo de divulgar o trabalho de mulheres que se destacam em diversas áreas da Computação no Brasil. O foco de cada live foi a biografia dessas mulheres, buscando-se compreender que aspectos influenciaram suas escolhas pela área e como foram suas experiências sendo mulheres nesse contexto. Os destaques trazidos pelas entrevistadas permitem reflexões sobre ações possíveis nas esferas privada e pública para incentivar mais meninas a entrar na área de Computação.",1,Cluster 1,31,31_covid_pandemia_19_remoto
195,2022,O Gap de Gênero no Mercado de Redes de Computadores: Estudo de Campo do Simpósio Brasileiro de Redes de Computadores e Sistemas Distribuídos,Suzy Santiago (UTFPR); Lindamir Salete Casagrande (UTFPR),"Por meio do método quantitativo este estudo descritivo, que se delineia como uma pesquisa de campo, apresenta uma análise do sexo dos/das autores/as estudantes dos artigos publicados nos últimos cinco anos (2017 a 2021) do Simpósio Brasileiro de Redes de Computadores e Sistemas Distribuídos (SBRC), de maneira a identificar se o gap de gênero que ocorre no mercado de redes de computadores já é percebido no âmbito acadêmico (ensino superior). A partir dos resultados conclui-se que o campo de redes de computadores atrai poucas mulheres já na fase de formação dos profissionais (de ensino superior).",4,Cluster 4,9,9_mulheres_teams_redes_análise
196,2022,Pandemia de COVID-19 tem Gênero,Aleteia Araujo (UnB); Maristela Holanda (UnB); Carla Castanho (UnB); Carla Koike (UnB); Roberta B. Oliveira (UnB); Edna Canedo (UnB); Mirella M. Moro (UFMG),"A pandemia de COVID-19 tem alterado a rotina de profissionais da área de TIC, como demais áreas de indústria, mercado e academia. Este artigo investiga se tais mudanças variam por gênero, com atenção às mulheres. Assim, foi realizada uma pesquisa com 205 profissionais a qual permite averiguar os diferentes impactos em suas vidas. Para isso, aspectos relacionados as atividades domésticas, pressão, esgotamento mental e físico são discutidos.",5,Cluster 5,31,31_covid_pandemia_19_remoto
197,2022,Percepções sobre a tecnologia da informação por alunas de ensino médio: um estudo sobre gênero e escolhas profissionais,Ana Medeiros (IFAL); Isadora B. M. C. Ferreira (IFAL); Lucas Fonseca (IFAL); Cledja Rolim (IFAL),"A participação de mulheres em algumas áreas de trabalho ainda encontra desafios em seu dia a dia, fato que é confirmado no baixo número de mulheres atuando em áreas relacionadas à tecnologia. Nesse contexto, este estudo analisa como 210 jovens mulheres de escolas públicas do município de Arapiraca, cursantes do ensino médio, se compreendem frente aos cursos superiores de tecnologia da informação, como possibilidade de escolha para um curso superior. A pesquisa, realizada por meio de um questionário eletrônico, é de natureza qualitativa e quantitativa e traz questões inerentes ao universo tecnológico, social e de gênero.",5,Cluster 5,11,11_mulheres_tecnologia_cientista_escolhas
198,2022,SALVE TODAS: um Sistema Inteligente para Auxiliar na Segurança de Mulheres,Maria Fernanda C. Ribeiro (UFRN); Monica M. Pereira (UFRN),"O artigo apresenta o Sistema SALVE TODAS, cujo objetivo é auxiliar na segurança de mulheres através da implementação de técnicas de aprendizado de máquina em conjunto com a construção de um dispositivo eletrônico e de um aplicativo voltados para a detecção de situações de risco e para o disparo de uma mensagem de pedido de socorro. O dispositivo conta com diferentes sensores cujos dados serão analisados por uma rede neural capaz de reconhecer situações em que a mulher se encontra em perigo e disparar a mensagem de SOS automaticamente. A mensagem também pode ser enviada manualmente por meio de um botão. Ao ser identificado o perigo, o aplicativo envia o SOS e compartilha a localização da mulher com seus contatos de segurança.",2,Cluster 2,30,30_mensagem_iniciativa_rede_protótipo
199,2022,Uma Análise Comparativa do Desempenho em Matemática entre Gêneros nas Provas do ENEM,Maristela Holanda (UnB); Amilton L. M. Júnior (UnB); Eric Hans M. da Silva (UnB); João Laterza (UnB); Aleteia Araujo (UnB); Carla Castanho (UnB); Carla Koike (UnB); Roberta B. Oliveira (UnB),"No Brasil, são utilizadas as notas do Exame Nacional do Ensino Médio (ENEM) para acesso às universidades públicas federais. Além das notas, os microdados desse exame possuem um grande conjunto de informações dos estudantes inscritos nas provas. Essas informações podem ser utilizadas para a realização de diversas análises a respeito do desempenho dos estudantes. Como em outros lugares do mundo, a entrada em cursos de computação pelas mulheres é bem menor do que a dos homens. Um dos pontos identificados na literatura em relação à não escolha pelo curso de computação, é a questão que computação precisa de muita matemática. Nesse contexto, este artigo apresenta uma análise especificamente sobre a matemática no ENEM, e as diferenças entre homens e mulheres nessa prova, tendo como questão de pesquisa: Qual a nota média obtida na prova de matemática pelos inscritos que estavam presentes por gênero, etnia, Unidade Federativa (UF) de residência, deficiência, estado civil e situação de conclusão do ensino médio? A análise dos dados foi dos anos de 2010 até 2019, pelo grande volume de dados o experimento foi executado em um cluster na Amazon Web Service (AWS) com o banco de dados MongoDB. Como resultado, em todas as análises os homens tiraram notas melhores que as mulheres, porém a diferença foi pequena entre as notas (homens e mulheres), aproximadamente 10%.",5,Cluster 5,-1,-1_computação_mulheres_meninas_cursos
200,2022,Uma Análise das Citações do Women in Technology (WIT),Andréa Sabedra Bordin (UFSC); Luciana Bolan Frigo (UFSC); Suelen Laurindo (UFSC); Luiza Castilho Ereno (UFSC); Ana Carolina da Silveira de Souza (UFSC),"Este artigo provê uma análise das citações dos seis anos do Workshop Women in Techcnology (WIT) com o intuito de identificar os artigos com maior prestígio, os principais indicadores bibliométricos e o fluxo de conhecimento da rede de citações. O processo foi realizado por meio da coleta, extração e análise dos artigos citados no evento. A análise revela que a maioria dos documentos citados foram publicados em eventos e mais especificamente no WIT. O artigo com mais prestígio aborda o Programa Meninas Digitais. A rede de citação é fracamente conectada e possui 6 componentes isolados. Os resultados dessa análise podem subsidiar tomadas de decisão, tanto para pesquisadores, como para a organização do evento.",4,Cluster 4,13,13_wit_publicações_análise_anos
201,2022,What Are the Challenges Faced by Women in the Games Industry?,Bárbara Moreira Drummond (UFF); Luciana Cardoso de Castro Salgado (UFF); José Viterbo (UFF),"Apesar do crescente interesse feminino em jogos, as mulheres ainda representam uma porcentagem muito baixa das pessoas produtoras de jogos. Este trabalho realiza uma Revisão Sistemática da Literatura, com o objetivo de entender quais desafios as mulheres encontram na indústria de jogos, e quais propostas têm sido feitas para promover empresas mais inclusivas. Os artigos encontrados mostram que os estereótipos de gênero ainda são muito presentes, afetando a entrada e permanência de mulheres na área. Entretanto, têm-se discutido abordagens que envolvem, além da contratação de mais mulheres, colocá-las em posição de liderança e adotar estratégias de comunicação sensíveis a gênero. Os resultados podem contribuir para guiar futuras pesquisas sobre quais abordagens realmente funcionam ou não.",3,Cluster 3,10,10_jogos_personagens_digitais_desenvolvimento
202,2022,Análise do Comportamento Histórico do Perfil de Gênero em Cursos de Computação na UFSC,Lígia Sell (UFSC); Cristina Meinhardt (UFSC),"Este trabalho analisa o perfil de estudantes de cursos de computação na UFSC, comparando com os comportamentos reportados de inversão de maioria de gênero feminino em outros cursos de computação e com dados gerais de estudantes na área no Brasil. Além disso, são discutidos aspectos relacionados a raça nos cursos avaliados. O mapeamento do perfil de estudantes na instituição alvo permite planejar ações e politicas mais eficientes para aumentar a inclusão feminina na área de tecnologia da informação.",5,Cluster 5,-1,-1_computação_mulheres_meninas_cursos
203,2022,Avaliação de adequação de jogos ao público feminino,Isabel P. Matos (PUC Minas); Júlia F. G. Prado (PUC Minas); Mônica C. Machado (PUC Minas); Lucila Ishitani (PUC Minas),"O mundo dos games ainda é visto como predominantemente masculino. Faz-se necessário o desenvolvimento de jogos digitais que considerem as especificidades do público feminino, com intuito de atrair mais o interesse das meninas. Este trabalho apresenta heurísticas para avaliação da adequação de jogos para mulheres. Para isso, foi realizada uma Revisão de Literatura na qual não foram encontradas heurísticas para avaliar jogos para o público em estudo, embora tenham sido identificadas características de jogos para meninas. A partir dessas características foram propostas seis heurísticas sendo estas utilizadas para a avaliação de cinco jogos. Os resultados indicam que as heurísticas contribuem para avaliação da adequação de jogos digitais ao público feminino.",3,Cluster 3,10,10_jogos_personagens_digitais_desenvolvimento
204,2022,Desconstruindo Estereótipos em uma Oficina de Criptografia para Docentes da Educação Básica,Mayara Dal Vesco Hoger (UTFPR); Bruna Oenning Amador (UTFPR); Patricia Abe Turato (UTFPR); Lara Morgado da Silva Santos (UTFPR); Rita Cristina Galarraga Berardi (UTFPR); Silvia Amélia Bim (UTFPR),"Oficinas que abordam assuntos técnicos em áreas como a Computação, muitas vezes, geram materiais que reforçam os estereótipos presentes na área. Contudo, é possível buscar meios de apresentar os conteúdos de forma que, intencionalmente, além de abordar assuntos técnicos, também gerem um maior senso de pertencimento. Por meio da apresentação das estratégias utilizadas na construção de uma oficina de Criptografia, este artigo mostra a importância de construir materiais didáticos que introduzam aspectos relacionados a questões de gênero e desconstrução de estereótipos, mesmo que implicitamente. O alto engajamento das docentes nos cinco encontros da oficina com atividades síncronas e assíncronas, permite indicar que as estratégias escolhidas contribuíram para o seu senso de pertencimento.",2,Cluster 2,5,5_skills_soft_escolas_ensino
205,2022,Diversidade de Gênero em Projetos Open Source: um Estudo da Relevância dos Comentários Postados em Issues do GitHub,Estela Miranda Batista (UFV); Gláucia Braga e Silva (UFV); Thais Regina de Moura Braga Silva (UFV),"Estudos sobre diversidade de gênero em comunidades de software evidenciam a baixa representatividade feminina e, por consequência, a baixa participação, geralmente medida em função do número de contribuições em código. Este trabalho analisa a participação feminina em termos da relevância dos comentários postados no issue tracking do GitHub utilizando dados de 5 comunidades open source abertas e 5 dedicadas às mulheres. Os resultados mostram que, mesmo com pouca representatividade, na média, a relevância dos comentários feitos por mulheres é similar a dos homens. Em comunidades dedicadas além da representatividade, a relevância se mostra maior.",1,Cluster 1,4,4_the_tecnologia_mulheres_informática
206,2022,HACKatie: O Hackathon como estratégia para o incentivo de mulheres nas áreas de STEM,Eirene de Oliveira Fireman (UFAL); Karla Sophia Santana da Cruz (UFAL); Lilian Giselly Pereira Santos (UFAL); Lívia de Maria Calado Machado Soares (UFAL); Nayse da Silva Fagundes (UFAL); Suzy Kamylla de Oliveira Menezes (IFAL); Ullyanne Julia Freire Patriota (UFAL); Raquel da Silva Cabral (UFAL),"O presente artigo expõe o desenvolvimento da segunda edição da maratona de programação, conhecida também como Hackathon, realizada pelo projeto de extensão da UFAL intitulado: ""Katie: saindo do buraco negro e impulsionando as meninas para a computação"", que visa motivar, apoiar e promover a inclusão das mulheres nas áreas de STEM. O evento foi realizado de forma remota e organizado por membros e voluntários do projeto. Este Hackathon e o seu anterior possuíram público-alvo exclusivamente feminino de diversas idades, graus de escolaridade e localidade. Observou-se um aumento de participação entre as edições, o que mostra o interesse das participantes por iniciativas que incentivam o desenvolvimento pessoal e profissional em STEM.",1,Cluster 1,0,0_stem_projeto_feminina_áreas
207,2022,Jogos de tabuleiro como forma de estímulo ao Pensamento Computacional e à STEAM-W,Caroline Reis Vieira Santos Rauta (IFSC); Isabela Reinhold (IFSC); Maria Tereza de Almeida Wippel (IFSC),"Este artigo apresenta o desenvolvimento de dois jogos de tabuleiro: um baseado em computação em papel quadriculado e outro no Guia do Pensamento Computacional para Família. A proposta apresentada inclui a temática dos jogos o protagonismo feminino e a diversidade. Os jogos foram avaliados como de boa jogabilidade, mas os voluntários apontaram a necessidade de melhorias em aspectos como o nível de dificuldade e repetitividade. Pretende-se dar continuidade ao projeto para que se possa melhorar esses aspectos e avaliar outros, como o impacto dos jogos no desenvolvimento do pensamento computacional.",3,Cluster 3,2,2_jogo_história_personalidades_grace
208,2022,Mapeamento dos Índices da Desigualdade de Gênero por Unidade da Federação no Brasil,Ana Carolina Cebin Pereira (IFES); Karin Satie Komati (IFES),"Medir quantitativamente o quão desigual é a situação das mulheres em relação aos homens é uma iniciativa empreendida por organizações internacionais, tais como a ONU e o FEM. Embora os índices sejam multidimensionais, ao final, é gerado um único valor para o país inteiro. Há propostas brasileiras de índices de avaliação da desigualdade de gênero por unidade da federação, tais como o INDG e o IMDG. O objetivo deste trabalho é desenvolver um site com um mapa coroplético dos índices INDG e o IMDG.",4,Cluster 4,3,3_brasil_feminina_cursos_superior
209,2022,Mulheres na Ciência: Jogando para Aprender,Suzany Angeli (UDESC); Silvia Amélia Bim (UTFPR); Isabela Gasparini (UDESC),"O presente trabalho apresenta o processo de criação do jogo ""Mulheres na Ciência"" por estudantes do 9° ano do Ensino Fundamental II de uma escola pública por meio das técnicas do Design Participativo. ""Mulheres na Ciência"" foi criado com a participação de estudantes em todas as fases de sua criação e possibilitou mudanças nas percepções de estudantes sobre a participação das mulheres na construção do conhecimento científico.",3,Cluster 3,2,2_jogo_história_personalidades_grace
210,2022,Perfis em Mídia Social para Meninas e Mulheres com interesse na área STEM e STEAM,Leihge Roselle Rondon Pereira (UFMT); Karla de Souza e Silva (UFMT); Eunice Pereira dos Santos Nunes (UFMT); Cristiano Maciel (UFMT),"Os estereótipos de gênero e a baixa representatividade feminina são alguns dos aspectos que diminuem a interação das mulheres com os temas STEM/STEAM. Este trabalho apresenta um mapeamento dos perfis ativos na mídia social Instagram que abordam e apoiam a pauta das mulheres nessas áreas. Foram identificados 45 perfis a partir de uma busca com descritores, critérios de inclusão e exclusão. Observou-se que os perfis contribuem com a inserção das Mulheres em STEM/STEAM e ressignificam o campo como um espaço para a mulher.",1,Cluster 1,4,4_the_tecnologia_mulheres_informática
211,2022,Projeto de incentivo à meninas na STEM: Um relato de experiência,Viviane A. Souza (IFS); Iara S. Edgel (IFS); Yasmin S. Néu (IFS); Jozeane P. A. Silva (IFS); Josiane N. S. Lopes (IFS),"Este presente artigo tem por objetivo apresentar um relato de experiência a partir das vivências de um projeto que está sendo realizado desde 2021 no Instituto Federal de Sergipe. O propósito do programa é auxiliar meninas que estudam na rede pública a conhecerem mais sobre o universo da ciência, tecnologia e computação e incentivá-las a seguirem seus objetivos, independente da área. O artigo vai ilustrar as atividades remotas realizadas até então, as percepções das bolsistas, ações nas mídias sociais e trabalhos futuros.",1,Cluster 1,16,16_oficinas_ações_meninas_relato
212,2022,Questões de Gênero e a Evasão de Mulheres nos Cursos de Computação: Um Estudo de Caso na Região Metropolitana de Belém,Ana Isabela M. Ramos (UFPA); Fabíola O. Araújo (UFPA),"Diante de um cenário de pouco incentivo às mulheres para ingressar na área da computação, o que contribui para a baixa quantidade de mulheres e o alto índice de evasão daquelas que ingressam nos cursos de computação. Este artigo busca identificar as razões que levam tantas mulheres à desistência da trajetória acadêmica por meio da aplicação de um questionário sobre a vivência feminina nos cursos de Tecnologia da Informação na Região Metropolitana de Belém. Para analisar as respostas do questionário, foram utilizados os softwares IRAMUTEQ e WEKA, aplicando algoritmos de análise de discurso, bem como mineração de dados para identificar padrões entre as respostas, e, posteriormente, identificar os motivos da evasão.",5,Cluster 5,-1,-1_computação_mulheres_meninas_cursos
213,2022,Relato de experiência da criação do grupo #include&lt;girls&gt;: onde estamos agora e o que vem a seguir,Maria Camila N. Barioni (UFU); Elaine R. Faria (UFU); Maria Adriana V. Lima (UFU); Gina M. B. Oliveira (UFU); Fabíola S. F. Pereira (UFU); Alessandra A. Paulino (UFU); Mirella S. Junqueira (UFU),"Este artigo descreve as ações realizadas na fundação do grupo #include<girls> incluindo levantamento de dados, planejamento e resultados. O objetivo do grupo consiste em desenvolver atividades acadêmicas para fomentar o ingresso de meninas no ensino superior nas áreas de Computação e Tecnologia da Informação e Comunicação (TIC). O artigo também apresenta os próximos passos que foram delineados levando em consideração as necessidades identificadas na comunidade e na universidade.",1,Cluster 1,14,14_the_of_courses_to
214,2022,"STEAM, Gênero e Ensino Médio: ações da extensão em parceria com o Meninas Digitais Mato Grosso",Waleska Gonçalves de Lima (UFMT); Cristiano Maciel (UFMT); Ana Lara Casagrande (UFMT); Sabrina Bourscheid Sassi (UFMT / SEDUC-MT); Maria Fernanda Abalem Franca Nunes (UFMT),"Com o objetivo de compartilhar ações e estratégias para fomentar a pauta STEAM e Gênero, este artigo relata a experiência formativa oriunda do Projeto de Extensão ""Carreira, tecnologias e educação: extensão e pesquisa em prol da equidade de gênero"", vinculado ao Meninas Digitais Mato Grosso. As ações relacionaram as discussões sobre a sub-representação das mulheres nas áreas científicas e tecnológicas com o Novo Ensino Médio, na perspectiva dos docentes da rede estadual de Mato Grosso. Os resultados indicam avaliações positivas dos participantes. Outras consequências benéficas podem ser percebidas quando acompanhados os efeitos na prática do docente, incluindo a inclusão de pautas STEAM e de Gênero nos contextos escolares.",0,Cluster 0,0,0_stem_projeto_feminina_áreas
215,2022,Uso do Caderno de Atividades Desplugadas durante a Pandemia: Um Relato de Experiência,Jislane S. S. de Menezes (IFS); Cristiane O. de Santana (IFS); Leandro Santos Fraga (IFS); Kamille G. Bezerra (IFS); Ana Beatriz S. Matias (IFS),"Ada Lovelace, Grace Hooper, Carol Shawn, entre outras, são mulheres que fizeram parte da história da Computação, fazendo parecer que a área da computação é almejada dentre as mulheres, contudo esse número é reduzido. Com o isolamento social devido a Covid-19 e a necessidade de trazer para meninas o conhecimento sobre representatividades femininas, o projeto Meninas Digitais Regional Sergipe disponibilizou a 173 estudantes, um caderno de atividades desplugadas impresso, para resolução sem auxílio de instrutor. A avaliação de 84 questionários aplicados como pré-teste e pós-teste indicou que houve uma melhora de cerca de 27% na lembrança de personalidades femininas e conceito sobre computação desplugada após a resolução do caderno.",2,Cluster 2,-1,-1_computação_mulheres_meninas_cursos
216,2021,A percepção das mulheres sobre a programação - Oficinas de Programação Django Girls,Myrian Noguera Salinas (Girls Code),"Numerosas iniciativas têm buscado atrair meninas e mulheres para as carreiras STEM (Ciência, Tecnologia, Engenharia e Matemática) através de diferentes oficinas. Este trabalho  têm como objetivo relatar a experiência das oficinas desenvolvidas com meninas do ensino médio e mulheres adultas do Paraguai e Uruguai durante os anos de 2018 e 2019. As oficinas incluíram a criação de um Blog Web com HTML/CSS, Python e Django Web Framework, além de palestras e debates sobre personalidades femininas proeminentes, bem como a inserção feminina na tecnologia. Foram aplicados questionários de percepção onde os dados obtidos também são apresentados, analisados e discutidos.",0,Cluster 0,0,0_stem_projeto_feminina_áreas
217,2021,Análise da participação feminina no curso de Ciência da Computação da UFCG,Beatriz A. de Miranda (UFCG); Marcella M. S. C. de Almeida (UFCG); Ivyna R. S. Alves (UFCG); Lívia M. R. S. Campos (UFCG),"Apesar de sua importância histórica para o desenvolvimento da Ciência da Computação, as mulheres ainda têm uma baixa participação nos cursos de graduação da área. A fim de entender se e como essas números se aplicam ao curso de Ciência da Computação da Universidade Federal de Campina Grande, foi realizada uma análise descritiva dos dados acadêmicos fornecidos pela instituição. A partir dessa análise foi possível traçar um perfil do corpo discente feminino e compreender aspectos relacionados a taxa de ingresso, conclusão, evasão, sucesso e desempenho nas disciplinas com maior retensão no curso a partir da perspectiva de gênero, de a forma a entender se o sexo é um fator determinante para o sucesso no curso.",5,Cluster 5,20,20_desempenho_feminino_meninos_es
218,2021,Análise Estatística Descritiva e Regressão da Inserção das Mulheres nos Cursos de TI nos Anos de 2009 a 2018,Ariana R. Cursino (FATEC); Juliana F. P. Martinez (FATEC),"Os cursos da área de Tecnologia, são majoritariamente ocupados por homens. Com o intuito de fornecer métricas para a coordenação dos cursos e comunidades que trabalham com mulheres na área da tecnologia, uma análise descritiva estatística dos dados do Censo de Educação Superior dos anos de 2009 a 2018, se faz necessário. O presente trabalho, visa verificar o número de mulheres em relação ao número de homens que ingressaram nos cursos de TI, bem como uma análise de regressão para verificar a equação da taxa de crescimento de homens e mulheres nos cursos. O escopo do presente trabalho é fornecer métricas para futuras tomadas de decisão, com o objetivo de tornar o ambiente mais inclusivo e com igualdade de gênero.",5,Cluster 5,8,8_preconceito_políticas_dados_homens
