id_artigo,ano,titulo,autores,abstract,topic_tfidf,tema_tfidf,topic_bertopic,tema_bertopic
95,2024,“Era uma vez Lovelace”: Explorando a Contribuição Feminina na Computação por meio de um Jogo Didático,Sara L. de Farias (IF Goiano); Thalia S. de Santana (IF Goiano / UEG); Maria Luiza F. Silva (IF Goiano); Ramayane B. Braga (IF Goiano); Adriano H. Braga (IF Goiano),"Durante muito tempo na humanidade, a história da Computação foi contada sob uma perspectiva masculina, invisibilizando grandes contribuições de mulheres. Visando trazer maior visibilidade para estes nomes importantes na tecnologia, elaborou-se um jogo didático de tabuleiro para o ensino da história das mulheres na Computação. O jogo possui 27 cartas e adota como marco as gerações de computadores. Foram efetuadas quatro aplicações do jogo, coletando percepções dos participantes, que relataram alto nível de desconhecimento sobre as figuras femininas e seus feitos, ao mesmo tempo que consideraram o jogo como atraente e com regras claras e compreensíveis.",3,Cluster 3,2,2_jogo_história_personalidades_grace
96,2024,Relato de Experiência: Inclusão de Biografias de Pesquisadoras na Wikipédia,Herlane de Souza dos Santos (IFES); Anna Júlia Ferreira Tamanini (IFES); Maria Eduarda Lira Moreira (IFES); Karin Satie Komati (IFES),"No ano de 2022, a Wikipédia emergiu como o oitavo website mais frequentado no Brasil, acumulando mais de 184,9 milhões de visitas mensais. Sua posição de destaque como a enciclopédia digital mais consultada no país coloca-a como uma influente plataforma de conhecimento, moldando a percepção pública sobre uma ampla gama de tópicos. Foi identificado na própria Wikipédia um viés de gênero - uma discrepância reconhecida pela própria administração do site. Em resposta a isso, foi elaborado um projeto dedicado à criação de artigos biográficos sobre mulheres pesquisadoras nas áreas de ciência e tecnologia, com o intuito de disseminar suas pesquisas e contribuições e com isso melhorar o conhecimento coletivo para uma representação mais equitativa dos gêneros. O projeto envolveu a participação ativa de estudantes do ensino médio. O propósito deste artigo é narrar a jornada dessas estudantes, explorando os desafios e aprendizados enfrentados durante as atividades do projeto e refletindo sobre o impacto dessas iniciativas.",1,Cluster 1,7,7_brasileira_brasileiras_negras_computação
97,2024,A Escassez de Dados Abertos Estruturados em Países Latino-Americanos com Enfoque de Gênero na Educação Superior,Nicole Denes Hildebrand (UTFPR); Bruna Oenning Amador (UTFPR); Cristiano Maciel (UFMT); Rita Cristina Galarraga Berardi (UTFPR),"Esse artigo analisa a escassez de dados abertos estruturados em países latino-americanos com enfoque de gênero em áreas STEM, por meio de pesquisas em plataformas de dados abertos sobre Educação Superior. Neste sentido, são discutidos os desafios em obter estes dados, enfatizando o esforço necessário para que os dados existentes possam ser reutilizados e integrados, de modo a poder comparar dados de fontes heterogêneas e beneficiar futuras pesquisas em STEM de forma mais ampla.",4,Cluster 4,26,26_dados_abertos_stem_emílias
98,2024,Mentoria Acadêmica Gamificada: Explorando o legado das Mulheres na Computação,Rayanne Rocha (UFC); Marina Azevedo Ximenes Teles (UFC); Maria Julia Souza (UFC); Mylena Nascimento (UFC); Aline Nascimento (UFC); Anna Beatriz Marques (UFC),"A equidade de gênero na área da Computação continua sendo um grande desafio, causado por diversos motivos, entre eles o apagamento das contribuições femininas na área, diminuindo diretamente a representatividade das mulheres. Para ajudar a superar esse desafio o projeto Meninas Digitais do Vale criou a mentoria acadêmica, visando apoiar as ingressantes da Universidade Federal do Ceará, a fim de garantir a permanência dessas alunas nos cursos de Engenharia de Software e Ciência da Computação. Para assegurar uma maior representatividade e engajamento das alunas, o projeto gamificou a mentoria acadêmica com o uso de badges e álbuns de figurinhas contendo mulheres da área. Esta pesquisa visa coletar e analisar as respostas e relatos das alunas ingressantes que participaram da mentoria e responderam aos questionários, com o objetivo de entender a contribuição da mentoria e da gamificação para a permanência das ingressantes.",1,Cluster 1,-1,-1_computação_mulheres_meninas_cursos
99,2024,Como Abordamos a Interseccionalidade na Computação? Busca por Valores Interseccionais em uma Revisão Sistemática de Literatura na Base SOL,Marília Abrahão Amaral (UTFPR); Leander Cordeiro de Oliveira (UTFPR),"Este artigo parte da questão ""Como pensar teorias feministas, de gênero e interseccionais no contexto da computação brasileira?"". Para tal, é apresentada uma argumentação com objetivo de entrelaçar categorias (interseccionalidade, ativismo, politização, horizontalidade e saberes situados) de análise de conteúdo em artigos resultantes de um mapeamento sistemático realizado na Biblioteca Digital da Sociedade Brasileira de Computação (SOL-OpenLib). Como resultado tem-se a discussão sobre pesquisas e ações desenvolvidas no cenário brasileiro.",4,Cluster 4,7,7_brasileira_brasileiras_negras_computação
100,2024,Equidade de gênero no mercado formal de trabalho: uma análise da inserção profissional feminina de estudantes de curso TIC no Ceará,Danielly Silva Paulino (IFCE); João Pedro de Sousa dos Santos (IFCE); Erica de Lima Gallindo (IFCE); Hobson Almeida Cruz (IFCE),"Este estudo investiga a participação das estudantes mulheres do Instituto Federal do Ceará (IFCE) no mercado de trabalho formal. Usando uma abordagem quantitativa, foram examinados 5.590 alunos de cursos de Tecnologia da Informação e Comunicação (TIC), bem como os empregos formais que ocuparam no período de 2017 a 2021. Os resultados evidenciam uma persistente disparidade de gênero, com as mulheres em menor número no ingresso e na conclusão dos cursos, apresentando maior taxa de evasão e menor presença em posições de destaque no mercado de trabalho. Essas descobertas ressaltam a importância de fomentar o protagonismo feminino desde a educação básica, visando alcançar uma distribuição mais equitativa das oportunidades educacionais e profissionais na área de TIC.",5,Cluster 5,8,8_preconceito_políticas_dados_homens
101,2024,WIT 18 Anos: A Evolução de seus Comitês de Programa,Mirella M. Moro (UFMG); Luciana Salgado (UFF); Aleteia Araujo (UnB),"WIT (Women in Information Technology) é o maior evento nacional sobre diversidade de gênero na Computação. Realizado pelo Programa Meninas Digitais da Sociedade Brasileira de Computação, este evento celebra 18 edições em 2024. Chegar à maioridade em uma sociedade científica predominantemente masculina vai além de simplesmente marcar a transição para a “vida adulta”. Na realidade, é um importante marco que representa o potencial de mudança e igualdade de gênero. Para festejar tal conquista, este trabalho apresenta uma análise multidimensional sobre as pessoas que compuseram os seus comitês de programa. Os resultados revelam que diversidades regional, de formação, e de experiência têm sido marcas constantes nesses comitês.",4,Cluster 4,-1,-1_computação_mulheres_meninas_cursos
102,2024,Abordagem Interdisciplinar para Aproximar Meninas das Áreas de STEM: Reflexões e Propostas,Carmelita E. Vidigal (AVEC); Marilia V. C. Souza (AVEC),"Neste artigo descreve-se um projeto gratuito voltado para alunas do 9ª ano do ensino fundamental ao 3º ano do ensino médio de escolas públicas, que reúne atividades de programação, empreendedorismo e desenvolvimento pessoal. A reflexão sobre problemas reais enfrentados pelas meninas no cotidiano e as possibilidades de intervenção para mitigá-los por meio de aplicativos fazem parte de um projeto interdisciplinar que se encontra em sua 7ª edição. São apresentados os resultados de um levantamento feito com um grupo de egressas para verificar em que medida o projeto influenciou suas escolhas acadêmicas e profissionais.",0,Cluster 0,5,5_skills_soft_escolas_ensino
103,2024,"Projeto Gurias na Computação: reflexões, desafios e oportunidades frente à curricularização da extensão",Aline Vieira de Mello (Unipampa); Amanda Meincke Melo (Unipampa); Alice Fonseca Finger (Unipampa); Ildevana Poltronieri Rodrigues (Unipampa),"O projeto Gurias na Computação, registrado na Universidade Federal do Pampa, foi concebido a partir do diálogo entre alunas e professoras dos cursos de Computação, tendo como objetivo incentivar a participação feminina na área. Desde 2016, é um projeto parceiro do Programa Meninas Digitais da Sociedade Brasileira de Computação e realiza diferentes ações de ensino, pesquisa e extensão. Com a exigência dos cursos de graduação inserirem, pelo menos, 10% de extensão em seus currículos, a equipe executora do projeto precisou refletir sobre seu papel nesse processo. Neste artigo, são compartilhadas experiências do projeto Gurias na Computação, assim como refletimos sobre os desafios e as oportunidades do projeto frente à curricularização da extensão.",1,Cluster 1,12,12_gurias_federal_computação_ação
104,2024,Help Me: Evaluation of Applications to Support Women Victims of Domestic Violence,Cynthya Letícia Teles de Oliveira (USP / IFSP); Isadora Garcia Ferrão (USP),"Brazil, the fifth country with the most cases of femicide in the world, faces challenges both in its culture and in its public policies about supporting women who are victims of domestic violence. There are assistance programs, such as granting protective measures to ensure a minimum distance between the aggressor and the victim. Thus, different complementary initiatives emerged, such as applications that allow reporting incidents of violence and support for access. In this sense, this article proposes a technical evaluation of the five most popular brazilian applications on the Play Store dedicated to combating gender-based violence, considering technical metrics of usability and security.",6,Cluster 6,3,3_brasil_feminina_cursos_superior
105,2024,"No Passado Meninas, no Presente Mulheres, no Futuro Profissionais de TI com o apoio do Projeto Meninas.comp",Aline de Galés Silva (UnB); Nataly Lacerda de Oliveira (UnB); Maristela Holanda (UnB); Aleteia Araujo (UnB),"A baixa representatividade feminina na área de tecnologia pode acontecer por diferentes fatores, como por exemplo desconhecimento do campo ou da falta de apoio, ocasionando uma lacuna de oportunidades para as mulheres. Assim, por meio de entrevistas semiestruturadas e uma pesquisa, o presente estudo investiga o impacto do projeto Meninas.comp na vida de diversas estudantes de TI, desde o momento da escolha de carreira até o Ensino Superior. Entre os resultados, destaca-se que conhecer a Computação no Ensino Médio, por meio do projeto, foi decisivo para o ingresso na área de Computação, e o projeto tem se tornado um fator protetivo para que elas permaneçam no curso.",5,Cluster 5,-1,-1_computação_mulheres_meninas_cursos
106,2024,TWIST: Programa de Capacitação de Desenvolvedoras de Software,Noemi Rodriguez (PUC-Rio); Maria Julia de Lima (PUC-Rio); Ana Lúcia de Moura (PUC-Rio); Rachel Szenberg (PUC-Rio),"Nesse artigo, descrevemos o TWIST, um programa criado no Instituto Tecgraf, na PUC-Rio, com o objetivo de atrair mais mulheres para a área de desenvolvimento de software. O TWIST é um programa de capacitação de seis meses que visa estimular mulheres a trabalharem na área. Descrevemos a primeira edição do programa, que ocorreu em 2023 e foi voltada para alunas dos primeiros semestres de cursos de graduação da área técnica. A avaliação das participantes foi muito positiva e várias delas estão agora engajadas em projetos de desencvolvimento de software na PUC-Rio.",1,Cluster 1,-1,-1_computação_mulheres_meninas_cursos
107,2024,Exploring Gender Perspectives on Parenthood Experiences among Fathers and Mothers in the ICT Field,Isabelle Alex dos Santos (UnB); Nataly Lacerda de Oliveira (UnB); Edna Dias Canedo (UnB),"Context: Previous research has explored the beneficial effects of gender diversity within Information and Communication Technology (ICT) teams. Nonetheless, it’s widely acknowledged that women encounter numerous obstacles in sustaining their careers, particularly after becoming mothers, in contrast to fathers. Goal: This paper investigates the perceptions of practitioners mothers and fathers in the ICT field regarding the challenges they encounter in the job market concerning parenthood, with a particular emphasis on gender perspectives. Method: We have conducted a survey with fathers and mothers working in the ICT field to ascertain their perceptions of parenting challenges. Results: Our findings indicate that male practitioners find the organizational culture inclusive towards employees who are parents, while most women don’t feel the same way. Mothers have shown to feel insecure about the impact that maternity leave can have on their careers and reported receiving fewer job opportunities because they have children, while most fathers do not share these concerns. Furthermore, the majority of ICT practitioners who are parents said their coworkers are supportive regarding their parental responsibilities. Conclusions: The analysis highlights common challenges faced by parents in the ICT industry, such as balancing work and family responsibilities, workplace discrimination against women, and an organizational culture that lacks support for parents. Nevertheless, there is a growing acknowledgment of the necessity for inclusive policies and mutual support to tackle these challenges.",6,Cluster 6,4,4_the_tecnologia_mulheres_informática
108,2024,Processo de Elaboração e Validação da Cartilha Educativa “Mulheres na Computação”,Carla G. A. da Silva (UFMT); Silvia D. F. de Lima (UFMT); Helena C. D. Magalhães (UFMT); Karla S. Silva (UFMT); Maria F. A. F. N. Costa (UFMT); Julia M. R. Rogerio (UFMT); Cristiano Maciel (UFMT); Eunice P. S. Nunes (UFMT),"O trabalho tem como objetivo a apresentação do processo de elaboração e validação de uma cartilha educacional intitulada “Mulheres na Computação” para ser utilizada nas ações formativas e oficinas do Programa Meninas Digitais Mato Grosso com estudantes do ensino médio de escolas públicas do Estado de Mato Grosso, bem como material de apoio para professores da educação básica. A cartilha foi validada e aprovada por especialistas e pelo público-alvo.",0,Cluster 0,16,16_oficinas_ações_meninas_relato
109,2024,A representatividade feminina em um jogo educacional que visa incentivar a aprendizagem de História do Brasil,Julia Oliveira Pessoa (UFABC); Maria Clara Pereira Araujo (UFBA); Alessandra Yukari Fujii (UFABC); Rafaela Vilela da Rocha (UFABC),"Este artigo tem como objetivo discutir e expor a relevância da presença feminina nos jogos eletrônicos, a partir da avaliação de um jogo educacional que visa incentivar a aprendizagem de História do Brasil. Os impactos e demandas do protagonismo feminino nos ambientes digitais e, especificamente, de jogos educativos, são discutidos por meio dos resultados do estudo da temática, desenvolvimento e análise do jogo. A análise foi feita por meio do teste de Bechdel e de uma pesquisa com alunos do ensino básico e superior, além de especialistas e docentes a respeito do mesmo. Os resultados indicam que a representatividade feminina e identificação com as personagens constitui fator positivo na experiência lúdica e educacional.",3,Cluster 3,10,10_jogos_personagens_digitais_desenvolvimento
110,2024,Uma Adaptação do Mobile Device Proficiency Questionnaires para um Público de Idosas da Região Amazônica,Gleiciane A. Fernandes (Unifesspa); Gabriel Silva (Unifesspa); Cecília Ionara P. de Araújo (Unifesspa); Breno Wendel P. de Araújo (Unifesspa); Dhennifer Alves (Unifesspa); Isaque Severino (Unifesspa); Léia S. de Sousa (Unifesspa),"A falta de competências digitais e a pobreza são grandes impeditivos para que as mulheres idosas da região amazônica possam ter acesso à informação, comunicar-se efetivamente e resolver tarefas do dia-a-dia pela internet. Uma universidade federal do interior da Amazônia em parceria com outras instituições tem implementado ações para inclusão digital de mulheres idosas por meio da realização de oficinas, cursos livres e projetos de extensão. Este trabalho apresenta uma adaptação em linguagem simples do Questionário de Proficiência em Dispositivos Móveis (MDPQ) com foco em smartphones, uma ferramenta utilizada nas etapas iniciais do levantamento. São apresentados ainda os resultados da aplicação do referido questionário para um público de mulheres idosas amazônicas e uma análise dos pontos identificados. Os achados demonstram que as mulheres idosas desejam aprender a operar aplicativos móveis de maneira autônoma para se beneficiarem do uso de dispositivos e serviços móveis.",1,Cluster 1,-1,-1_computação_mulheres_meninas_cursos
111,2024,O Uso do Instagram para Divulgação de Projetos nas Área de STEAM: Uma Análise do Perfil @MermãsDigitais,Gabriel Vieira Lima (IFMA); Yasmin Milhomem de Oliveira (IFMA); Lailla Galeno da Silva (IFMA); Vinicius Schineider Januário Viana (IFMA); Aricelma Costa Ibiapina (IFMA); Thiago Paiva Freire (IFMA); Simone Azevedo Bandeira de Melo Aquino (IFMA),"O estudo analisou o perfil no Instagram do Projeto Mermãs Digitais, uma iniciativa do Instituto Federal do Maranhão – Campus Imperatriz voltado para promover a participação feminina em áreas STEAM. Como metodologia, utilizou-se uma abordagem descritiva quantitativa e qualitativa, tendo métricas de publicações e da conta como objeto de análise. Os resultados indicaram que o uso estratégico de Reels como formato de publicação teve um impacto significativo no alcance e engajamento das postagens, indicaram ainda que os posts de entretenimento geraram um maior engajamento dos seguidores em comparação com outras categorias. Por fim, obtiveram-se percepções sobre estratégias digitais para outras iniciativas semelhantes.",1,Cluster 1,24,24_instagram_engajamento_postagens_descritiva
112,2024,Inspiring Women in Technology: Educational Pathways and Impact,Larissa F. Rodrigues Moreira (UFV); Liziane S. Soares (UFV); Adriana Z. Martinhago (UFV),"This paper presents initiatives aimed at fostering female involvement in the realm of computing and endeavoring to inspire more women to pursue careers in these fields. The Meninas++ Project coordinates activities at both the high school and higher education levels, facilitating dialogue between young women and computing professionals, and promoting female role models within the field. Our study demonstrated the significant impact of these activities on inspiring, empowering, and retaining female students in computing. Furthermore, higher education initiatives have fostered engagement among both women and men, promoting inclusivity, entrepreneurship, and collaboration to enhance women’s representation in the computing field.",6,Cluster 6,22,22_and_to_women_computing
113,2024,Análise Perceptiva de Estratégias de Conteúdo do projeto Katie em Mídias Sociais,Barbara de Lima (UFAL); Jucyelle Barros do Nascimento (UFAL); Eliana Silva de Almeida (UFAL); Raquel da Silva Cabral (UFAL),"O Katie é um projeto de extensão da Universidade Federal de Alagoas (UFAL) dedicado a aumentar a representatividade feminina nas áreas de Ciência, Tecnologia, Engenharia e Matemática (STEM). Reconhecendo o Instagram como ferramenta principal para promover ideias e causas, a pesquisa busca identificar estratégias eficazes para ampliar o alcance do grupo nessa plataforma. A metodologia da pesquisa inclui análise descritiva e exploratória de dados, além de métodos estatísticos e ferramentas visuais para uma compreensão mais aprofundada dos padrões de engajamento. Os resultados indicam que, atualmente, as publicações de maior engajamento estão relacionadas a reels de entretenimento associado à tecnologia.",1,Cluster 1,24,24_instagram_engajamento_postagens_descritiva
114,2024,Byjutech: criação de bijuterias sustentáveis com tecnologia,Eliza Matos da Silva (IFB); Amanda Alves dos Santos (IFB); Sara Stela S. T. Martins (IFB); Sylvana Karla S. L. Santos (IFB),"A obsolescência programada gera uma expectativa no aumento do descarte de dispositivos eletrônicos, resultando em resíduos que perduram no meio ambiente por longos períodos. Neste contexto, foi concebida a proposta de criação de bijuterias a partir de peças recuperadas de dispositivos eletrônicos, como teclado e placas de circuito impresso. A ideia do projeto consiste em gerar a reflexão sobre o consumo exagerado de tecnologia. Os resultados refletem uma resposta positiva e encorajadora daqueles que tiveram a oportunidade de interagir com o projeto e construir suas próprias bijuterias, peças únicas e feitas pelos próprios usuários.",1,Cluster 1,-1,-1_computação_mulheres_meninas_cursos
115,2024,Promoção de espaços voltados ao incentivo e formação de meninas e mulheres na área tecnológica: Um relato de experiência das alunas atuantes,Anne de Medeiros (Cefet/RJ); Amanda Amorim (Cefet/RJ); Victoria Cruzado (Cefet/RJ); Izabela da Silva (Cefet/RJ); Ana Viana (Cefet/RJ); Jullie de Aguiar (Cefet/RJ); Diego Brandão (Cefet/RJ); Fabrício Silva (Cefet/RJ); Rafaelli Coutinho (Cefet/RJ),"Este artigo tem por objetivo apresentar um relato de experiências de um projeto desenvolvido em escolas públicas por uma instituição de ensino superior no Brasil. O projeto promove espaços voltados à participação, incentivo e formação de alunos sobre conhecimentos básicos de robótica e programação com o foco para o empoderamento feminino no ensino básico. No artigo são ilustradas as percepções das bolsistas no que tange a importância do seu papel no projeto e os desafios impostos pelo retorno das atividades presenciais após o período pandêmico, como também ações de divulgação e trabalhos futuros. As bolsistas reconheceram a relevância de sua participação e conseguiram superar suas dificuldades, motivando outras mulheres para a área tecnológica.",1,Cluster 1,5,5_skills_soft_escolas_ensino
116,2024,Despertando meninas para a Tecnologia: a Jornada do Código X,Carmem L. S. Surmani (UFVJM / Projeto Social Código X); Lucas G. M. Santos (UFVJM); Mariane G. C. Oliveira (UFVJM); Daniella S. Paiva (Projeto Social Código X); Joanna R. Nogueira (Projeto Social Código X); Tamires M. Rezende (Projeto Social Código X); Joicymara S. Xavier (UFVJM / Projeto Social Código X),"A disparidade de gênero é evidente em áreas como a tecnologia. Para enfrentar esse desafio, surgiu o projeto Código X, que promove o empoderamento e a inclusão digital entre meninas de 9 a 14 anos. Inicialmente com aulas presenciais, o projeto se adaptou à pandemia com o 'Código X em Casa' e a 'Trilha Online'. Em 2022, foram introduzidas novas etapas, como a 'Maratona Tech', seguida pela 'Pré-Trilha' em 2023. Formalmente estabelecido como ONG em 2023, o projeto está desenvolvendo material para replicar sua metodologia, visando ampliar o interesse das alunas na Jornada Código X.",1,Cluster 1,0,0_stem_projeto_feminina_áreas
117,2024,Proposta de um Content Hub como Estratégia para Coleta e Centralização de Dados de Gênero sobre a Liderança de Mulheres na TI,Julia Milioranza Gomes (UFMT); Melissa Maria Souza de Carvalho (UFMT); Bruna Rocha Aguiar (UFMT); Karen da Silva Figueiredo Medeiros Ribeiro (UFMT),"O presente artigo apresenta a criação de um hub de informações como estratégia para a coleta e a centralização de dados de gênero sobre a liderança de mulheres na TI no Brasil. O desenvolvimento do hub foi baseado na elaboração de jornadas de usuárias, buscando compreender melhor seus objetivos e suas formas de interação. A versão preliminar do hub encontra-se disponível para uso e foi inicialmente populada com o resultado de pesquisas e notícias sobre liderança de mulheres na TI, realizadas por meio de uma curadoria acadêmica. Além disso, o hub funciona como landing page para a discussão da importância de dados de gênero e da temática de liderança de mulheres na TI e como interface para a coleta de novos dados sobre o assunto, ao abrigar uma pesquisa voltada para mulheres líderes na área.",4,Cluster 4,7,7_brasileira_brasileiras_negras_computação
118,2024,Gender Gap no Eixo Tecnológico de Informação e Comunicação: o caso do IFSC,Caroline R. V. S. Rauta (IFSC); Maykon Chagas (IFSC); Maria Clara Adão (IFSC); Jaqueline C. Brandão (IFSC),"Este trabalho apresenta um mapeamento da atuação de mulheres docentes nos cursos de Tecnologia de Informação e Comunicação no IFSC. Devido à ausência desses dados na Plataforma Nilo Peçanha, realizou-se uma coleta de dados em fontes institucionais de domínio público, os quais foram sistematizadas em uma planilha. A análise revelou que as mulheres representam apenas 14,56% do quadro docente, atuam majoritariamente nos cursos técnicos, de tipo Integrado. As mulheres com contrato temporário representam percentual maior em relação aos homens. Elas também apresentam, no geral, menor titulação. A invisibilização da ausência de mulheres na docência de TI ainda é um grande problema.",5,Cluster 5,-1,-1_computação_mulheres_meninas_cursos
