id_artigo,ano,titulo,autores,abstract,topic_tfidf,tema_tfidf,topic_bertopic,tema_bertopic
1,2025,Inclusão de Mulheres na Área de Cibersegurança no Brasil,Maristela Holanda (UnB); Adrielly Lima (UnB); Emilly Victoria Bernardes (UnB); Luana Cruz Silva (UnB); Marjorie Mitzi (UnB); Aleteia Araujo (UnB); João Gondim (UnB); Maria Emilia Machado Telles Walter (UnB),"A baixa participação profissional das mulheres em Computação é mais agravada em algumas de suas áreas, como a da cibersegurança. Neste contexto, a partir de um mapeamento da literatura, este artigo apresenta ações e iniciativas feitas no Brasil para a inclusão feminina nessa área. Para isso, foram pesquisados artigos nas bases de dados Scopus, Web of Science e Google Acadêmico e em dois eventos da Sociedade Brasileira de Computação (SBC), o Simpósio Brasileiro em Segurança da Informação e de Sistemas Computacionais (SBSeg) e o Women in Information Technology (WIT). Nessa pesquisa, localizou-se apenas um artigo, que utiliza a cibersegurança em uma atividade de inclusão de mulheres na Computação, e cinco projetos sobre o tema. Assim, constatou-se que há uma carência de informações sobre a atuação das mulheres em cibersegurança no país. Em âmbito mundial, foram encontrados artigos produzidos em países de cinco continentes. A partir dessas informações, foram propostas ações que podem contribuir para a inclusão de mulheres nesta àrea.",4,Cluster 4,-1,-1_computação_mulheres_meninas_cursos
2,2025,"Presença de mulheres na Engenharia: Um estudo sobre Representatividade no CEFET-MG, campus Divinópolis",Marinêz V. de M. Werneck Magalhães (CEFET-MG); Thabatta M. A. de Araújo (CEFET-MG); Alba V. A. Durães (CEFET-MG); Gabriella C. B. C. Dalpra (CEFET-MG),"Este estudo analisou a representatividade de mulheres nos cursos de Engenharia de Computação e Engenharia Mecatrônica do CEFET-MG, campus Divinópolis, entre 2019 e 2024, período em que apenas 17,48% das matrículas foram de mulheres. A pesquisa identificou desafios estruturais, acadêmicos e sociais que impactam sua permanência, como discriminação de gênero, baixa representatividade em cargos de liderança e dificuldades no ambiente acadêmico. A taxa de evasão de mulheres (31,51%) superou a de homens (30,14%), evidenciando essas barreiras. Iniciativas institucionais, como o projeto ”Padawoman”, mostraram-se relevantes para mitigar essas dificuldades, promovendo um ambiente de apoio para 82% das alunas. No entanto, 56% das entrevistadas acreditam que a instituição deve investir mais em políticas de inclusão e suporte específico. Os resultados destacam a necessidade de estratégias institucionais individualizadas, como redes de apoio e programas de conscientização, e a formação de docentes e equipes psicossocial para fortalecer a equidade de gênero. Essas ações são essenciais para a permanência e sucesso das estudantes, além de contribuírem para um ambiente acadêmico mais inclusivo e diversificado na Engenharia.",1,Cluster 1,8,8_preconceito_políticas_dados_homens
3,2025,"Interseccionalidade e Tecnologia: Um Mapeamento Sistemático de Publicações em Português sobre Gênero, Raça e Classe na Participação Feminina",Karolyne Rodrigues (IFCE); Rayane Silva Duarte (IFCE); Ádina Lima (IFCE); Fernanda Ferreira do Nascimento (IFCE); Rogério Lopes Vieira César (IFCE),"O presente estudo consiste em um Mapeamento Sistemático da Literatura que objetivou buscar, analisar e avaliar trabalhos acadêmicos que abordem a interseção de gênero, raça e classe na participação feminina no setor tecnológico. O Mapeamento investiga o quão abragente e crítica os produtos científicos estão tratando a problemática das desigualdades estruturais que limitam a inclusão de mulheres, especialmente negras e de baixa renda, no campo da tecnologia. A pesquisa não apenas destaca as barreiras enfrentadas, mas também busca identificar estratégias de resistência e iniciativas que promovem o empoderamento dessas mulheres.",4,Cluster 4,26,26_dados_abertos_stem_emílias
4,2025,Investigando o Ingresso e a Permanência Feminina no Curso de Ciência da Computação da UESB: Uma Análise Dos Últimos 10 Anos,Lívia Evily de A. Rocha (UESB); Ana Carolina X. Castro (UESB); Camille R. Costa (UESB); Lis L. Sousa (UESB); Maria Luísa G. Gonzalez (UESB),"Este artigo analisa a participação feminina no curso de Ciência da Computação da UESB entre 2014 e 2024, com foco no ingresso e permanência das alunas. A pesquisa adota uma abordagem quali-quantitativa, combinando dados institucionais sobre matrículas e evasão com fatores socioculturais e institucionais. O objetivo é compreender a evolução das taxas de ingresso, comparar a evasão entre gêneros e verificar se as tendências da instituição refletem o cenário de outras universidades brasileiras, visando contribuir para políticas de equidade de gênero.",5,Cluster 5,3,3_brasil_feminina_cursos_superior
5,2025,Conectando Mulheres à STEM: Um Panorama dos Eventos de Empoderamento Feminino na Tecnologia da Informação,Ana Clara Ribeiro Rodrigues da Cunha (IFTM); Lídia Bononi Paiva Tomaz (IFTM),"A baixa representatividade feminina na Tecnologia da Informação resulta de fatores sociais e culturais que historicamente afastaram as mulheres das carreiras tecnológicas. No Brasil, essa desigualdade é evidente na formação acadêmica e no mercado de trabalho, refletindo-se nas áreas de Ciência, Tecnologia, Engenharia e Matemática (STEM). Entre as iniciativas para reverter esse cenário, destacam-se os eventos voltados ao empoderamento feminino, que promovem trocas de experiências, redes de apoio e debates sobre equidade de gênero. Neste sentido, este trabalho analisou esse tipo de evento no âmbito nacional. Os resultados indicaram predominância de iniciativas organizadas por instituições acadêmicas e comunidades locais.",4,Cluster 4,3,3_brasil_feminina_cursos_superior
6,2025,Mulheres na Integração de Produtos do Instituto Eldorado: Quais suas Motivações e Expectativas na Carreira?,Ariel Luane Bentes (IPE); Anna Beatriz Marques (UFC); Adriana Damian (IPE),"Na literatura, diversos estudos abordam a escassez de mulheres em cursos de graduação na área de tecnologia, um fenômeno que pode estar diretamente ligado à baixa representatividade feminina no mercado de trabalho. No entanto, em relação às mulheres que atuam no mercado de trabalho, quais as suas principais motivações para permanecer na área de tecnologia? Quais suas expectativas sobre a carreira? Dado esse contexto, esse artigo apresenta um estudo exploratório que investigou mulheres que atuam no desenvolvimento de software na área de Integração de Produtos do Instituto de Pesquisas Eldorado. Dentre os resultados obtidos, notou-se que a valorização profissional e representatividade feminina as motivam a permanecer na área. Os resultados obtidos nessa pesquisa podem colaborar com pesquisas que visam compreender aspectos que estimulam as mulheres a permanecerem no mercado de trabalho e também podem contribuir com o engajamento de mais mulheres na área de tecnologia.",5,Cluster 5,11,11_mulheres_tecnologia_cientista_escolhas
7,2025,A Síndrome do Impostor entre estudantes de tecnologia na Universidade Federal do Amazonas,Fernanda Alice F. Duarte (UFAM); Ana Carolina Oran (UFAM); Anna Beatriz Marques (UFC),"A Síndrome do Impostor é um fenômeno que afeta a autoconfiança e o desempenho de uma pessoa, sendo comum em áreas competitivas, como a tecnologia. Este estudo investiga sua prevalência entre 101 estudantes de Engenharia de Software e Ciência da Computação da Universidade Federal do Amazonas, analisando se as alunas enfrentam essa condição com maior frequência. A pesquisa utilizou um questionário que inclui a Escala Clance do Fenômeno do Impostor (CIPS) para avaliar a intensidade da síndrome e a autopercepção dos participantes. Os resultados mostram que uma parcela significativa dos respondentes é afetada, sendo a maioria formada por mulheres, o que destaca a necessidade de medidas de suporte específicas para esse grupo.",5,Cluster 5,6,6_pesquisa_egressas_estudo_viés
8,2025,Desafios e Perspectivas da Participação Feminina na Tecnologia: Um Estudo sobre o Programa OxeTech,Lais S. Almeida (UFAL); Geymerson S. Ramos (UFAL); Raquel S. Cabral (UFAL); Eliana S. Almeida (UFAL),"Este estudo analisa o alcance e a presença feminina no programa OxeTech, uma iniciativa estadual de capacitação em Tecnologia da Informação. A partir da aplicação de métodos estatísticos sobre mais de 8500 registros anônimos, identificou-se uma associação significativa entre gênero e categoria da vaga de trabalho, com sub-representação feminina em áreas como Desenvolvimento & TI, e sobre-representação nas categorias Marketing & Social Media, Criação & Design. Além disso, verificou-se uma maior adesão de mulheres a cursos introdutórios, contrastando com a predominância masculina em formações mais avançadas. Esses achados evidenciam a necessidade de políticas públicas voltadas à formação de base e ao engajamento feminino em áreas de maior complexidade técnica e liderança, ampliando sua atuação para além dos papéis de apoio.",4,Cluster 4,21,21_identificou_fatores_desigualdade_traço
9,2025,Bridging the Gap: A Data-Driven Analysis of How Traditional Software Engineering Productivity Metrics Overlook Women’s Performance,Lorena M. V. Seabra (CESAR School); Pamela T. L. Bezerra (CESAR School),"A produtividade em engenharia de software é geralmente medida por métricas como linhas de código, commits e tempo de execução de tarefas, mas essas métricas ignoram fatores subjetivos importantes, como colaboração e bem-estar. Isso afeta especialmente mulheres, que enfrentam vieses de gênero, microagressões e dupla jornada. Com base em uma pesquisa com 85 engenheiras de software no Brasil, este estudo mostra como esses desafios impactam o desempenho feminino e aponta que as métricas tradicionais não valorizam adequadamente suas contribuições. Os resultados reforçam a necessidade de um modelo mais inclusivo que reconheça tanto aspectos técnicos quanto não técnicos.",5,Cluster 5,25,25_prêmios_métricas_ações_concentração
10,2025,O que é Liderança Acadêmica de Mulheres em STEM? Uma Abordagem Conceitual,Leihge Roselle Rondon Pereira (UFMT); Cristiano Maciel (UFMT); Indira Rita Guzman (CalPoly),"Este estudo apresenta uma Revisão Sistemática de Literatura, que analisa artigos acadêmicos e artigos em anais de congressos que abordam a liderança acadêmica de mulheres nas áreas de Ciência, Tecnologia, Engenharia e Matemática (STEM). Por meio do levantamento de estudos, em idioma português, espanhol e inglês, identificamos dez categorizações sobre liderança acadêmica de mulheres em STEM. A partir das conceitualizações foi possível definir aspectos para esse modelo de liderança, sendo eles administrativo, científico e cultural. Tais aspectos são considerados relevantes para promover a equidade de gênero e inclusão na liderança acadêmica STEM.",4,Cluster 4,6,6_pesquisa_egressas_estudo_viés
11,2025,Mulheres em Cargo de Liderança em Tecnologia: Uma Análise Fenomenológica,Safyre A. Farao (UFSC); Andréa Sabedra Bordin (UFSC),"Existe uma grande desigualdade de gênero em cargos de gestão na área de Tecnologias da Informação. O presente estudo possui o intuito de entender quais as trajetórias percorridas por mulheres que ocupam cargos de gestão e assumem papéis de liderança em TI, incluindo os desafios, as estratégias de superação e as motivações para buscarem essas posições. A pesquisa adotou uma abordagem qualitativa fenomenológica, com dados coletados por meio de cinco entrevistas, a partir dos quais descreveu-se a essência das experiências vivenciadas por essas mulheres. Aspectos em comum sobre a trajetória percorrida até a posição de liderança, os desafios enfrentados antes e durante a liderança, assim como as estratégias de superação são apresentados. Os resultados encontrados podem ser úteis para o desenvolvimento de politicas que impulsionem e retenham mais mulheres em posições de liderança.",4,Cluster 4,4,4_the_tecnologia_mulheres_informática
12,2025,Voices in Code: estudo de caso acerca da trajetória das mulheres em um curso de Ciência da Computação,Dyelle H. N. Almeida (UERN); Allany S. Rodrigues (UERN); Ingrid G. C. Lira (UERN); Lyziane da S. Nogueira (UERN); Sebastião E. A. Filho (UERN); Ceres G. B. Morais (UERN),"Este artigo apresenta uma análise da trajetória das mulheres em um Curso de Ciência da Computação. Abrangendo uma variedade de experiências, desafios e perspectivas, busca-se compreender as barreiras enfrentadas por elas ao integrar uma faculdade historicamente dominada por estudantes do sexo masculino. Para coletar estas informações, foram aplicados questionários com cerca de 44% do total de egressas, contendo perguntas sobre sua motivação para ingressar no Curso, dificuldades no percurso acadêmico e desafios no cenário profissional. Os resultados apontam que, além do baixo número de ingressantes, elas enfrentaram, e ainda enfrentam, problemas relacionados ao alto índice de evasão, preconceito, discriminação e falta de políticas de apoio. Isto mostra os desafios existentes com relação ao gênero na computação e na formação de uma sociedade mais igualitária e inclusiva.",5,Cluster 5,8,8_preconceito_políticas_dados_homens
13,2025,Hackathon 360: Estimulando Meninas na Computação em Projetos de Robótica Social para Educação,Tainá G. Souza (UFF); Marcia Flores (UFF); Nathália Monteiro (UFF); Estéfani Eller (UFF); Sandy Cabral (UFF); Adelmo Lima (UFF); Aline P. Nascimento (UFF); Débora C. Muchaluat-Saade (UFF); Luciana C. C. Salgado (UFF),"Este artigo investiga como a participação de estudantes mulheres em projetos com robótica social para criação de soluções inovadoras para problemas reais pode estimular meninas a aprender mais sobre a área das TICs rompendo estereótipos. O estudo foi realizado por meio de um hackathon e a pesquisa adotou uma abordagem qualitativa e exploratória, com codificação dos dados das alunas, mentoras e professoras da educação básica. Os resultados indicam sete aspectos que foram estimulados: percepção da utilidade do trabalho e impacto social, autoeficácia e confiança, apropriação das atividades, satisfação na realização das atividades, superação de desafios, senso de pertencimento e trabalho colaborativo.",1,Cluster 1,5,5_skills_soft_escolas_ensino
14,2025,Iniciativas de ensino de programação para mulheres: Um mapeamento sistemático,Sthefany Ferreira (UFAC); Gabriela Santos (UFAC); Victoria Cavalcante (UFAC); Alessandreia Oliveira (UFJF); Catarina Costa (UFAC),"O crescente avanço da Tecnologia aliada à programação permeia a escolha por carreiras na área de Ciências Exatas e suas Tecnologias. Entretanto, há uma baixa representatividade feminina na área de Tecnologia e em cursos de computação. Iniciativas como o Programa Meninas Digitais (PMD), ligado à Sociedade Brasileira de Computação (SBC), incentivam a participação e permanência de mulheres na computação e mudar essa realidade. Nesse sentido, este artigo buscou mapear as ações voltadas para o ensino de programação através de um Mapeamento Sistemático. Como resultado, 75 trabalhos foram analisados e foi identificado que as ações se concentram em oficinas e cursos e que as linguagens mais adotadas são Scratch e Python.",2,Cluster 2,25,25_prêmios_métricas_ações_concentração
15,2025,Trajetória feminina nos últimos 10 anos em curso de Sistemas de Informação situado no interior de pequeno estado do Nordeste do Brasil,Mai-Ly V. A. S. Faro (UFS); Alessandra C. N. Lima (UFS); Raphael P. de Oliveira (UFS); Fernanda M. B. Souza (UFS); Gabriella N. dos S. da Silva (UFS),"Por métodos quantitativos e qualitativos, a pesquisa investigou a trajetória feminina no curso de Sistemas de Informação do campus de Itabaiana, interior de pequeno estado do Nordeste do Brasil nos últimos 10 anos. A análise quantitativa revelou baixa representatividade feminina, sem diferenças significativas no desempenho acadêmico entre os gêneros. Já a análise qualitativa identificou que desafios como necessidade de trabalhar, falta de empatia e flexibilidade dos professores, estereótipos de gênero e fatores emocionais são dificultadores e contribuem para a evasão. Contudo, a alta empregabilidade em TI, trabalho remoto, interesse por tecnologia e redes de apoio são apontados como atrativos e motivadores para a permanência das alunas.",5,Cluster 5,3,3_brasil_feminina_cursos_superior
16,2025,Mulheres na Computação: uma análise baseada em Teoria Fundamentada nos Dados para o curso de Sistemas de Informação do IFS/Campus Lagarto,Larissa de G. Barreto (IFS); Catuxe V. de S. Oliveira (IFS); Luiz Diego V. Santos (UEFS); Jislane S. S. de Menezes (IFS); Vana Hilma V. Carvalho (IFS); Cristiane O. de Santana (IFS),"O artigo traz uma investigação sobre a presença de mulheres na Computação, campo marcado pela desigualdade de gênero, aplicando a Teoria Fundamentada nos Dados. A pesquisa coletou dados através de entrevistas semiestruturadas junto às egressas do curso de Sistemas de Informação do IFS, campus Lagarto, para identificar barreiras enfrentadas na formação e na carreira. Os resultados revelam que aspectos culturais, a falta de incentivo desde a infância e um ambiente predominantemente masculino desestimulam a sua participação, destacando a necessidade de um local de aprendizado inclusivo, sugerindo iniciativas como programa de mentoria e promoção de modelos femininos para estimular a presença no setor tecnológico.",4,Cluster 4,21,21_identificou_fatores_desigualdade_traço
17,2025,O Papel da Mulher nos Jogos Digitais: Um Mapeamento Sistemático da Literatura,Mayara L. de F. Neves (UFPR); Clausius D. G. Reis (UFPR); Rachel C. D. Reis (UFPR),"Atualmente, os jogos digitais são uma das formas de entretenimento mais populares. No entanto, observa-se a falta de estudos que ofereçam uma visão mais abrangente sobre a atuação feminina na indústria dos jogos. Logo, este estudo realiza um mapeamento sistemático da literatura, analisando 81 estudos relevantes. A pesquisa revela que a maioria dos estudos se concentra nas experiências das mulheres como jogadoras e personagens, enquanto sua presença na criação de jogos e participação de eventos é pouco explorada. Os resultados indicam que, apesar do aumento da participação feminina no setor, ainda persistem desafios, como ambientes hostis em jogos online, estereótipos na construção de personagens e a baixa inclusão de mulheres.",3,Cluster 3,10,10_jogos_personagens_digitais_desenvolvimento
18,2025,Um Panorama da Presença Feminina nos Programas de Pós-Graduação em Ciência da Computação Brasileiros - Um Estudo Bibliométrico –,Rosane Teles Lins Castilho (UFRJ); Fabio Castro Gouveia (UFRJ),"A ciência continua a sub-representar as mulheres em todos os níveis acadêmicos nos dias de hoje. Isto aplica-se também à sua representação nos departamentos de ciência da computação mundo afora, onde estudos recentes mostram que mulheres representam entre 20 e 24% dos corpos docentes. O presente estudo bibliométrico procura preencher parte da lacuna de análises sobre a representação feminina, produção acadêmica (publicações) e áreas de pesquisa da Ciência da Computação brasileira, através das docentes vinculadas aos programas de pós-graduação em Ciência da Computação nota 7, na avaliação da CAPES, dos quadriênios 2013-2016 e 2017-2020. Os resultados revelam semelhanças aos do nível internacional",5,Cluster 5,-1,-1_computação_mulheres_meninas_cursos
19,2025,Desafios e Motivações de Mulheres na Computação - Análise de Entrevistas de um Podcast,Tainara Silva Novaes (UTFPR); Larissa Behrens Soares (UTFPR); Adolfo Neto (UTFPR); Mariangela Setti (UTFPR); Maria Claudia Figueiredo Pereira Emer (UTFPR),"A presença feminina ainda é significativamente menor que a masculina nas áreas de Ciência, Tecnologia, Engenharia e Matemática (STEM), refletindo uma desigualdade de gênero persistente nesses ambientes. O Projeto Emílias tem realizado ações para incentivar a presença de mulheres na computação. Este estudo analisa entrevistas do Emílias Podcast para identificar desafios enfrentados e fatores que podem motivar meninas a atuarem nessa área. O objetivo do estudo é ampliar o debate sobre equidade de gênero e destacar a importância de iniciativas de inclusão. O método foi baseado na Teoria Fundamentada Sociotécnica. Os resultados apontam diversos preconceitos e a relevância de redes de apoio para a permanência feminina na área.",4,Cluster 4,26,26_dados_abertos_stem_emílias
20,2025,Redes Sociais na Divulgação de uma Iniciativa por e para Mulheres na Computação,Heloisa Benedet Mendes (UFPR); Mayara Lessnau de Figueiredo Neves (UFPR); Thalita Maria do Nascimento (UFPR); Barbara Reis dos Santos (UFPR); Sofia Wamser Lima (UFPR); Clausius Duque Gonçalves Reis (UFPR); Rachel Carlos Duque Reis (UFPR),"As redes sociais conectam bilhões de pessoas, mas seu uso na educação ainda é limitado. Diante deste cenário, este estudo analisa o impacto do uso dessas plataformas na promoção de uma iniciativa acadêmica voltada para atrair e apoiar mulheres na área de Computação. Para isso, a pesquisa foi dividida em duas partes: (1) análise dos vídeos publicados no Instagram e TikTok da iniciativa concat(Gurias) e (2) pesquisa sobre a influência desses materiais na escolha dos cursos de computação da UFPR. Os resultados evidenciam a relevância das redes sociais tanto na divulgação da iniciativa concat(Gurias) voltada para a inclusão feminina, quanto na atração de mulheres para a computação.",4,Cluster 4,24,24_instagram_engajamento_postagens_descritiva
21,2025,Avaliação de Desempenho por Sexo Biológico nos Cursos de Ciência da Computação e Engenharia de Software,Sofia de C. Sato (UFAM); André Y. S. Okimoto (UFAM); Yago de J. B. Lobato (UFAM); João C. N. Nogueira (UFAM); Guilherme L. de S. e Souza (UFAM); Ana L. M. dos Santos (UFAM); Leandro S. G. de Carvalho (UFAM); Tanara Lauschner (UFAM); Fabíola G. Nakamura (UFAM); Eduardo F. Nakamura (UFAM),"O pequeno percentual de mulheres em cursos de computação questiona o desempenho do grupo feminino no ambiente acadêmico. Visando avaliar se o sexo dos estudantes influencia a jornada estudantil, foi proposta uma pesquisa utilizando indicadores educacionais e dados dos cursos de Ciência da Computação (CC) e Engenharia de Software (ES) da Universidade Federal do Amazonas. Os resultados demonstram que as mulheres acompanham o desempenho dos homens e, em alguns casos, os superam. Por exemplo, a mediana da taxa de conclusão feminina é 4,2 pontos percentuais a mais que a masculina para CC e 13,3 para ES. Isso indica que o sexo feminino não é inferior em desempenho comparado ao masculino e é igualmente capacitado para os cursos e suas complexidades.",5,Cluster 5,20,20_desempenho_feminino_meninos_es
22,2025,Análise do perfil das estudantes do curso de Sistemas de Informação do IFS/Campus Lagarto: um primeiro passo para a inclusão e permanência das mulheres na área de tecnologia,Larissa de G. Barreto (IFS); Catuxe V. de S. Oliveira (IFS); Luiz Diego V. Santos (UEFS); Jislane S. S. de Menezes (IFS); Vana H. V. Carvalho (IFS); Cristiane O. de Santana (IFS),"Este artigo analisa o perfil das estudantes do curso de Sistemas de Informação do Instituto Federal de Sergipe, motivado pela importância de compreender suas características para promover sua inclusão e permanência na área de tecnologia. Utilizando dados extraídos de relatórios gerenciais e questionários aplicados as alunas, o estudo investigou aspectos como idade, ocupação, vida acadêmica e percepções sobre a representatividade feminina. Os resultados revelam que, embora a maioria das alunas esteja na faixa etária de 21 a 25 anos, um alto percentual enfrentou reprovações em disciplinas. A falta de referências femininas sugere uma oportunidade para o desenvolvimento de políticas institucionais que estimulem um ambiente mais acolhedor e inclusivo na educação superior.",5,Cluster 5,8,8_preconceito_políticas_dados_homens
23,2025,As Causas Sistêmicas por trás do Viés de Gênero em IA: Um Mapeamento Sistemático da Literatura,Rafaela Toledo Dolabella (UFV); Thais Regina de Moura Braga Silva (UFV); Gláucia Braga e Silva (UFV); Estela Miranda Batista (UFV),"A Inteligência Artificial (IA) tem transformado o cotidiano das pessoas, impactando decisões críticas em diversas áreas, como saúde, segurança e mercado de trabalho. Contudo, seu uso levanta preocupações éticas e sociais, especialmente no que diz respeito aos vieses presentes em sistemas de IA. Este trabalho aborda especificamente o viés de gênero, investigando as causas sistêmicas (dados, viés algorítmico e comportamento do usuário) por trás desse problema por meio de um Mapeamento Sistemático da Literatura (MSL). A pesquisa analisou 176 estudos provenientes das bases IEEE Xplore, ACM Digital Library e Scopus, dos quais 12 foram considerados relevantes para o objetivo do trabalho. A seleção foi orientada por critérios de inclusão e exclusão. A análise identificou que a maioria dos artigos encontrados aborda o uso de dados enviesados como causa do viés de gênero, seguido do viés algorítmico, encontrado em metade dos estudos. O comportamento do usuário ainda é pouco explorado, aparecendo como foco principal em apenas um trabalho.",4,Cluster 4,6,6_pesquisa_egressas_estudo_viés
