edicao,categoria,titulo,autores,abstract,url
2025: Anais do XIX Women in Information Technology,Artigos de Pesquisa,Inclusão de Mulheres na Área de Cibersegurança no Brasil,Maristela Holanda (UnB); Adrielly Lima (UnB); Emilly Victoria Bernardes (UnB); Luana Cruz Silva (UnB); Marjorie Mitzi (UnB); Aleteia Araujo (UnB); João Gondim (UnB); Maria Emilia Machado Telles Walter (UnB),"A baixa participação profissional das mulheres em Computação é mais agravada em algumas de suas áreas, como a da cibersegurança. Neste contexto, a partir de um mapeamento da literatura, este artigo apresenta ações e iniciativas feitas no Brasil para a inclusão feminina nessa área. Para isso, foram pesquisados artigos nas bases de dados Scopus, Web of Science e Google Acadêmico e em dois eventos da Sociedade Brasileira de Computação (SBC), o Simpósio Brasileiro em Segurança da Informação e de Sistemas Computacionais (SBSeg) e o Women in Information Technology (WIT). Nessa pesquisa, localizou-se apenas um artigo, que utiliza a cibersegurança em uma atividade de inclusão de mulheres na Computação, e cinco projetos sobre o tema. Assim, constatou-se que há uma carência de informações sobre a atuação das mulheres em cibersegurança no país. Em âmbito mundial, foram encontrados artigos produzidos em países de cinco continentes. A partir dessas informações, foram propostas ações que podem contribuir para a inclusão de mulheres nesta àrea.",https://sol.sbc.org.br/index.php/wit/article/view/35966
2025: Anais do XIX Women in Information Technology,Artigos de Pesquisa,"Presença de mulheres na Engenharia: Um estudo sobre Representatividade no CEFET-MG, campus Divinópolis",Marinêz V. de M. Werneck Magalhães (CEFET-MG); Thabatta M. A. de Araújo (CEFET-MG); Alba V. A. Durães (CEFET-MG); Gabriella C. B. C. Dalpra (CEFET-MG),,https://sol.sbc.org.br/index.php/wit/article/view/35967
2025: Anais do XIX Women in Information Technology,Artigos de Pesquisa,"Interseccionalidade e Tecnologia: Um Mapeamento Sistemático de Publicações em Português sobre Gênero, Raça e Classe na Participação Feminina",Karolyne Rodrigues (IFCE); Rayane Silva Duarte (IFCE); Ádina Lima (IFCE); Fernanda Ferreira do Nascimento (IFCE); Rogério Lopes Vieira César (IFCE),,https://sol.sbc.org.br/index.php/wit/article/view/35968
2025: Anais do XIX Women in Information Technology,Artigos de Pesquisa,Investigando o Ingresso e a Permanência Feminina no Curso de Ciência da Computação da UESB: Uma Análise Dos Últimos 10 Anos,Lívia Evily de A. Rocha (UESB); Ana Carolina X. Castro (UESB); Camille R. Costa (UESB); Lis L. Sousa (UESB); Maria Luísa G. Gonzalez (UESB),,https://sol.sbc.org.br/index.php/wit/article/view/35969
2025: Anais do XIX Women in Information Technology,Artigos de Pesquisa,Conectando Mulheres à STEM: Um Panorama dos Eventos de Empoderamento Feminino na Tecnologia da Informação,Ana Clara Ribeiro Rodrigues da Cunha (IFTM); Lídia Bononi Paiva Tomaz (IFTM),,https://sol.sbc.org.br/index.php/wit/article/view/35970
2025: Anais do XIX Women in Information Technology,Artigos de Pesquisa,Mulheres na Integração de Produtos do Instituto Eldorado: Quais suas Motivações e Expectativas na Carreira?,Ariel Luane Bentes (IPE); Anna Beatriz Marques (UFC); Adriana Damian (IPE),,https://sol.sbc.org.br/index.php/wit/article/view/35971
2025: Anais do XIX Women in Information Technology,Artigos de Pesquisa,A Síndrome do Impostor entre estudantes de tecnologia na Universidade Federal do Amazonas,Fernanda Alice F. Duarte (UFAM); Ana Carolina Oran (UFAM); Anna Beatriz Marques (UFC),"A Síndrome do Impostor é um fenômeno que afeta a autoconfiança e o desempenho de uma pessoa, sendo comum em áreas competitivas, como a tecnologia. Este estudo investiga sua prevalência entre 101 estudantes de Engenharia de Software e Ciência da Computação da Universidade Federal do Amazonas, analisando se as alunas enfrentam essa condição com maior frequência. A pesquisa utilizou um questionário que inclui a Escala Clance do Fenômeno do Impostor (CIPS) para avaliar a intensidade da síndrome e a autopercepção dos participantes. Os resultados mostram que uma parcela significativa dos respondentes é afetada, sendo a maioria formada por mulheres, o que destaca a necessidade de medidas de suporte específicas para esse grupo.",https://sol.sbc.org.br/index.php/wit/article/view/35972
2025: Anais do XIX Women in Information Technology,Artigos de Pesquisa,Desafios e Perspectivas da Participação Feminina na Tecnologia: Um Estudo sobre o Programa OxeTech,Lais S. Almeida (UFAL); Geymerson S. Ramos (UFAL); Raquel S. Cabral (UFAL); Eliana S. Almeida (UFAL),,https://sol.sbc.org.br/index.php/wit/article/view/35973
2025: Anais do XIX Women in Information Technology,Artigos de Pesquisa,Bridging the Gap: A Data-Driven Analysis of How Traditional Software Engineering Productivity Metrics Overlook Women’s Performance,Lorena M. V. Seabra (CESAR School); Pamela T. L. Bezerra (CESAR School),,https://sol.sbc.org.br/index.php/wit/article/view/35974
2025: Anais do XIX Women in Information Technology,Artigos de Pesquisa,O que é Liderança Acadêmica de Mulheres em STEM? Uma Abordagem Conceitual,Leihge Roselle Rondon Pereira (UFMT); Cristiano Maciel (UFMT); Indira Rita Guzman (CalPoly),,https://sol.sbc.org.br/index.php/wit/article/view/35975
2025: Anais do XIX Women in Information Technology,Artigos de Pesquisa,Mulheres em Cargo de Liderança em Tecnologia: Uma Análise Fenomenológica,Safyre A. Farao (UFSC); Andréa Sabedra Bordin (UFSC),,https://sol.sbc.org.br/index.php/wit/article/view/35976
2025: Anais do XIX Women in Information Technology,Artigos de Pesquisa,Voices in Code: estudo de caso acerca da trajetória das mulheres em um curso de Ciência da Computação,Dyelle H. N. Almeida (UERN); Allany S. Rodrigues (UERN); Ingrid G. C. Lira (UERN); Lyziane da S. Nogueira (UERN); Sebastião E. A. Filho (UERN); Ceres G. B. Morais (UERN),,https://sol.sbc.org.br/index.php/wit/article/view/35977
2025: Anais do XIX Women in Information Technology,Artigos de Pesquisa,Hackathon 360: Estimulando Meninas na Computação em Projetos de Robótica Social para Educação,Tainá G. Souza (UFF); Marcia Flores (UFF); Nathália Monteiro (UFF); Estéfani Eller (UFF); Sandy Cabral (UFF); Adelmo Lima (UFF); Aline P. Nascimento (UFF); Débora C. Muchaluat-Saade (UFF); Luciana C. C. Salgado (UFF),,https://sol.sbc.org.br/index.php/wit/article/view/35978
2025: Anais do XIX Women in Information Technology,Artigos de Pesquisa,Iniciativas de ensino de programação para mulheres: Um mapeamento sistemático,Sthefany Ferreira (UFAC); Gabriela Santos (UFAC); Victoria Cavalcante (UFAC); Alessandreia Oliveira (UFJF); Catarina Costa (UFAC),,https://sol.sbc.org.br/index.php/wit/article/view/35979
2025: Anais do XIX Women in Information Technology,Artigos de Pesquisa,Trajetória feminina nos últimos 10 anos em curso de Sistemas de Informação situado no interior de pequeno estado do Nordeste do Brasil,Mai-Ly V. A. S. Faro (UFS); Alessandra C. N. Lima (UFS); Raphael P. de Oliveira (UFS); Fernanda M. B. Souza (UFS); Gabriella N. dos S. da Silva (UFS),,https://sol.sbc.org.br/index.php/wit/article/view/35980
2025: Anais do XIX Women in Information Technology,Artigos de Pesquisa,Mulheres na Computação: uma análise baseada em Teoria Fundamentada nos Dados para o curso de Sistemas de Informação do IFS/Campus Lagarto,Larissa de G. Barreto (IFS); Catuxe V. de S. Oliveira (IFS); Luiz Diego V. Santos (UEFS); Jislane S. S. de Menezes (IFS); Vana Hilma V. Carvalho (IFS); Cristiane O. de Santana (IFS),,https://sol.sbc.org.br/index.php/wit/article/view/35981
2025: Anais do XIX Women in Information Technology,Artigos de Pesquisa,O Papel da Mulher nos Jogos Digitais: Um Mapeamento Sistemático da Literatura,Mayara L. de F. Neves (UFPR); Clausius D. G. Reis (UFPR); Rachel C. D. Reis (UFPR),,https://sol.sbc.org.br/index.php/wit/article/view/35982
2025: Anais do XIX Women in Information Technology,Artigos de Pesquisa,Um Panorama da Presença Feminina nos Programas de Pós-Graduação em Ciência da Computação Brasileiros - Um Estudo Bibliométrico –,Rosane Teles Lins Castilho (UFRJ); Fabio Castro Gouveia (UFRJ),"A ciência continua a sub-representar as mulheres em todos os níveis acadêmicos nos dias de hoje. Isto aplica-se também à sua representação nos departamentos de ciência da computação mundo afora, onde estudos recentes mostram que mulheres representam entre 20 e 24% dos corpos docentes. O presente estudo bibliométrico procura preencher parte da lacuna de análises sobre a representação feminina, produção acadêmica (publicações) e áreas de pesquisa da Ciência da Computação brasileira, através das docentes vinculadas aos programas de pós-graduação em Ciência da Computação nota 7, na avaliação da CAPES, dos quadriênios 2013-2016 e 2017-2020. Os resultados revelam semelhanças aos do nível internacional",https://sol.sbc.org.br/index.php/wit/article/view/35983
2025: Anais do XIX Women in Information Technology,Artigos de Pesquisa,Desafios e Motivações de Mulheres na Computação - Análise de Entrevistas de um Podcast,Tainara Silva Novaes (UTFPR); Larissa Behrens Soares (UTFPR); Adolfo Neto (UTFPR); Mariangela Setti (UTFPR); Maria Claudia Figueiredo Pereira Emer (UTFPR),,https://sol.sbc.org.br/index.php/wit/article/view/35984
2025: Anais do XIX Women in Information Technology,Artigos de Pesquisa,Redes Sociais na Divulgação de uma Iniciativa por e para Mulheres na Computação,Heloisa Benedet Mendes (UFPR); Mayara Lessnau de Figueiredo Neves (UFPR); Thalita Maria do Nascimento (UFPR); Barbara Reis dos Santos (UFPR); Sofia Wamser Lima (UFPR); Clausius Duque Gonçalves Reis (UFPR); Rachel Carlos Duque Reis (UFPR),,https://sol.sbc.org.br/index.php/wit/article/view/35985
2025: Anais do XIX Women in Information Technology,Artigos de Pesquisa,Avaliação de Desempenho por Sexo Biológico nos Cursos de Ciência da Computação e Engenharia de Software,Sofia de C. Sato (UFAM); André Y. S. Okimoto (UFAM); Yago de J. B. Lobato (UFAM); João C. N. Nogueira (UFAM); Guilherme L. de S. e Souza (UFAM); Ana L. M. dos Santos (UFAM); Leandro S. G. de Carvalho (UFAM); Tanara Lauschner (UFAM); Fabíola G. Nakamura (UFAM); Eduardo F. Nakamura (UFAM),,https://sol.sbc.org.br/index.php/wit/article/view/35986
2025: Anais do XIX Women in Information Technology,Artigos de Pesquisa,Análise do perfil das estudantes do curso de Sistemas de Informação do IFS/Campus Lagarto: um primeiro passo para a inclusão e permanência das mulheres na área de tecnologia,Larissa de G. Barreto (IFS); Catuxe V. de S. Oliveira (IFS); Luiz Diego V. Santos (UEFS); Jislane S. S. de Menezes (IFS); Vana H. V. Carvalho (IFS); Cristiane O. de Santana (IFS),,https://sol.sbc.org.br/index.php/wit/article/view/35987
2025: Anais do XIX Women in Information Technology,Artigos de Pesquisa,As Causas Sistêmicas por trás do Viés de Gênero em IA: Um Mapeamento Sistemático da Literatura,Rafaela Toledo Dolabella (UFV); Thais Regina de Moura Braga Silva (UFV); Gláucia Braga e Silva (UFV); Estela Miranda Batista (UFV),,https://sol.sbc.org.br/index.php/wit/article/view/35988
2025: Anais do XIX Women in Information Technology,Artigos de Pesquisa,Entendendo melhor o processo de decisão para ingressar em cursos de tecnologia na Universidade Federal da Paraíba,Raquel Vigolvino Lopes (UFPB); Renata Viegas de Figueiredo (UFPB); Maria Gabriella Freire F. S. de Oliveira (UFPB); Maria Victoria M. de Araujo (UFPB); Dayanny Soares (UFPB),,https://sol.sbc.org.br/index.php/wit/article/view/35989
2025: Anais do XIX Women in Information Technology,Artigos de Pesquisa,Avaliação Retrospectiva da Experiência de uma Coorte de Egressas de um Curso de Introdução à Programação para Alunas do Ensino Médio e Concluintes,Juliana Martins Leoncio Eusebio (USP); Maria da Graça Campos Pimentel (USP),,https://sol.sbc.org.br/index.php/wit/article/view/35990
2025: Anais do XIX Women in Information Technology,Artigos de Pesquisa,Análise da Participação Feminina nos Cursos de Nível Superior da área de Computação do IFPE,Ana Carolina Barbosa dos Santos (IFPE); Ellen Patrícia Lopes de Santana (IFPE); Viviane Cristina Oliveira Aureliano (IFPE),,https://sol.sbc.org.br/index.php/wit/article/view/35991
2025: Anais do XIX Women in Information Technology,Artigos de Pesquisa,Mulheres na Ciência de Dados: Três Anos de Desafios e Avanços,Jullie Belmonte (CEFET-RJ); Kele Belloze (CEFET-RJ); Carmen Lucia A. Queiroz (CEFET-RJ); Mayara M. Omai (CEFET-RJ); Fabricio Lopes e Silva (CEFET-RJ); Rafaelli Coutinho (CEFET-RJ); Diego Brandão (CEFET-RJ),,https://sol.sbc.org.br/index.php/wit/article/view/35992
2025: Anais do XIX Women in Information Technology,Artigos de Pesquisa,Oficinas de Pensamento Computacional: explorando a experiência de estudantes sob a perspectiva de gênero,Sofia Bento Desidério (UFC); Marina Azevedo (UFC); Mayronn Gomes Viana (UFC); Aline Nunes (UFC); Maria Julia Siqueira (UFC); Ylana Torres (UFC); Jayne Cristina (UFC); Julia Barros (UFC); Valéria da Silva Pinheiro (UFC); Anna Beatriz Marques (UFC),,https://sol.sbc.org.br/index.php/wit/article/view/35993
2025: Anais do XIX Women in Information Technology,Artigos de Pesquisa,Mulheres na Computação no Brasil: Um Mapeamento Cienciométrico das Produções Científicas do Women in Information Technology (WIT) de 2016 a 2024,Vinicius Schineider Januário Viana (IFMA); Gabriel Vieira Lima (IFMA); Aricelma Costa Ibiapina (IFMA); Simone Azevedo Bandeira de Melo Aquino (IFMA),"A participação feminina na computação tem sido amplamente estudada, com o Women in Information Technology (WIT) desempenhando um papel central nesse debate. Este estudo realiza uma análise cienciométrica das publicações do WIT, utilizando a base Dimensions para identificar temas, autores e instituições mais influentes. Foram analisadas 326 publicações desde 2016, destacando tendências e iniciativas voltadas à inclusão de mulheres na área. Os resultados apontam um crescimento na produção científica e reforçam a importância de políticas de incentivo. O estudo contribui ao fornecer uma visão abrangente e automatizada sobre a evolução das pesquisas no evento.",https://sol.sbc.org.br/index.php/wit/article/view/35994
2025: Anais do XIX Women in Information Technology,Artigos de Pesquisa,Mapeamento da Representatividade Feminina em Cursos Técnicos e de Graduação da área de Tecnologia da Informação no estado do Ceará,Cecília Mesquita (UFC); Lara Lima (UFC); Jéssica Rodrigues (UFC); Felipe Oliveira (UFC); Daniel Magalhães (UFC); Ana Lívia Lopes (UFC); Viviane Menezes (UFC); Marcelo Martins da Silva (UFC); Carla Bezerra (UFC),,https://sol.sbc.org.br/index.php/wit/article/view/35995
2025: Anais do XIX Women in Information Technology,Artigos de Pesquisa,"Mulheres na TI do IFTO: desvendando desafios e motivações, e traçando estratégias para a permanência",Carla Beatriz Sousa Ribeiro (IFTO); Catarina Soares de Castro (IFTO); Laira Giovana Martins Macêdo (IFTO); Thatiane de Oliveira Rosa (IFTO),,https://sol.sbc.org.br/index.php/wit/article/view/35996
2025: Anais do XIX Women in Information Technology,Relatos de Experiência,STEM para todos: Um Relato de Experiência,Lídia Bononi P. Tomaz (IFTM); Jefferson B. Martins (IFTM); Ana Clara R. R. da Cunha (IFTM),,https://sol.sbc.org.br/index.php/wit/article/view/35997
2025: Anais do XIX Women in Information Technology,Relatos de Experiência,Do Papel ao Digital: Circuitos em papel como estratégia para engajar meninas na computação,Adelmo Lima (UFF); Maria Clara Flores (UFF); Nathalia Monteiro (UFF); Paulo Carrano (UFF); Rafaela Santos (UFF); Geiziane Gonçalves (UFF); Luciana Salgado (UFF); Aline Nascimento (UFF); Simone Martins (UFF),,https://sol.sbc.org.br/index.php/wit/article/view/35998
2025: Anais do XIX Women in Information Technology,Relatos de Experiência,Ampliando horizontes digitais de meninas por meio do letramento digital apoiado em pensamento computacional e robótica educacional,Ana Luiza Costa Vilela (IFRN); Pedro Henrique Assunção (IFRN); Rebecca Cruz Pinheiro (IPM); Keila Cruz Moreira (IFRN); Tatiana Amaral Sorrentino (IFRN); Éberton da Silva Marinho (IFRN); Helber Wagner da Silva (IFRN),,https://sol.sbc.org.br/index.php/wit/article/view/35999
2025: Anais do XIX Women in Information Technology,Relatos de Experiência,Mulheres Históricas e a Informática: Ada Lovelace - Inspirando Gerações,Suzy Kamylla de Oliveira Menezes (IFAL); Viviane de Menezes Ramalho Souza (IFAL),"Na área da Informática, as mulheres enfrentam diferentes barreiras que influenciam na permanência e representatividade feminina em cursos de nível médio e superior. Nesse sentido, é essencial que as contribuições femininas na área sejam divulgadas para estimular que mais meninas escolham a Informática como área profissional. Este trabalho tem o objetivo de apresentar atividades realizadas na Sala Temática Ada Lovelace - Inspirando Gerações.",https://sol.sbc.org.br/index.php/wit/article/view/36000
2025: Anais do XIX Women in Information Technology,Relatos de Experiência,Mulheres na Tecnologia: Destaques do Evento IFALTECH,Suzy Kamylla de Oliveira Menezes (IFAL); Viviane de Menezes Ramalho Souza (IFAL),,https://sol.sbc.org.br/index.php/wit/article/view/36001
2025: Anais do XIX Women in Information Technology,Relatos de Experiência,Alfabeto das Mulheres Brasileiras na Ciência como proposta para a alfabetização científica,Sylvana Karla S. L. Santos (IFB); Eliza de Matos Silva (UDF); Paula Queiroz Dutra (IFB); Ana Roberta Crisóstomo de Morais (IFB); Ana Clara Trindade de Oliveira (IFB); Lorrany Rodrigues Antunes (IFB); Maria Fernanda Itacarambi Silva (UnB); Alicia Barros Gonçalves Pereira (UnB); Ana Beatriz Lopes Rodrigues (IFB); Ludmilla Figueiredo Lima (IFB); Alyce Moreira do Nascimento (IFB),"O projeto Alfabeto das Mulheres Brasileiras na Ciência é uma ação do grupo de extensão Meninas na Ciência do IFB, iniciada no segundo semestre de 2024. A metodologia de desenvolvimento do projeto é o Design Thinking (DT). A partir das dificuldades encontradas por mulheres e meninas para prosseguir nas áreas STEAM, acrônimo em inglês para Ciência, Tecnologia, Engenharia, Artes e Matemática, a criação do alfabeto surgiu do trabalho colaborativo com estudantes do ensino médio e promoveu uma reflexão sobre as desigualdades de gênero e representatividade feminina em nossa sociedade. O resultado é uma ferramenta lúdica que pode ser utilizada desde o ensino fundamental para abordar a alfabetização científica e a desconstrução dos estereótipos de gênero.",https://sol.sbc.org.br/index.php/wit/article/view/36002
2025: Anais do XIX Women in Information Technology,Relatos de Experiência,Capacitação Digital para Mulheres 60+: Promovendo Inclusão e Autonomia através do Letramento Digital,Joana Felizardo da Silva (IFF); Vitória Graciano da Silva (IFF); Ana Mara de Oliveira Figueiredo (IFF),"Em um mundo cada vez mais digital, a inclusão tecnológica tornou-se um requisito básico para a participação e o exercício da cidadania. No entanto, para mulheres com mais de 60 anos, essa inclusão ainda é um desafio, marcado por barreiras de gênero, idade e acesso. Este artigo apresenta um projeto de extensão universitária que busca capacitar mulheres idosas no uso de ferramentas digitais, promovendo autonomia e inclusão social. Os resultados mostram que a iniciativa não apenas capacitou as participantes, mas também promoveu empoderamento e redução de desigualdades, destacando a importância de projetos que conectam a universidade à comunidade.",https://sol.sbc.org.br/index.php/wit/article/view/36003
2025: Anais do XIX Women in Information Technology,Relatos de Experiência,Fortalecendo a confiança das mulheres para atuar na área de computação,Ana Lúcia de Moura (PUC-Rio); Jessica Ribas (PUC-Rio); Maria Julia de Lima (PUC-Rio); Noemi Rodriguez (PUC-Rio),,https://sol.sbc.org.br/index.php/wit/article/view/36004
2025: Anais do XIX Women in Information Technology,Relatos de Experiência,Inclusão de Meninas em Competições de Programação: Um Relato de Experiência da Universidade de Brasilia,Maristela Holanda (UnB); Ana Clara B. Borges (UnB); Laryssa O. Ferreira (UnB); Aleteia Araujo (UnB); Luana Cruz Silva (UnB); Maria Eduarda Carvalho Santos (UnB); Vanessa Paixão Costa (UnB); Guilherme Novaes Ramos (UnB); Vinicius R. P. Borges (UnB); Edson Alves da Costa Jr (UnB); Maria Emilia Machado Telles Walter (UnB),,https://sol.sbc.org.br/index.php/wit/article/view/36005
2025: Anais do XIX Women in Information Technology,Relatos de Experiência,"Mulheres, Computação e Acessibilidade: O Relato de uma Discente com Paralisia Cerebral no Ensino Superior",Jennifer Viana (Unifesspa); Cristina Araújo (Unifesspa); Wemilly Carvalho (Unifesspa); Marcela Alves (Unifesspa); Leia Sousa (Unifesspa); Hugo Kuribayashi (Unifesspa),"Este artigo apresenta o relato de experiência de uma discente com paralisia cerebral no curso de Bacharelado em Sistemas de Informação. A partir de uma pesquisa qualitativa com entrevistas não estruturadas, são discutidas barreiras atitudinais, pedagógicas, arquitetônicas e tecnológicas vivenciadas ao longo de sua trajetória acadêmica. O estudo propõe reflexões, destacando os desafios enfrentados e sugerindo recomendações para melhorias no ensino superior. As conclusões ressaltam a importância de políticas institucionais específicas e da formação continuada de docentes em práticas inclusivas, promovendo a equidade e a permanência de estudantes com deficiência.",https://sol.sbc.org.br/index.php/wit/article/view/36006
2025: Anais do XIX Women in Information Technology,Relatos de Experiência,GECET e a Promoção da Liderança Feminina em STEM: Relato de Experiência em um Projeto de Extensão Universitária,Marilaine Colnago (UNESP); Rafaella S. Ferreira (UNESP); Giovana A. Benvenuto (UNESP); Rogéria Cristiane Gratão de Souza (UNESP); Wallace Casaca (UNESP); Helen S. Picoli (UNICAMP),,https://sol.sbc.org.br/index.php/wit/article/view/36007
2025: Anais do XIX Women in Information Technology,Relatos de Experiência,Programa Mulheres Mil e a Inclusão Digital no IFPR Campus Palmas: Relato de Experiência,Marina Girolimetto (IFPR); Andreia Marini (IFPR),"Este trabalho apresenta um relato de experiência sobre a implementação de um curso de Formação Inicial e Continuada (FIC) em Operadora de Computador no Programa Mulheres Mil, realizado no Instituto Federal do Paraná (IFPR) – Campus Palmas. O curso ocorreu entre 19 de agosto e 22 de novembro de 2024 e buscou promover a inclusão digital de vinte mulheres da comunidade local, das quais dezoito obtiveram a certificação. O relato destaca as principais dificuldades enfrentadas pelas participantes, como a sensação de não pertencimento, problemas de transporte e saúde, além de desafios interpessoais. Apesar dessas adversidades, as alunas expressaram satisfação com a experiência e demonstraram interesse em participar de futuras edições do Programa, evidenciando o seu potencial para promover a inclusão digital para o público feminino.",https://sol.sbc.org.br/index.php/wit/article/view/36008
2025: Anais do XIX Women in Information Technology,Relatos de Experiência,Divas Digitais: Promovendo a Inclusão Feminina em STEM do Ensino Médio à Computação,Samilly F. Moraes (Unifesspa); Wemilly Carvalho (Unifesspa); Erika Veloso (Unifesspa); Yasmim Barreiros (Unifesspa); Cecília Araújo (Unifesspa); Andrya Almeida (Unifesspa); Hugo Kuribayashi (Unifesspa); Leia Sousa (Unifesspa); Marcela Alves (Unifesspa),,https://sol.sbc.org.br/index.php/wit/article/view/36009
2025: Anais do XIX Women in Information Technology,Relatos de Experiência,Projeto PoliWomen: Desenvolvimento de soft skills para a Inclusão Feminina na Computação e Engenharia,Rafaela Otemaier (PUCPR); Camila Fukuda (PUCPR); Mariana Couto Siqueira (PUCPR),,https://sol.sbc.org.br/index.php/wit/article/view/36010
2025: Anais do XIX Women in Information Technology,Relatos de Experiência,Letramento Digital para Mulheres Idosas Amazônicas: Aprendizagens e Desafios em uma Ação Extensionista,Cecília Ionara P. de Araújo (Unifesspa); Gerson Alves de S. Neto (Unifesspa); Aline S. de Sousa (FVC); Léia S. de Sousa (Unifesspa),,https://sol.sbc.org.br/index.php/wit/article/view/36011
2025: Anais do XIX Women in Information Technology,Relatos de Experiência,Participação feminina na equipe de robótica no Instituto Federal do Espírito Santo - Campus Colatina: desafios e estratégias,Lara Calegário Guedes (IFES); Geanderson Lemonte (IFES); Dione Sousa (IFES); Jaimel de Oliveira Lima (IFES); Lisânia Soares Miranda (IFES); Nicolly do Carmo Reis (IFES); Amanda Almeida Soares (IFES),,https://sol.sbc.org.br/index.php/wit/article/view/36012
2025: Anais do XIX Women in Information Technology,Relatos de Experiência,Promoção da Equidade de Gênero na Computação: Resultados de uma Iniciativa para Alunas do Ensino Médio,Luciana Mara Freitas Diniz (PUC Minas); Amália Soares Vieira de Vasconcelos (PUC Minas); Fernanda Soares Oliveira Cunha (PUC Minas); Laura Caetano Costa (PUC Minas); Marcella Santos Belchior (PUC Minas),,https://sol.sbc.org.br/index.php/wit/article/view/36013
2025: Anais do XIX Women in Information Technology,Relatos de Experiência,Relato de Experiência de um Projeto de Extensão de Incentivo à Meninas na Tecnologia,Maria Vittória S. R. Palma (UFMT); Emilli D. de Oliveira (UFMT); Maria Clara I. de Castro (UFMT); Leticia Emily da S. Nascimento (UFMT); Gracyeli S. S. Guarienti (UFMT); Ludmilla F. O. Galvão (UFMT); Paulo Guilherme P. da Silva (UFMT),,https://sol.sbc.org.br/index.php/wit/article/view/36014
