edicao,categoria,titulo,autores,abstract,url
2024: Anais do XVIII Women in Information Technology,Artigos Curtos,Superando Desafios: Mulheres em Projetos Open Source no GitHub,Cinthia Provesi Pissetti (UFSC); Luciana Bolan Frigo (UFSC); Isabela Gasparini (UDESC),"Com a baixa representatividade feminina em áreas de tecnologias da informação, o presente artigo faz uma análise do cenário de mulheres em ambientes colaborativos de código aberto. Para a pesquisa foram analisadas duas comunidades no GitHub e selecionados quatro repositórios. Apesar dos desafios e da baixa representação, observa-se um aumento gradual na participação das mulheres ao longo do tempo, ressaltando a necessidade contínua de políticas e iniciativas que promovam a igualdade de gênero nessas comunidades. Um dos achados desta pesquisa mostra que em um repositório específico para mulheres, elas realizaram 83.33% dos comentários, enquanto nos demais repositórios a participação delas é de cerca de 5.56%, apesar do percentual de mulheres ser praticamente igual ao de homens. Considera-se ainda a importância de pesquisas qualitativas futuras para compreender as motivações e desafios enfrentados pelas mulheres nessas áreas.",https://sol.sbc.org.br/index.php/wit/article/view/29584
2024: Anais do XVIII Women in Information Technology,Artigos Curtos,Uma revisão da literatura sobre ambientes digitais representativos para mulheres na área de Tecnologia da Informação com Gamificação e UX Design,Lailla Galeno da Silva (IFMA); Gabriel Vieira Lima (IFMA); Simone Azevedo Bandeira de Melo Aquino (IFMA); Eveline de Jesus Viana Sá (IFMA); Thiago Paiva Freire (IFMA),,https://sol.sbc.org.br/index.php/wit/article/view/29585
2024: Anais do XVIII Women in Information Technology,Artigos Curtos,Introdução à Computação: Experiências na Construção do Conhecimento Tecnológico de Alunas do Mermãs Digitais,Vinicius Schineider Januário Viana (IFMA); Yasmin Milhomem de Oliveira (IFMA); Gabriel Vieira Lima (IFMA); Steffane de Oliveira Castro (IFMA); Aricelma Costa Ibiapina (IFMA); Simone Azevedo Bandeira de Melo Aquino (IFMA),"Este artigo examina o impacto da disciplina de Introdução à Computação no projeto de extensão Mermãs Digitais do IFMA – Campus Imperatriz. O estudo investigou a eficácia de diferentes metodologias de ensino, como gamificação, aprendizagem baseada em projetos e colaborativa, na promoção do engajamento e aprendizado das alunas. Utilizando método qualitativo descritivo, foram coletadas e analisadas 20 respostas de questionários respondidos pelas participantes. Os resultados indicaram uma recepção positiva das metodologias de ensino e da estrutura curricular utilizada, destacando a eficácia de projetos práticos e gamificação.",https://sol.sbc.org.br/index.php/wit/article/view/29586
2024: Anais do XVIII Women in Information Technology,Artigos Curtos,Representatividade feminina na Olimpíada Brasileira de Informática: uma década de análise da Modalidade Programação Nível 2,Anna Paula Silva (UNIRIO); Maria Laura Soares (PUC-Rio); Larissa Coelho (CEFET/RJ); Gustavo Guedes (CEFET/RJ),,https://sol.sbc.org.br/index.php/wit/article/view/29587
2024: Anais do XVIII Women in Information Technology,Artigos Curtos,Conhecer para Incluir: Qual é o Perfil de Mulheres Brasileiras Jogadoras de Jogos Digitais?,Estela Miranda Batista (UFV); Helena Cristo Martins (UFV); Maria Lúcia Bento Villela (UFV),,https://sol.sbc.org.br/index.php/wit/article/view/29588
2024: Anais do XVIII Women in Information Technology,Artigos Curtos,Café das Gurias: A Construção de um Ambiente Acolhedor para Fortalecer a Permanência de Mulheres na Computação,Laura Quevedo Jurgina (UFPel); Tiago D. Mackedanz (UFPel); Ana Carolina N. Konradt (UFPel); Louise Bezerra (UFPel); Kathe Beserra (UFPel); Maria Júlia Duarte Lorenzoni (UFPel); Bianca B. Dullius (UFPel); Leomar S. Rosa Júnior (UFPel),,https://sol.sbc.org.br/index.php/wit/article/view/29589
2024: Anais do XVIII Women in Information Technology,Artigos Curtos,Code.Ino: Construindo um Futuro Digital com o Protagonismo das Meninas em um Jogo para Programação,Bianca P. Castro (UnB); Hanani E. F. Soares (UnB); Thamires P. S. Schiavini (UnB); Maristela Holanda (UnB); Aleteia Araujo (UnB),,https://sol.sbc.org.br/index.php/wit/article/view/29590
2024: Anais do XVIII Women in Information Technology,Artigos Curtos,Bits de Ada: ações de estímulo à permanência feminina no curso de Bacharelado em Ciência da Computação do IFMA Campus Caxias,Heloisa Guimarães Coelho (IFMA); Luis Fernando Maia Santos Silva (IFMA); Samore Ellen Pacheco Barbosa (IFMA); Alexia Rodrigues Silva (IFMA); Sabrina Pachêco Silveira (IFMA); Jose Wilker Pereira Luz (IFMA),,https://sol.sbc.org.br/index.php/wit/article/view/29591
2024: Anais do XVIII Women in Information Technology,Artigos Curtos,Uma História que está só Começando: Primeiros Passos de uma Iniciativa para Aumentar a Representatividade Feminina na Computação,Thalita Maria do Nascimento (UFPR); Mayara L. de F. Neves (UFPR); Heloísa B. Mendes (UFPR); Camilla L. Assolari (UFPR); Clausius D. G. Reis (UFV); Kamila T. Lyra (UFPR); Rachel C. D. Reis (UFPR),,https://sol.sbc.org.br/index.php/wit/article/view/29592
2024: Anais do XVIII Women in Information Technology,Artigos Curtos,Desenvolvendo competências nas áreas STEM por meio de rodas de conversas e oficinas,Clara Freire M. Teixeira (IFRN); Maria Isabel M. Oliveira (IFRN); Maria Laura B. da Silva (IFRN); Alba Sandyra B. L. Campos (IFRN); Karolayne S. de Azevedo (UFRN),,https://sol.sbc.org.br/index.php/wit/article/view/29593
2024: Anais do XVIII Women in Information Technology,Artigos Curtos,Programa de Incentivo a Meninas no Ingresso em Cursos da área de Computação: um Relato de Experiência em Jaboatão dos Guararapes,Viviane Cristina Oliveira Aureliano (IFPE); Maria Eduarda Santana dos Santos (IFPE); Vanessa Carla Pereira da Silva (IFPE); Emmanuele Ribeiro de Mendonça (IFPE),,https://sol.sbc.org.br/index.php/wit/article/view/29594
2024: Anais do XVIII Women in Information Technology,Artigos Curtos,Mulheres em Cargos de Liderança em Tecnologia: Uma Revisão Sistemática,Safyre A. Farao (UFSC); Andréa Sabedra Bordin (UFSC),"Existe uma grande desigualdade de gênero na área de Tecnologia de Informação e Comunicação. Consequentemente, somente algumas mulheres conseguem ocupar cargos de liderança nessa área. A motivação desta pesquisa é investigar as experiências de mulheres que exerceram ou exercem funções de gestão em TIC no Brasil, identificando os desafios enfrentados e as estratégias para lidar com eles. Para isso, foi realizada uma revisão sistemática de literatura, que culminou na análise de 10 trabalhos. O desafio mais identificado nos trabalhos foi a discriminação ou preconceito de gênero. Diversas estratégias de superação de desafios foram mencionadas nos trabalhos, ainda que pouco discutidas.",https://sol.sbc.org.br/index.php/wit/article/view/29595
2024: Anais do XVIII Women in Information Technology,Artigos Curtos,Caminhos Percorridos: Reflexões do Projeto Meninas Digitais Dourados,Valguima Odakura (UFGD),,https://sol.sbc.org.br/index.php/wit/article/view/29596
2024: Anais do XVIII Women in Information Technology,Artigos Curtos,A machine learning examination of women’s leadership effectiveness in software development processes,Sâmara Ahyeska Alves Ferreira (IFTM); Danielli Araújo Lima (IFTM),,https://sol.sbc.org.br/index.php/wit/article/view/29597
2023: Anais do XVII Women in Information Technology,Artigos Completos,¿Cómo incentivar la educación STEM en niñas?: Una revisión de literatura,Kory Ponce (Universidad de Lima); Nadia Rodriguez-Rodriguez (Universidad de Lima); Franci Suni-Lopez (Universidad de Lima),"Around the world, women have a low representation in STEM careers. This phenomenon is puzzling when there is a labor market that increasingly requires professionals from these disciplines. Factors such as gender stereotypes and lack of information about these careers negatively affect girls' interest and motivation in this field. The objective of this article is to carry out a literature review of the various initiatives carried out to encourage STEM education in girls. Bootcamps, workshops, and serious games are the three types of most common initiatives. Of all these, serious games seem to have represented so far, a more effective strategy.",https://sol.sbc.org.br/index.php/wit/article/view/25005
2023: Anais do XVII Women in Information Technology,Artigos Completos,A História da Ada Silva: Livro para Representatividade na Computação,Patrícia Araújo-de-Oliveira (Unifap); Lorena Nunes (Unifap); Maiara Priscila Lima dos Santos (Unifap); Kamila Farias (Unifap); Adrilana Oliveira (Unifap),"A representatividade na Computação é um fator importante para o incentivo ao interesse pela área. Ainda se faz necessário um foco na desconstrução na representatividade desde a infância para que possamos ter mais diversidade na área. Este trabalho apresenta a construção de um livro que conta a história de uma protagonista feminina e negra, da Região Norte do Brasil, comumente colocada como coadjuvante ou ausente nos materiais atualmente encontrados.",https://sol.sbc.org.br/index.php/wit/article/view/25006
2023: Anais do XVII Women in Information Technology,Artigos Completos,A influência do gênero nos cursos de computação na UFES,Rebeca C. de Oliveira (UFES); Lucia Catabriga (UFES); Eliana Zandonade (UFES); Andrea Maria P. Valli (UFES); Maria Claudia S. Boeres (UFES); Camila Z. Aguiar (UFES),"O objetivo deste trabalho é apresentar, analisar e discutir a distribuição dos gêneros nos cursos de Ciência da Computação e Engenharia de Computação da Universidade Federal do Espírito Santo (UFES), com o intuito de investigar a baixa presença feminina atual. Estudos no mundo verificaram que houve uma grande inversão nos gêneros na computação, antes ocupada por mulheres criadoras de várias tecnologias e linguagens de programação. Essa realidade se repete na UFES, sendo mensurada nesse trabalho através dos dados, cedidos pela universidade, dos estudantes ingressantes nos cursos de 1990 a 2022. Na análise quantitativa foram considerados, para cada estudante, o ano de ingresso, a idade, o sexo, o curso e a forma de evasão. Além das análises descritivas, testes estatísticos de qui-quadrado de Pearson foram executados com o intuito de mensurar a influência do gênero na conclusão dos cursos.",https://sol.sbc.org.br/index.php/wit/article/view/25007
2023: Anais do XVII Women in Information Technology,Artigos Completos,Análise da presença feminina no corpo docente e sua relação com o corpo discente feminino nos cursos de TIC,Laís Pisetta Van Vossen (UDESC); Maria Teresa Silva Santos (UDESC); Daniella Martins Vasconcellos (UDESC); Guilherme Tomaselli Borchardt (UDESC); Carlos Daniel Schmitt Bunn (UDESC); Eric Carvalho da Silveira (UDESC); Isabela Gasparini (UDESC); Luciana Bolan Frigo (UFSC),,https://sol.sbc.org.br/index.php/wit/article/view/25008
2023: Anais do XVII Women in Information Technology,Artigos Completos,Análise de Redações sobre Mulheres na Ciência: Uma Perspectiva de Estudantes do Ensino Médio,Kamilly Cristine Gomes (IFMG); Iolanda Agnes D. Ribeiro (IFMG); Cristiane N. Targa (IFMG); Michele A. Brandão (IFMG),,https://sol.sbc.org.br/index.php/wit/article/view/25009
2023: Anais do XVII Women in Information Technology,Artigos Completos,Análise do gênero de pesquisadores em eventos do Congresso da Sociedade Brasileira de Computação,Maria Laura Soares (CEFET/RJ); Anna Paula Silva (CEFET/RJ / Unirio); Érica Carneiro (CEFET/RJ); Luciana Varjolo (CEFET/RJ); Gustavo Guedes (CEFET/RJ),"Segundo dados do IBGE, as mulheres correspondem a 51,03% da população brasileira. Apesar disso, apenas 23% do total de pesquisadores na área de Computação são do gênero feminino. Diversos fatores sociais parecem ser responsáveis por essa lacuna, porém algumas ações que visam atrair mulheres para a área de informática vêm surgindo a fim de mitigar essa questão. Diante dessa disparidade, este estudo tem como objetivo comparar a representatividade de gênero na autoria de artigos publicados em eventos do Congresso da Sociedade Brasileira de Computação (CSBC) nos últimos cinco anos. Os resultados indicam que a autoria de artigos nesses eventos é predominantemente masculina, refletindo a disparidade de gênero presente na área.",https://sol.sbc.org.br/index.php/wit/article/view/25010
2023: Anais do XVII Women in Information Technology,Artigos Completos,Análise e reflexões sobre a diferença de gênero na computação: podemos fazer mais?,Raquel Lopes (UFPB); Beatriz Maciel (UFPB); Dayanny Soares (UFPB); Larrysa Figueiredo (UFPB); Marcus Carvalho (UFPB),"Este artigo apresenta uma análise atualizada da participação das mulheres em cursos superiores de tecnologia no Brasil. Mulheres representam menos de 20% dos estudantes ingressantes e menos de 16% dos graduados em cursos superiores de tecnologia no Brasil (2021). Identificamos cerca de 80 iniciativas que buscam atrair mais mulheres para a área, mas o aumento na representação feminina ainda não é significativo. É necessário uma discussão mais profunda e soluções mais permanentes para o problema.",https://sol.sbc.org.br/index.php/wit/article/view/25011
2023: Anais do XVII Women in Information Technology,Artigos Completos,Aproximando Meninas da Área de STEM com Iniciação a Robótica,Luiza Castilho Ereno (UFSC); Ana Carolina Marcelino (UFSC); Andrea Bordin (UFSC); Luciana B. Frigo (UFSC),,https://sol.sbc.org.br/index.php/wit/article/view/25012
2023: Anais do XVII Women in Information Technology,Artigos Completos,Autopercepção de Meninas do Ensino Básico em Relação às Carreiras de STEM,Aline de Galés Silva (UnB); Renata Muniz Prado (UnB); Mirella M. Moro (UFMG); Aleteia Araujo (UnB),,https://sol.sbc.org.br/index.php/wit/article/view/25013
2023: Anais do XVII Women in Information Technology,Artigos Completos,Despertando o Interesse de Mulheres para os Cursos em STEM,Tainara Silva Novaes (UTFPR); Kathleen Danielly Souza Lins (UTFPR); Adolfo Gustavo S. Seca Neto (UTFPR); Mariangela de Oliveira Gomes Setti (UTFPR); Maria Claudia Figueiredo Pereira Emer (UTFPR),"Este artigo apresenta iniciativas que têm como objetivo promover a participação das mulheres nas áreas de STEM, buscando encorajar mais mulheres a seguirem carreiras nesses campos. O Projeto Emílias - Armação em Bits desenvolve oficinas nas escolas e um podcast, promovendo a interação entre jovens e profissionais da área de computação, além de contribuir para a formação de modelos femininos nesse campo. Os resultados demonstraram que 70,6% das estudantes demonstraram interesse pela computação após participarem das oficinas. Em relação aos ouvintes do podcast, dados do Spotify indicaram que 53% do público se identifica como feminino, 44% como masculino, e 3% não especificaram o gênero, o que mostra que o podcast tem alcançado um público feminino.",https://sol.sbc.org.br/index.php/wit/article/view/25014
2023: Anais do XVII Women in Information Technology,Artigos Completos,Egressas de Cursos de Computação: o quê as influenciou a escolherem um curso na área?,Aline Vieira de Mello (Unipampa); Vanessa Petró (IFRS); Amanda Meincke Melo (Unipampa); Alice Fonseca Finger (Unipampa); Maiara Neri Bustamante Sá (Unipampa),,https://sol.sbc.org.br/index.php/wit/article/view/25015
2023: Anais do XVII Women in Information Technology,Artigos Completos,ELLAS: Uma plataforma de dados abertos com foco em lideranças femininas em STEM no contexto da América Latina,Rita Cristina Galarraga Berardi (UTFPR); Pedro Henrique Stolarski Auceli (UTFPR); Cristiano Maciel (UFMT / California State Polytechnic University); Guillermo Davila (Universidad de Lima); Indira R. Guzman (California State Polytechnic University); Luana Mendes (UFMT / UNISELVA),"Os países da América latina e Caribe sofrem com a sub-representação de mulheres nas áreas de STEM e para resolver esse problema iniciativas, políticas e ações são criadas com frequência por diversos órgãos, sejam eles públicos ou privados. Porém, dados e informações de iniciativas, políticas e ações, não estão abertos, concentrados em algum local e nem sempre estruturados. Para reduzir esse problema e facilitar pesquisas que utilizam dados sobre mulheres em STEM, a rede de pesquisa internacional ELLAS foi criada e executa um projeto. O intuito do projeto é a criação de uma plataforma com tecnologias baseada em Web Semântica para estruturar e concentrar os dados do Brasil, Peru e Bolívia, inicialmente. Assim, esse artigo tem por objetivo apresentar as estratégias adotadas para o desenvolvimento desta plataforma.",https://sol.sbc.org.br/index.php/wit/article/view/25016
2023: Anais do XVII Women in Information Technology,Artigos Completos,"Fatores de Atração, Evasão e Permanência de Mulheres nas Áreas da Computação",Nayara Dias dos Santos (PUCRS); Sabrina Marczak (PUCRS),,https://sol.sbc.org.br/index.php/wit/article/view/25017
2023: Anais do XVII Women in Information Technology,Artigos Completos,Fatores e Dificuldades que Influenciam na Entrada e Permanência das Mulheres na Área de TI,Carla Ilane Moreira Bezerra (UFC); Maria Alice de Souza Macedo (UFC); Kassia Cristina de Sousa Lopes (UFC),,https://sol.sbc.org.br/index.php/wit/article/view/25018
2023: Anais do XVII Women in Information Technology,Artigos Completos,"Investigando a inter-relacão entre gamificação, gênero e IHC feminista: uma revisão sistemática da literatura",Karine Alessandra Córdova (UDESC); Ana Carolina Tomé Klock (Tampere University); Isabela Gasparini (UDESC),"Ao considerar a diversidade como um fator importante no desenvolvimento de soluções tecnológicas, pretende-se através de uma revisão sistemática da literatura, compreender como o gênero e perspectiva da Interacão Humano-Computador (IHC) feminista têm sido levados em conta no desenvolvimento de soluções gamificadas. O processo de revisão foi realizado nas bibliotecas digitais ACM e Web of Science com um total de 242 trabalhos encontrados, e após a aplicação de critérios de inclusão e exclusão, 4 foram analisados e discutidos neste artigo. Os resultados revelam que não há um padrão de incorporação de gênero, porém, o contexto mais comum é o educacional, em que os principais elementos de jogos utilizados são a competição e os desafios.",https://sol.sbc.org.br/index.php/wit/article/view/25019
2023: Anais do XVII Women in Information Technology,Artigos Completos,Investigando o desenvolvimento de soft skills em projetos parceiros do Programa Meninas Digitais: um estudo exploratório,Sofia Bento Desidério (UFC); Maria Rebecca L. Lelis (UFC); Maria Elanne M. Rodrigues (UFC); Francisca Kelen F. dos Santos (UFC); Anna Beatriz Marques (UFC),"Os projetos parceiros do Programa Meninas Digitais (PMD) realizam diversas ações que impactam no desenvolvimento acadêmico e profissional de suas integrantes. Neste contexto, se destacam as habilidades interpessoais ou soft skills. Este trabalho investiga o desenvolvimento de soft skills em alunas e pessoas coordenadoras que participam dos projetos parceiros do PMD. Para coleta dos dados foi conduzido um survey. Uma análise temática foi realizada para identificação de evidências de soft skills desenvolvidas durante a atuação dos respondentes nos projetos. As ações realizadas pelos projetos participantes da pesquisa foram mapeadas. Os resultados mostram que as ações promovidas pelos projetos impactam no desenvolvimento de habilidades como auto direção, comunicação, trabalho em equipe, diversidade e responsabilidade social.",https://sol.sbc.org.br/index.php/wit/article/view/25020
2023: Anais do XVII Women in Information Technology,Artigos Completos,Mapeamento do Perfil das Mulheres Brasileiras em Processamento de Linguagem Natural,Helena Caseli (UFSCar / BPLN); Evelin Amorim (INESC TEC / BPLN); Elisa Terumi Rubel Schneider (PUCPR / BPLN); Leidiana Iza Andrade Freitas (UFC / BPLN); Jéssica Rodrigues (University of Oxford / BPLN); Maria das Graças V. Nunes (USP / BPLN),"Conhecer o perfil das mulheres brasileiras que atuam em Processamento de Linguagem Natural (PLN) é um importante passo para o desenvolvimento de políticas e programas que visem aumentar a inclusão e a diversidade nessa área. Este é o primeiro trabalho realizado no Brasil com este fim. A partir de dados coletados via consulta pública, Lattes e Linkedin, notou-se que o perfil é de uma formação em computação ou linguística, atuando em empresas ou universidades, mas com pouca diversidade étnica e aparente dificuldade em conciliar vida profissional e maternidade. Analisando mais especificamente o grupo “Brasileiras em PLN” constatou-se uma expressiva capacidade de publicação e orientação, mas ainda uma baixa colaboração entre nossas integrantes.",https://sol.sbc.org.br/index.php/wit/article/view/25021
2023: Anais do XVII Women in Information Technology,Artigos Completos,Mentoria acadêmica como aliada à integração de alunas de Computação no ambiente acadêmico,Marina Azevedo Ximenes Teles (UFC); Larissa Santos Saraiva (UFC); Maria Isabele de O. Freires (UFC); Marina da S. Rocha (UFC); Anna Beatriz Marques (UFC),,https://sol.sbc.org.br/index.php/wit/article/view/25022
2023: Anais do XVII Women in Information Technology,Artigos Completos,"Não se nasce mulher na computação, torna-se. Tornam-se juntas! Analisando sete anos de WIT.",Luiz Paulo Carvalho (UFRJ); Silas Lima Filho (UFRJ); Michele A. Brandão (IFMG / UFMG); Jonice Oliveira (UFRJ); Flávia Maria Santoro (UERJ); Mônica Ferreira da Silva (UFRJ),"O CSBC integra a computação brasileira e trata dos rumos da área no país. Em um de seus eventos-base, WIT, questões de gênero e computação se encontram. A análise dos últimos 7 anos de WIT expõe algo raro nos eventos do CSBC: uma quantidade absoluta e proporcional de autoria de mulheres em conformidade com a agenda dialética do evento. WIT apresenta coesão, reincidência e colaboração entre sua comunidade, com predominância de instituições fora da região Sudeste, e publicações onde percebemos a ênfase em educação e na solução de problemas enfrentados pelas brasileiras.",https://sol.sbc.org.br/index.php/wit/article/view/25023
2023: Anais do XVII Women in Information Technology,Artigos Completos,Paridade de Gênero no Ensino Superior em STEM no Brasil: uma análise de 10 anos,Luciana Maria Azevedo Nascimento (UFRJ); Yuri Oliveira de Lima (UFRJ); Carlos Eduardo Barbosa (UFRJ / Marinha do Brasil); Luis Felipe Coimbra Costa (UFRJ); Ana Moura Santos (Universidade de Lisboa); Larissa Galeno (UFRJ); Geraldo Bonorino Xexéo (UFRJ); Jano Moreira de Souza (UFRJ),"Ciência, Tecnologia, Engenharia e Matemática (STEM) são áreas cruciais para o desenvolvimento socioeconômico do Brasil que sofrem com a falta de diversidade. Neste artigo, analisamos a participação feminina no Ensino Superior em STEM de 2010 a 2019 usando a metodologia SAGA da UNESCO. Os resultados mostram que a participação feminina em STEM aumentou de 29,5% para 33,7% no período. Nesse ritmo, levaria 24 anos para atingir o limite mínimo de paridade (45%). Concluímos que, mesmo com mudanças positivas no período, o Ensino Superior em STEM no Brasil ainda apresenta desafios consideráveis de igualdade de gênero que demandam a atenção de diversos atores sociais para melhorarem de forma mais acelerada.",https://sol.sbc.org.br/index.php/wit/article/view/25024
2023: Anais do XVII Women in Information Technology,Artigos Completos,Peg.Ada: Um jogo educacional para abordar a importância da pegada digital no futuro profissional de jovens meninas,Andressa R. Vinhal (UFGD); Valguima V. V. A. Odakura (UFGD),"Este artigo apresenta um jogo educacional com o objetivo de ensinar jovens meninas sobre pegada digital. O jogo tem o propósito de educar as meninas sobre a importância de proteger sua privacidade e segurança online, bem como encorajá-las a serem cidadãs digitais responsáveis. O jogo foi projetado com uma abordagem lúdica e interativa, com desafios que ajudam a manter o interesse das jogadoras. Espera-se que este jogo possa ser útil para educadores, pais e outros profissionais que trabalham com jovens meninas e que desejam ajudá-las a entender melhor sua presença online.",https://sol.sbc.org.br/index.php/wit/article/view/25025
2023: Anais do XVII Women in Information Technology,Artigos Completos,Por mais Mulheres na Ciência e na Tecnologia: ação formativa com abordagem STEAM na Educação Básica,Waleska Gonçalves de Lima (UFMT); Giseli Duardo Maciano (UFMT); Alessandra Ferreira dos Santos (UFMT); Leihge Roselle Rondon Pereira (UFMT); Helena Cristina Dias Magalhães (UFMT); Sabrina Bourscheid Sassi (UFMT); Cristiano Maciel (UFMT); Eunice Pereira dos Santos Nunes (UFMT),"Este artigo descreve o desenvolvimento de ação formativa realizada com estudantes do 9º ano do Ensino Fundamental ao 3º ano do Ensino Médio, em quatro escolas da rede estadual de Mato Grosso. Esta ação é fruto de um projeto que tem como foco a abordagem STEAM na Educação Básica. Os resultados indicam avaliações positivas quanto às atividades desenvolvidas e metodologia utilizada, com dinâmicas, práticas e acolhimento. Entretanto, como melhoria indica-se a ampliação de debate com estudantes, formação continuada para professores, melhores infraestruturas das escolas e suporte da política educacional, de modo a possibilitar práticas STEAM mais ampliadas e integradas à proposta pedagógica das escolas.",https://sol.sbc.org.br/index.php/wit/article/view/25026
