edicao,categoria,titulo,autores,abstract,url
2019: Anais do XIII Women in Information Technology,Artigos Curtos,Uma Iniciativa para Apoiar e Empoderar Alunas de Ensino Técnico e de Graduação em Computação,Kecia Ferreira (CEFET-MG); Glívia  Barbosa (CEFET-MG); Silvia  Albuquerque (CEFET-MG),"Este artigo apresenta um projeto criado por professoras em uma instituição de ensino que possui dois cursos técnicos e uma graduação na área de Computação. É descrito um relato de experiências a partir das ações no âmbito do projeto direcionadas a essas alunas para incentivá-las e apoiá-las a concluir seus cursos e encorajá-las para o mercado de trabalho. Como resultado do projeto, espera-se criar e consolidar uma rede de apoio mútuo entre as alunas desses cursos, bem como um grupo de orientação a elas, com atividades sistemáticas supervisionadas pelas professoras.",https://sol.sbc.org.br/index.php/wit/article/view/6718
2019: Anais do XIII Women in Information Technology,Artigos Curtos,Letramento de Meninas em Programação através do Pensamento Computacional para Compreensão de Problemas,Vania Marquiori (IFES); Márcia  Oliveira (IFES); Gabriel  Nascimento (IFSP),"Este trabalho trata da retração das mulheres na carreira da ciência da computação e das dificuldades de compreensão e de suas implicações no processo de formação de programadores. Desta forma o trabalho propõe a oferta de oficinas baseadas nos pilares do pensamento computacional para meninas do quinto ao nono ano do ensino fundamental em escola pública. A proposta é resultante de uma experiência de iniciação à programação com uma estudante surda, e tem como objetivo desenvolver o letramento em programação através do pensamento computacional para compreensão dos problemas despertando o interesse de meninas pela área.",https://sol.sbc.org.br/index.php/wit/article/view/6719
2019: Anais do XIII Women in Information Technology,Artigos Curtos,Fatores que Atraem e Afastam as Meninas de cursos da Área de TI,Amanda Martins (UFPB); Joana  Silva (UFPB); Joyce  Santos (UFPB); Ayla  Rebouças (UFPB),Este trabalho tem o objetivo de apresentar os resultados de um levantamento junto a meninas que estão cursando ou já concluíram cursos na área de TI sobre os fatores que atraem ou dificultam a permanência de mulheres em cursos da área. O levantamento foi realizado por meio de questionário online e os resultados mostram alguns fatores que podem atrair meninas para a área e que podem ser mais explorados em ações com este fim. Foram também obtidos alguns fatores que impactam negativamente na motivação das meninas para concluírem seus cursos e que podem ser mais refletidos nos cursos de graduação e mitigados.,https://sol.sbc.org.br/index.php/wit/article/view/6720
2019: Anais do XIII Women in Information Technology,Artigos Curtos,Triênio do Curso de Iniciação à Programação de Computadores para mulheres: uma análise preliminar das turmas e das egressas,Renata  Sena (UFBA),"Este artigo apresenta e discute resultados da análise do triênio das turmas exclusivas para mulheres do Curso de Iniciação à Programação (CIProg), ação do Meninas Digitais-Regional Bahia que visa aproximar mulheres das áreas de Computação por meio da programação. A discussão que segue passa por um breve histórico dessa iniciativa e do CIProg, além de apresentar uma análise histórica das turmas, suas especificações e particularidades, o perfil de egressas quanto à escolaridade e a política de cotas praticada nos editais de seleção para o CIProg.",https://sol.sbc.org.br/index.php/wit/article/view/6721
2019: Anais do XIII Women in Information Technology,Artigos Curtos,Uma experiência de aprendizagem de lógica de programação com Code.org no ensino médio: uma análise por gênero sobre a percepção dos estudantes,Maria Fiori (UFC); Marina  Rocha (UFC); Anna  Marques (UFC),Levar a programação para estudantes do ensino médio pode facilitar o aprendizado e a compreensão do funcionamento de um algoritmo. Este artigo apresenta uma experimentação com a plataforma Code.org com 28 estudantes de ensino médio da rede pública estadual. O objetivo da experiência foi introduzi-los à lógica de programação e despertar o interesse dos estudantes para os cursos de Computação. O método de avaliação aplicado foi um questionário para avaliação de jogos digitais fornecido pelo modelo MEEGA+ qLevar a programação para estudantes do ensino médio pode facilitar o aprendizado e a compreensão do funcionamento de um algoritmo. Este artigo apresenta uma experimentação com a plataforma Code.org com 28 estudantes de ensino médio da rede pública estadual. O objetivo da experiência foi introduzi-los à lógica de programação e despertar o interesse dos estudantes para os cursos de Computação. O método de avaliação aplicado foi um questionário para avaliação de jogos digitais fornecido pelo modelo MEEGA+ que avalia a experiência do jogador. Uma análise por gênero foi conduzida sobre os resultados da avaliação do Code.orgue avalia a experiência do jogador. Uma análise por gênero foi conduzida sobre os resultados da avaliação do Code.org.,https://sol.sbc.org.br/index.php/wit/article/view/6722
2019: Anais do XIII Women in Information Technology,Artigos Curtos,Uma escultura de Ada Lovelace como recurso educativo para trabalhar gênero na computação,Nani Castilho (UFRGS); Clevi  Rapkiewicz (UFRGS); Simone  Fogazzi (UFRGS),Diversos instrumentos e estratégias podem ser usadas para fomenter o debate sobre a baixa participação de mulheres na área de computação. A falta de modelos de referência tem sido usada com frequência. Esse artigo relata a experiência de inserir o debate de gênero na computação em escolas públicas usando como recurso educativo uma escultura de Ada Lovelace feita com lixo eletrônico. Depoimentos de alunas e alunos que tiveram contato com a escultura denotam que integrar ate nesse debate pode trazer bons resultados.,https://sol.sbc.org.br/index.php/wit/article/view/6723
2019: Anais do XIII Women in Information Technology,Artigos Curtos,Construindo uma Identidade Coletiva em prol do Pertencimento e Permanência em Cursos da Área de Computação,Ana Bacelo (PUC-RS); Cristina  Nunes (PUC-RS); Milene  Silveira (PUC-RS),"A diminuição no número de meninas que ingressam (e que concluem) os cursos das áreas de Engenharia e de Computação na PUCRS trouxe a necessidade de se criar ações que as motivem tanto a ingressar quanto a permanecer em cursos destas áreas. No âmbito dos cursos da área de Computação da PUCRS, uma série de ações foram realizadas durante o ano de 2018, com o intuito de se construir uma identidade de grupo com as meninas que estão nestes cursos. Com a criação e fortalecimento desta identidade, esperamos que elas se sintam pertencentes a seus cursos, neles permaneçam e consigam inspirar outras meninas a neles ingressarem.",https://sol.sbc.org.br/index.php/wit/article/view/6724
2019: Anais do XIII Women in Information Technology,Artigos Curtos,Promovendo o conhecimento sobre mulheres na Computação: experiência com o jogo de cartas Computasseia no ensino de História da Computação,Ana Alencar (UFC); Valéria  Pinheiro (UFC); Anna  Marques (UFC),"As mulheres foram de grande importância na História da Computação, porém ao longo do processo foram excluídas dos relatos históricos. Este artigo descreve a experiência de ensino-aprendizado com um jogo de cartas existente denominado Computasseia, que aborda a História da Computação, com seus principais acontecimentos e personalidades importantes, mostrando a imagem e a importância das mulheres que colaboraram para a área. O jogo foi adotado e avaliado com estudantes do ensino médio e graduação. Os resultados indicam que a experiência contribuiu para a construção do conhecimento dos estudantes, potencializando o interesse pela área de Computação e a interação entre os jogadores.",https://sol.sbc.org.br/index.php/wit/article/view/6725
2019: Anais do XIII Women in Information Technology,Artigos Curtos,"Perfis das estudantes dos cursos de Informática do Instituto Federal de Educação, Ciência e Tecnologia de São Paulo (IFSP), campus Bragança Paulista",Thais Sousa (IFSP); Elisandra  Silva (IFSP); Sandra  Oliveira (IFSP),"É importante compreender os perfis das estudantes dos cursos de Informática do IFSP – Bragança Paulista, para colaborar na inclusão e na permanência das estudantes na área e, também, na promoção da participação de mulheres no mercado de trabalho. O campus possui curso técnico integrado ao ensino médio, superior e pós-graduação na área de Informática, sendo possível atuar nos diferentes níveis de ensino. Ademais, este trabalho está relacionado a um projeto de extensão que busca promover a participação de mulheres na área de Exatas. Dessa forma, o objetivo deste artigo é apresentar os perfis das estudantes dos diferentes níveis de ensino na área Informática do campus e com esses resultados definir estratégias adequadas.",https://sol.sbc.org.br/index.php/wit/article/view/6726
2019: Anais do XIII Women in Information Technology,Artigos Curtos,Oficina Gurias na Computação: três horas de imersão feminina na área da Computação discutidas em detalhes,Fláva Amim (UNIPAMPA); Jaqueline  Moura (UNIPAMPA); Karina  Fernandes (UNIPAMPA); Ketrin  Vargas (UNIPAMPA); Aline  Mello (UNIPAMPA),"As estatı́sticas apontam que as mulheres representam aproximadamente 14% dos ingressantes nos cursos da área da Computação no Brasil. Muitos projetos têm realizado oficinas junto a estudantes do Ensino Médio, visando a atrair mais mulheres para esses cursos. Entretanto, a maioria dos trabalhos encontrados que relatam essas oficinas não trazem informações suficientes que permitam a sua replicação. Assim, este artigo apresenta em detalhe o planejamento e a execução de uma oficina de 3 horas voltada para estudantes do Ensino Médio, além de fornecer todo o material utilizado.",https://sol.sbc.org.br/index.php/wit/article/view/6727
2019: Anais do XIII Women in Information Technology,Artigos Curtos,PyLadies Manaus: Experiências no Empoderamento Feminino na Comunidade Python,Giovana Lucca (UEA); Juliany  Raiol (UEA); Nicoli  Araújo (UEA); Rafaela  Sousa (UEA); Elloá  Guedes (UEA),"Este artigo apresenta o PyLadies Manaus, capı́tulo local de um grupo internacional de mentoria com foco em ajudar mais mulheres a se tornarem ativas na comunidade de código aberto Python. Descrevemos alguns antecedentes históricos que motivaram a criação desse grupo, o perfil de suas atuais integrantes e também os resultados e impactos de 11 atividades realizadas em 2018.",https://sol.sbc.org.br/index.php/wit/article/view/6728
2019: Anais do XIII Women in Information Technology,Artigos Curtos,Uma análise de gênero a partir de dados da Sociedade Brasileira de Computação,Karen Ribeiro (UFMT); Jéssica  Azevedo (UFMT); Cristiano  Maciel (UFMT); Silvia  Bim (UTFPR),"A Sociedade Brasileira de Computação (SBC) é uma sociedade científica que reúne estudantes, professores, pesquisadores, profissionais e entusiastas da área de Computação do Brasil. Por se tratar da principal instituição civil que representa a área no país, este artigo tem como objetivo realizar uma análise quantitativa a partir dos dados das pessoas associadas à SBC, segundo gênero, localização, categoria de associação e áreas de interesse na Computação, a fim de traçar um panorama atual da Computação no país.",https://sol.sbc.org.br/index.php/wit/article/view/6729
2019: Anais do XIII Women in Information Technology,Artigos Curtos,A influência de uma ação de inclusão no interesse das alunas de ensino médio em cursar Computação na Universidade Federal de Goiás,Talita Ferreira (UFG); Elisângela  Dias (UFG),"Embora as mulheres tenham sido pioneiras na Computação, o interesse de alunas do ensino médio em Computação e a participação feminina no ambiente acadêmico e profissional da Computação vem diminuindo ao longo do tempo. Neste artigo, mostramos os resultados da pesquisa realizada com alunas do ensino médio durante uma ação de inclusão destinada a aumentar a visibilidade das mulheres que fizeram parte da história da Computação e incentivar a participação feminina na Computação. Concluı́mos que a ação de inclusão influenciou positivamente no interesse em Computação por parte das alunas do ensino médio participantes da pesquisa.",https://sol.sbc.org.br/index.php/wit/article/view/6730
2019: Anais do XIII Women in Information Technology,Artigos Curtos,Pós-graduação em Computação na Universidade de  Brasília: Um Grande Desafio na Diversidade de Gênero,Maristela Holanda (UNB); Aleteia  Araujo (UNB),"O problema de diversidade de gênero em Ciência da Computação é um fato bem documentado em cursos de graduação no Brasil. Quando se trata de pesquisa, mestrado e doutorado, esse diagnóstico é menos conhecido. Assim, este artigo apresenta dados dos programas de pós-graduação da Universidade de Brasília que tem mestrados acadêmico e profissional, e doutorado acadêmico.",https://sol.sbc.org.br/index.php/wit/article/view/6731
2019: Anais do XIII Women in Information Technology,Artigos Curtos,Mulheres na Computação: Análises por Sub-Áreas,Barbara Duarte (UFMG); Ana  Moura (UFMG); Mirella  Moro (UFMG),Este artigo apresenta a presença feminina nas sub-áreas da Computação brasileira a partir da participação em comitês de programa de simpósios da Sociedade Brasileira de Computação ao longo do tempo.,https://sol.sbc.org.br/index.php/wit/article/view/6732
2019: Anais do XIII Women in Information Technology,Artigos Curtos,Exame Nacional de Desempenho de Estudantes (ENADE): Análise do Perfil das mulheres dos cursos da área de computação,Barbara Freitas (IFNMG); Luciana Cosme (IFNMG); Mayara Nascimento (IFNMG),"O objetivo deste trabalho é traçar o perfil das mulheres da área de computação através de uma análise dos microdados referentes ao Exame Nacional de Desempenho dos Estudantes (ENADE) durante o ano de 2017. Este trabalho foi motivado pelo desejo de compreender e identificar fatores que podem mostrar as diferenças entre e homens e mulheres na área de computação. Dos resultados obtidos, o mais significativo refere-se à motivação para iniciar o curso, a maioria das mulheres foi motivada pelo desejo de inserção no mercado de trabalho enquanto os homens assumem ter uma vocação para a área.",https://sol.sbc.org.br/index.php/wit/article/view/6733
2019: Anais do XIII Women in Information Technology,Artigos Curtos,Gênero e áreas de interesse na informática: uma análise de amostragem pelos perfis do Linkedin na região de Curitiba/PR,Laura Shibukawa (UTFPR); Mayara  Yamanoe (UTFPR),"A desigualdade de gênero na área da informática se expressa tanto na presença tímida de mulheres quanto em seu pouco reconhecimento. Para entender questões como essas, buscamos, por meio de uma análise de amostragem através de perfis de mulheres da rede social Linkedin, identificar as diversas funções que elas ocupam e/ou almejam. A informática possui diversas subáreas e, partindo dessa questão, consideramos relevante saber em quais espaços de atuação encontram-se as mulheres, o que é fundamental para contribuir com os estudos sobre igualdade de gênero na computação.",https://sol.sbc.org.br/index.php/wit/article/view/6734
2019: Anais do XIII Women in Information Technology,Artigos Curtos,A vida de Ada Lovelace em um circuito de atividades desplugadas,Silvia Bim (UTFPR); Rosiane  Freitas (UFAM); Cristiano  Maciel (UFMT); Mory  Lobo (UFMT); Larissa  Pessoa (UFAM); Fernanda  Pires (UFAM); Jean  Rangel (UFTPR); João Bernado (UEA); Karla  Pereira (UFAM),"A vida de Ada Lovelace é uma fonte de inspiração para mulheres e homens de todas as idades, por ter sido uma pessoa de mente brilhante e visionária. Seu feito maior foi ter elaborado o que é considerado o primeiro programa de computador da história. Neste artigo, é apresentada uma proposta metodológica para uso didático de um livro infantil sobre a vida de Ada Lovelace, pela proposição de um circuito de atividades desplugadas, com vistas a se trabalhar os pilares do pensamento computacional em crianças e adolescentes. Tal abordagem foi aplicada em uma oficina no LAWCC–CLEI 2018(X Congresso da Mulher Latino-americana em Computação–Conferência Latino-americana em Informática). Uma análise quali-quantitativa foi realizada, indicando a adequabilidade da atividade proposta.",https://sol.sbc.org.br/index.php/wit/article/view/6735
2019: Anais do XIII Women in Information Technology,Artigos Curtos,Gurias Digitais: Inclusão de Meninas na Área de TI,Amanda Saccol (Universidade Regional Integrada do Alto Uruguai e das Missões); Carla  Castanho (Universidade Regional Integrada do Alto Uruguai e das Missões); Eduardo  Silva (Universidade Regional Integrada do Alto Uruguai e das Missões); Eduardo  Spies (Universidade Regional Integrada do Alto Uruguai e das Missões); Victor  Alves (Universidade Regional Integrada do Alto Uruguai e das Missões),"A área de TI encontra-se em constante avanço, mas a baixa participação das mulheres vem se tornando cada vez mais alarmante. Esse trabalho objetiva analisar a participação da mulher na área computacional e relatar o desenvolvimento do projeto Gurias Digitais, o qual busca incentivar meninas de uma escola municipal da cidade de Santiago a conhecer melhor a área da Computação, também as incentivando a considerar a área como uma opção de carreira válida, ensinando-as a desenvolver seu próprio jogo.",https://sol.sbc.org.br/index.php/wit/article/view/6736
2019: Anais do XIII Women in Information Technology,Artigos Curtos,Mentorando meninas iniciantes em programação: um estudo de caso,Fabrizio Franzoia (UEA); Fernanda  Pires (UEA); Marcela  Pessoa (UEA),"O presente artigo discute modelos, metodologias, preconceitos e os seus impactos para um grupo de meninas calouras em um curso de computação. Bem como levanta altercações em torno da criação de grupos de estudos focais para meninas com vistas ao empoderamento como medida inicial fortalecedora. O método utilizado foi o estudo de caso com uma abordagem do tipo quali-quanti. Resultados apontam que a medida: “criação de grupo de estudos mentorados” se mostrou uma boa iniciativa dado o grau de aceitação e de resultados avaliados de forma qualitativa (descrição das alunas) e quantitativa (avaliação de contests).",https://sol.sbc.org.br/index.php/wit/article/view/6737
2018: Anais do XII Women in Information Technology,Artigos,Meninas do Ensino Médio: Quem quer estudar TI?,Jacques André Grings (UNIPACS); Naira Kaieski (IFSUL); Paula Nunes (IFSUL),"O artigo examina a escolha profissional das jovens concluintes do Ensino Médio da região do Paranhana/RS. Foi aplicada uma pesquisa com 1.328 alunos, de ambos os sexos, com idades entre 15 e 20 anos, sendo que 734 (55%) eram meninas. As respostas indicam que essas, em sua maioria, desejam cursar o Ensino Superior e já escolheram tanto a profissão quanto o curso de graduação baseado na sua realização pessoal. Porém, carreiras e formações relacionadas com tecnologia apresentaram uma inquietante baixa demanda.",https://sol.sbc.org.br/index.php/wit/article/view/3371
2018: Anais do XII Women in Information Technology,Artigos,Um estrato do perfil das profissionais de TIC na cidade de Maringá-PR,Luciana A. F. Martimiano (UEM); Nikaelly V. de Lima (DB1 Global Software); Valéria D. Feltrim (UEM); Larissa Roder (DB1 Global Software),"Este artigo apresenta uma análise do perfil das profissionais em Tecnologia da Informação e Comunicação em Maringá-PR. Por meio de um questionário respondido por 33 profissionais, foi possível identificar a idade, o grau de formação, os cargos mais ocupados, a percepção de preconceito de gênero e assédio, e a percepção de competência. Estabelecendo uma relação entre idade e percepção de preconceito e competência, as mulheres com mais de 40 anos relataram ter sofrido menos assédio e preconceito e se consideram competentes. Por outro lado, a maioria das mulheres com até 39 anos relataram já ter sofrido algum tipo de preconceito e que não se consideram competentes o suficiente.",https://sol.sbc.org.br/index.php/wit/article/view/3372
2018: Anais do XII Women in Information Technology,Artigos,Iniciativas de Inserção de Mulheres no Mercado de Tecnologia da Informação: Análise das experiências de participantes brasileiros do Desafio Technovation,Suzy Santiago (CEFET-MG); Carolina Riente de Andrade (CEFET-MG),"Este artigo apresenta um estudo de caso do Desafio Technovation, um projeto de âmbito internacional, que se propõe a despertar o interesse de meninas em áreas relacionadas à tecnologia, de forma a explorar como as iniciativas promovidas pelo projeto contribuem para aumentar a presença feminina nestas áreas, que são predominantemente masculinas. Foram aplicados questionários para participantes do projeto no ano de 2017 e partir destes foram realizadas análises qualitativas e quantitativas para verificar as contribuições do projeto.",https://sol.sbc.org.br/index.php/wit/article/view/3373
2018: Anais do XII Women in Information Technology,Artigos,Participação feminina em game jams: um estudo sobre igualdade de gêneros em maratonas de desenvolvimento de jogos,Cláudia Letícia Ferraz Dutra (UFPE); Kiev Gama (UFPE),"Este trabalho apresenta um estudo sobre a participação feminina em game jams, entregando o resultado da pesquisa realizada na Portomídia Game Jam das Minas, evento de desenvolvimento de jogos focado no público feminino. O trabalho visa investigar a igualdade de gêneros em eventos desta natureza e identificar motivações e desestímulos femininos para a sua participação em game jams.",https://sol.sbc.org.br/index.php/wit/article/view/3374
2018: Anais do XII Women in Information Technology,Artigos,"O Moodle de Lovelace: Um Curso a Distância de Python Essencial, Ativo e Prático para Formação de Programadoras",Márcia Gonçalves de Oliveira (IFES); Rutinelli da Penha Favero (IFES); Mônica F. da Silva Lopes (IFES); Anne Carolina Silva (IFES); Jennifer Gonçalves do Amaral (IFES); Helen França Medeiros (IFES),"Uma realidade comum de muitas adolescentes e jovens é a dificuldade ou impossibilidade de continuar os estudos após uma gravidez porque assumirão responsabilidades de cuidar de seus filhos em tempo integral ou de trabalhar para sustentá-los. Com o objetivo de oferecer a essas jovens e a outras estudantes que tenham interesse em aprender programação uma possibilidade de formação profissional a domicílio, desenvolvemos o Moodle de Lovelace, um curso a distância de programação Python com conteúdos essenciais de programação, atividades planejadas com metodologias ativas e aplicações práticas no mundo real. A contribuição deste curso para atrair as jovens mulheres para a carreira de computação é oferecer a cada uma delas a oportunidade de estudar programação de qualquer lugar e em seu próprio tempo.",https://sol.sbc.org.br/index.php/wit/article/view/3375
2018: Anais do XII Women in Information Technology,Artigos,Autoria de conteúdos multimídia como atividade de estímulo à descoberta de experiências femininas em TI,Sheyla Medeiros (UFPB); Thaíse Costa (UFPB); Vanessa Dantas (UFPB); Renata Figueiredo (UFPB); Beatriz Martins (UFPB),"A autoria de conteúdo multimídia pode ser explorada como atividade de incentivo ao conhecimento, discussão e divulgação de experiências femininas naárea de Tecnologia da Informação (TI). Este artigo apresenta um relato de experiência acerca do uso de criação de conteúdo multimídia como forma de promover e debater a temática entre estudantes. A experiência proporcionou reflexão sobre o papel da mulher naárea de TI, ajudando no incentivo à carreira, além da disponibilização do material produzido como meio de divulgação do tema.",https://sol.sbc.org.br/index.php/wit/article/view/3376
2018: Anais do XII Women in Information Technology,Artigos,Identificando Influências na Escolha de uma Graduação em Exatas: um Estudo Qualitativo e Comparativo de Gênero,Maysa M. G. Macedo (IBM Research); Andrea Britto Mattos (IBM Research); Marisa Vasconcelos (IBM Research); Alexandre Martinazzo (USP); Roseli Lopes (USP),"Esse artigo descreve resultados preliminares de um estudo qualitativo conduzido com homens e mulheres empregados em uma empresa na área de tecnologia. Foram conduzidos quatro grupos focais com dois objetivos principais: (i) identificar as influências mais relevantes que as pessoas selecionadas receberam no momento em que optaram por um curso superior na área de tecnologia; e (ii) verificar se esses fatores diferem entre profissionais do sexo masculino e feminino. Nossas observações indicam que o processo da escolha de uma carreira difere entre os gêneros: enquanto homens buscam especialmente satisfação pessoal e financeira, mulheres demonstram uma maior preocupação a respeito da sua decisão perante à família e sociedade.",https://sol.sbc.org.br/index.php/wit/article/view/3377
