edicao,categoria,titulo,autores,abstract,url
2021: Anais do XV Women in Information Technology,Artigos Completos,"E aí meninas, qual vai ser? Agora sua carreira o jogo STEAM ParPow pode te ajudar a escolher",Victória Guimarães (UFAM); Larissa Pessoa (UFAM); Raquel Folz (UFAM); Lia Martins (UFAM / IFAM); Rosiane de Freitas (UFAM),"Neste artigo são abordados o desenvolvimento e a aplicação de um jogo de cartas que trabalha conteúdos de STEAM (ciências, tecnologias, engenharias, artes e matemática), cultura regional amazônica e a temática de mulheres em computação. Denominado de ParPow, o jogo é similar a um jogo de cartas muito conhecido (Dobble - Spot it). O desenvolvimento e entendimento do funcionamento do jogo envolve conceitos de geometria espacial, combinatória e algoritmos, e, sua jogabilidade trabalha a percepção visual, agilidade e raciocínio lógico, trabalhando, também, os quatro pilares do pensamento computacional: abstração, reconhecimento de padrão, decomposição e passo-a-passo algorítmico. Além de promover a divulgação de projetos de mulheres em STEAM no Brasil, o ParPow serviu de facilitador para promover o diálogo sobre assuntos de STEAM, principalmente com alunas do ensino médio que estavam na fase de escolha da carreira a seguir. A aplicação, em uma feira de profissões, demonstrou o quão atrativo e envolvente é o jogo e sua adequabilidade para demonstrar conceitos e aplicações interessantes em STEAM.",https://sol.sbc.org.br/index.php/wit/article/view/15843
2021: Anais do XV Women in Information Technology,Artigos Completos,Impactos do Projeto Meninas Digitais em Egressas de TI: Meninas Digitais - UFSC,Francielli Freitas Moro (UFRGS); Rafaela Oliveira Padilha (UFSC); Luciana Bolan Frigo (UFSC),"A baixa representatividade feminina na área de TI vem sendo discutida há décadas em diferentes regiões do mundo. A participação das mulheres nesta área é fundamental para o desenvolvimento socioeconômico. Projetos associados ao Programa Meninas Digitais atuam no sentido de diminuir estes problemas. Este artigo apresenta os resultados de uma pesquisa feita com as alunas egressas participantes do projeto Meninas Digitais - UFSC. Os resultados apontam que a participação no projeto teve reflexos positivos na vida profissional destas mulheres, impactando desde a contratação até a participação delas em outras ações semelhantes.",https://sol.sbc.org.br/index.php/wit/article/view/15844
2021: Anais do XV Women in Information Technology,Artigos Completos,Mapeamento das Ações Realizadas pelos Projetos Parceiros do Programa Meninas Digitais na Região Sul,Aline Vieira de Mello (UNIPAMPA); Alice Fonseca Finger (UNIPAMPA); Letícia Gindri (UNIPAMPA); Amanda Meincke Melo (UNIPAMPA),,https://sol.sbc.org.br/index.php/wit/article/view/15845
2021: Anais do XV Women in Information Technology,Artigos Completos,Mulheres na Computação: de Norte a Sul - Uma Ação de Extensão na Pandemia na Busca pela Integração das Diferentes Regiões do Brasil,Letícia Gindri (UNIPAMPA); Patrícia Araújo-de-Oliveira (UNIFAP); Amanda Meincke Melo (UNIPAMPA); Aíla Maciel (UNIFAP); Ketrin Diovana Alves Rodrigues Vargas (UNIPAMPA); Marina Braun Otokovieski (UNIPAMPA); Raniely dos Anjos (UNIFAP),,https://sol.sbc.org.br/index.php/wit/article/view/15846
2021: Anais do XV Women in Information Technology,Artigos Completos,Mulheres na Tecnologia da Informação: Histórico e Cenário Atual nos Cursos Superiores,Vívian Ludimila Aguiar Santos (IFNMG); Thales Francisco Mota Carvalho (UFVJM); Maria do Socorro Vieira Barreto (IFNMG),"O objetivo deste trabalho é salientar o histórico da participação feminina na área de Tecnologia da Informação (TI) e destacar o cenário feminino atual dos cursos superiores de TI no Brasil. Para isso, realizou-se uma pesquisa bibliográfica e uma análise dos microdados referentes ao Censo da Educação Superior do período de 2014 a 2019, disponibilizados pelo Instituto Nacional de Estudos e Pesquisas Educacionais Anísio Teixeira (INEP). Os resultados indicam a baixa representatividade feminina nos Cursos Superiores de TI no Brasil, durante o período estudado.",https://sol.sbc.org.br/index.php/wit/article/view/15847
2021: Anais do XV Women in Information Technology,Artigos Completos,Mundo Bit Byte:  Um jogo digital para disseminar o conhecimento sobre personalidades femininas na Computação,Ana Júlia L. Briceño (UnB); Ana Sofia S. Silvestre (UnB); Bianca P. Castro (Colégio Estadual Pedro Mourão); Hanani E. F. Soares (UnB); Tais A. Oliveira (UnB); Thamires P. Silva (UnB); Aleteia P. F. Araujo (UnB); Carla D. Castanho (UnB); Carla Cavalcante Koike (UnB); Maristela Holanda (UnB); Roberta B. Oliveira (UnB),,https://sol.sbc.org.br/index.php/wit/article/view/15848
2021: Anais do XV Women in Information Technology,Artigos Completos,O papel das professoras no incentivo à carreira de Computação para meninas no Ensino Fundamental,Bruna Oenning Amador (UTFPR); Patrícia Abe Turato (UTFPR); Mayara Dal Vesco Hoger (UTFPR); Lara Morgado da Silva Santos (UTFPR); Silvia Amelia Bim (UTFPR); Rita Cristina Galarraga Berardi (UTFPR),"Muitas ações têm sido realizadas com o intuito de atrair mais meninas para a Computação, que vão desde oficinas com alunas do ensino fundamental até ações para mantê-las nas universidades uma vez que elas escolhem essa carreira. No Brasil, considerando os mais de 100 projetos parceiros do Meninas Digitais, a grande maioria destes têm as estudantes como foco das ações. No entanto, projetos com foco nas professoras do Ensino Fundamental também podem ser aliados à causa. Para isso, essas professoras precisam conhecer mais sobre as carreiras na Computação, o que fazem os profissionais, qual o perfil de atividade e, assim, auxiliar na divulgação da área. Este artigo evidencia essa demanda por projetos que auxiliem as professoras, uma vez que foi possível identificar visões estereotipadas e lacunas, importantes em conceitos sobre a área de Computação como um todo.",https://sol.sbc.org.br/index.php/wit/article/view/15849
2021: Anais do XV Women in Information Technology,Artigos Completos,Panorama do percurso acadêmico feminino em um curso de Engenharia de Computação,Derivaldo Machado da Silva (UFPA); Viviane Almeida dos Santos (UFPA),,https://sol.sbc.org.br/index.php/wit/article/view/15850
2021: Anais do XV Women in Information Technology,Artigos Completos,Panorama sobre Participação das Mulheres no IHC,Êrica Peters do Carmo (UDESC); Ediana da Silva de Souza (UDESC); Arthur Felipe Herdt Schuelter (UDESC); Milene Selbach Silveira (PUCRS); Simone Diniz Junqueira Barbosa (PUC-Rio); Rebeca Schroeder (UDESC); Isabela Gasparini (UDESC),,https://sol.sbc.org.br/index.php/wit/article/view/15851
2021: Anais do XV Women in Information Technology,Artigos Completos,Participação Feminina na Empresa Júnior de Computação - CJR da Universidade de Brasília,Alice Borges (UnB); Fernanda de Sousa (UnB); Maristela Holanda (UnB); Aleteia P. F. Araujo (UnB); Carla Cavalcante Koike (UnB); Roberta B. Oliveira (UnB),,https://sol.sbc.org.br/index.php/wit/article/view/15852
2021: Anais do XV Women in Information Technology,Artigos Completos,Relato de Experiência: Comunidade de Inteligência Artificial para Mulheres,Poliana Nascimento Ferreira (AI Girls / UFABC); Laura Damaceno de Almeida (AI Girls / UAM); Andressa da Silva Siqueira (AI Girls / IME); Beatriz Pereira (AI Girls),,https://sol.sbc.org.br/index.php/wit/article/view/15853
2021: Anais do XV Women in Information Technology,Artigos Completos,Segregação ocupacional por gênero e fator de personalidade assistência na área de tecnologia,Alessandra Herranz Gazquez (UNICESUMAR); Regiane da Silva Macuch (UNICESUMAR),,https://sol.sbc.org.br/index.php/wit/article/view/15854
2021: Anais do XV Women in Information Technology,Artigos Completos,Transformando ações extensionistas para o ambiente digital: Um relato de experiência no projeto Meninas Digitais do Vale,Maria Victoria S. Fiori (UFC); Maria Elanne M. Rodrigues (UFC); Lauana Maria C. de Oliveira (UFC); Ariany Almeida Maia (UFC); Marina da S. Rocha (UFC); Victoria Gabriella R. Pereira (UFC); Jacilane de H. Rabelo (UFC); Anna Beatriz Marques (UFC),,https://sol.sbc.org.br/index.php/wit/article/view/15855
2021: Anais do XV Women in Information Technology,Artigos Completos,Uma Análise Regional sobre o Perfil de Estudantes Concluintes em cursos STEAM através do ENADE,Jeovana Leão (UFAM); Adrya Araújo (UFAM); Bruna Mariana F. de Souza (UFAM); Julis Figueira de Araújo (UFAM); Kalil Ferreira (UFAM); Mariana Barros (UFAM); Tanara Lauschner (UFAM); Fabiola Guerra Nakamura (UFAM),,https://sol.sbc.org.br/index.php/wit/article/view/15856
2021: Anais do XV Women in Information Technology,Artigos Completos,Uma análise sobre a importância de um projeto com ações direcionadas ao acolhimento de ingressantes de cursos de Computação: Um estudo qualitativo,Marina da S. Rocha (UFC); Karina Castelo Branco (UFC); Ana Lara S. Oliveira (UFC); Lauana M. C. de Oliveira (UFC); Maria Victoria S. Fiori (UFC); Jacilane de H. Rabelo (UFC); Anna Beatriz Marques (UFC),"A evasão de alunas nos primeiros semestres dos cursos de Computação vem sendo cada vez mais frequente. Desse modo, busca-se tornar mais presentes ações que engajem, apoiem e acolham as alunas nos semestres iniciais. Partindo disso, a iniciativa de apadrinhamento acadêmico é uma ação que tem como objetivo identificar e analisar as principais dificuldades e motivações das alunas ingressantes para assim, desenvolver atividades que possam mudar essa realidade e fornecer o apoio necessário. Este artigo apresenta uma pesquisa que teve como objetivo coletar o feedback de nove alunas dos cursos de Ciência da Computação e Engenharia de Software participantes de uma iniciativa de apadrinhamento acadêmico. Uma análise qualitativa, por meio da metodologia Grounded Theory, foi realizada para explorar o impacto da iniciativa e sugestões de melhorias.",https://sol.sbc.org.br/index.php/wit/article/view/15857
2021: Anais do XV Women in Information Technology,Artigos Completos,Uma Iniciativa para Aumentar a Participação Feminina nas Competições de Programação: um Relato de Experiência,Alice Lima (UnB); Maria Eduarda Santos (UnB); Tong Zhou (UnB); Maristela Holanda (UnB); Aleteia P. F. Araujo (UnB); Carla Cavalcante Koike (UnB); Vinícius R. P. Borges (UnB); Roberta B. Oliveira (UnB),,https://sol.sbc.org.br/index.php/wit/article/view/15858
2021: Anais do XV Women in Information Technology,Artigos Completos,Unindo o Útil ao Agradável: Ação de Extensão de Formação em Informática para Mulheres em Vulnerabilidade Social,Renata Luiza da Costa (IFG); Celyce de Sousa Gonçalves Lula (IFG); Débora Guerra de S. Guinati (IFG); Stéfany de Castro Souza (IFG),"Este artigo apresenta resultados de uma ação de formação em informática desenvolvida para mulheres em vulnerabilidade social. A partir do interesse em oferecer oportunidade de aprendizagem profissional e da realidade de déficit de profissionais mulheres na área da Informática, a proposta integrou conteúdos de Informática Básica, Empreendedorismo, Discussões de Gênero e Motivacionais, e Design de Sites. Dentre outros resultados, foi possível perceber que a extensão é um caminho para atração de mulheres para a área da Informática, mas, para que permaneçam nos cursos, também foi identificado que são necessárias outras medidas de apoio assistencial, tendo em vista o perfil de vulnerabilidade social.",https://sol.sbc.org.br/index.php/wit/article/view/15859
2021: Anais do XV Women in Information Technology,Artigos Completos,Violência simbólica na área de Tecnologia: análise de relatos de alunas em um curso de Engenharia de Computação,Kamilla Taiwhscki B. Silva (UFPA); Ildenê F. S. Mota (UFPA); Viviane A. Santos (UFPA),,https://sol.sbc.org.br/index.php/wit/article/view/15860
2021: Anais do XV Women in Information Technology,Artigos Completos,Women in Technology: Uma análise bibliométrica dos últimos cinco anos,Andréa Sabedra Bordin (UFSC); Isadora Garcia Ferrão (USP); Kalinka R. L. J. C. Branco (USP),,https://sol.sbc.org.br/index.php/wit/article/view/15861
2021: Anais do XV Women in Information Technology,Artigos Curtos,A interdisciplinaridade em um curso de extensão como forma de empoderamento feminino na computação,Sara L. de Farias (IF GOIANO); Maria Isabela S. Nunes (IF GOIANO); Thalia S. de Santana (IF GOIANO); Natália do C. Louzada (IF GOIANO); Ramayane B. Braga (IF GOIANO); Adriano H. Braga (IF GOIANO),"Durante o ano de 2020 em decorrência da pandemia provocada pela COVID-19 foi ofertado um curso totalmente online com inscrição gratuita e livre para quaisquer participantes. O conteúdo programático do curso abordou principalmente os seguintes temas: Introdução aos Estudos Feministas, História das Mulheres na Computação e Pensamento Computacional, totalizando uma carga horária de 100 horas. A iniciativa alcançou participantes de 17 estados brasileiros, os quais avaliaram-na como socialmente importante, em especial, por abordar interdisciplinarmente conteúdos que frequentemente não são contemplados em cursos regulares.",https://sol.sbc.org.br/index.php/wit/article/view/15862
2021: Anais do XV Women in Information Technology,Artigos Curtos,A representatividade feminina nos jogos digitais,Luciana P. de Araújo Kohler (FURB); Leonardo Fronza (FURB); Andreza Sartori (FURB); Krysthie Burger (FURB); Jennyfer Araújo (FURB),,https://sol.sbc.org.br/index.php/wit/article/view/15863
2021: Anais do XV Women in Information Technology,Artigos Curtos,Análise da Participação de Meninas e Mulheres no Ensino Médio em Informática do Instituto Federal de Brasília,Sylvana Karla S. L. Santos (IFB),,https://sol.sbc.org.br/index.php/wit/article/view/15864
2021: Anais do XV Women in Information Technology,Artigos Curtos,Análise da presença de alunas dos cursos da área de Computação da UFRN,Soraya R. S. Medeiros (UFRN); Inácio G. Medeiros (UFRN),,https://sol.sbc.org.br/index.php/wit/article/view/15865
2021: Anais do XV Women in Information Technology,Artigos Curtos,"Comunidade Women Techmakers João Pessoa: história, conquistas e percepção inicial sobre suas integrantes",Ivyna Rayany Santino Alves (UFCG); Marcella Medeiros Siqueira C. de Almeida (UFCG); Elayni Franco (UFPB); Luciana Gomes (UEPB); Vanessa Dantas (UFPB),,https://sol.sbc.org.br/index.php/wit/article/view/15866
2021: Anais do XV Women in Information Technology,Artigos Curtos,Elas Digitais: protagonismo feminino para falar de cursos e carreiras na área de Computação,Caroline Reis Vieira Santos Rauta (IFSC); Daniela Sbizera Justo (IFSC); Rayana Prata Neves (IFSC); Djhesica Moreira Cortez (IFSC); Amanda de Oliveira Casagrande (IFSC),,https://sol.sbc.org.br/index.php/wit/article/view/15867
2021: Anais do XV Women in Information Technology,Artigos Curtos,Estratégias pedagógicas no ensino de programação para mulheres,Caroline Sacramento Alves (UFBA); Juliana Maria Oliveira dos Santos (UFBA); Débora Abdalla (UFBA),,https://sol.sbc.org.br/index.php/wit/article/view/15868
2021: Anais do XV Women in Information Technology,Artigos Curtos,Heroínas Ocultas: As Históricas Nunca Contadas da Ciência,Marcia Ferreira Cristaldo (IFMS); Marta Luzzi (IFMS); Claudia Santos Fernandes (IFMS); Amanda Raynara Quintana Theodoro (IFMS); Ariadne Nicoly Mori de Paula (IFMS); Bianca Fernandes Ribas (IFMS); Clara Scatena da Silva (IFMS); Diane Rosa da Silva (IFMS); Giovanna Mara Paes Franco (IFMS); Kryslla Barbosa Rocha de Carvalho (IFMS); Luana Arfux de Castro Nogueira (IFMS); Alice Barbosa do Couto (IFMS); Maria Eduarda Alves Barbosa (IFMS); Nayara Arruda Cunha (IFMS),,https://sol.sbc.org.br/index.php/wit/article/view/15869
2021: Anais do XV Women in Information Technology,Artigos Curtos,Incentivando Meninas nas Ciências: um Relato de Experiência dos Minicursos de Programação e Robótica para Jovens,Júlia Marotti (UFRJ); Francisco Campos (UFRJ); Julia Godinho (UFRJ); Gabriel SantClair (UFRJ); Flávia Villela (UFRJ); Janaina Gomide (UFRJ); Laura Emmanuella de Oliveira (UFRN); Beatriz Becker (UFRJ); Camila Laricchia (UFRJ); Denise Siloto (UFRJ); Elisa Rocha (UFRJ); Milena Estanislau (UFRJ); Tabatta Martins (UFRJ); Valeria Nunes Belmonte (UFRJ),,https://sol.sbc.org.br/index.php/wit/article/view/15870
2021: Anais do XV Women in Information Technology,Artigos Curtos,Investigando a Participação das Mulheres nas Áreas de Teste e Qualidade de Software,Larissa M. R. Alves (UFERSA); Samara Martins Nascimento (UFERSA); Veronica M. L. Silva (UFERSA),,https://sol.sbc.org.br/index.php/wit/article/view/15871
2021: Anais do XV Women in Information Technology,Artigos Curtos,Mentoria em programação: aprendendo ao ensinar e ensinando ao aprender,Thais Regina de M. B. Silva (UFV); Gláucia Braga e Silva (UFV); Maria Theresa Arruda Henriques (UFV),,https://sol.sbc.org.br/index.php/wit/article/view/15872
2021: Anais do XV Women in Information Technology,Artigos Curtos,Nossa Voz: uma plataforma digital para visualização de dados sobre violência contra a mulher no Brasil,Dynnah Hanna Max P. G. da Silva (IFPB); Alana Marques de Morais (UNIESP); Aline Marques de Morais (UNIESP),,https://sol.sbc.org.br/index.php/wit/article/view/15873
2021: Anais do XV Women in Information Technology,Artigos Curtos,O Gênero Negro Feminino nas Redes Sociais: o que Revelam as Produções Acadêmicas,Mory Márcia de Oliveira Lobo (UFMT); Cristiano Maciel (UFMT),,https://sol.sbc.org.br/index.php/wit/article/view/15874
2021: Anais do XV Women in Information Technology,Artigos Curtos,Projeto Katie: o desafio de motivar meninas para as áreas STEM em meio à pandemia,Ana Carolina Nesso Guedes (UFAL); Ester de Lima Pontes Andrade (UFAL); Kamila Almeida Benevides (UFAL); Kelly Bianca Araújo Silva (UFAL); Lilian Giselly Pereira Santos (UFAL); Luana Júlia Nunes Ferreira (UFAL); Natália de Assis Sousa (UFAL); Rebeca de Jesus Brandão (UFAL); Eliana Almeida (UFAL),,https://sol.sbc.org.br/index.php/wit/article/view/15875
2021: Anais do XV Women in Information Technology,Artigos Curtos,Redes sociais como ferramenta de visibilidade das mulheres nas ciências exatas: análise do perfil @lindasdaengenharia,Sara das Mercês Silva (UFPA); Geisiane S. Matos (UFPA); Tatiane A. Nascimento (UFPA); Fabíola Pantoja O. Araújo (UFPA),,https://sol.sbc.org.br/index.php/wit/article/view/15876
2021: Anais do XV Women in Information Technology,Artigos Curtos,Redes Sociais e Mulheres na Computação: Iniciativas Divulgadas no Meio Digital,Suzy Kamylla de Oliveira Menezes (IFAL / UFAL),,https://sol.sbc.org.br/index.php/wit/article/view/15877
2021: Anais do XV Women in Information Technology,Artigos Curtos,Relato da experiência de desenvolvimento de um manual de boas práticas em ambientes acadêmicos,Bruna Mariana F. de Souza (UFAM); Kalil Ferreira (UFAM); Adrya Araújo (UFAM); Jeovana Leão (UFAM); Julis Figueira de Araújo (UFAM); Mariana Barros (UFAM); Tanara Lauschner (UFAM); Fabiola Guerra Nakamura (UFAM),,https://sol.sbc.org.br/index.php/wit/article/view/15878
2021: Anais do XV Women in Information Technology,Artigos Curtos,Relato das atividades e dificuldades do Coletivo Mirtha Lina em meio à pandemia de Covid-19,Camila Sass (UFABC); Beatriz Chicaroni (UFABC); Lara Tenore (UFABC); Lidia Ferreira (UFABC); Maria Eduarda Brandão (UFABC); Melissa Lins (UFABC); Poliana Ferreira (UFABC); Rosimeire Santana (UFABC); Carla Rodriguez (UFABC); Denise Goya (UFABC); Rafaela V. Rocha (UFABC),,https://sol.sbc.org.br/index.php/wit/article/view/15879
2021: Anais do XV Women in Information Technology,Artigos Curtos,Relato de Projeto para Disseminação e Apoio à Participação de Mulheres em Áreas da Ciência,Ana Luísa S. Milson (IFMG); Luísa M. Laboissiere (IFMG); Marcella D. Ferreira (IFMG); Rodrigo Cardoso (IFMG); Michele A. Brandão (IFMG),"O projeto DAMA objetiva apoiar a participação feminina em áreas de tecnologia e ciência. Diversas ações foram realizadas para ajudar meninas a se sentirem acolhidas em áreas consideradas masculinas e mostrar que há espaço para elas, além de contribuir para o crescimento pessoal e profissional das integrantes. Este artigo descreve as principais ações desenvolvidas no projeto e seus resultados.",https://sol.sbc.org.br/index.php/wit/article/view/15880
2021: Anais do XV Women in Information Technology,Artigos Curtos,StoryGirl: programando através de narrativas,Beatriz Saburido (UFRRJ); Angélica F. S. Dias (UFRJ); Juliana B. S. França (UFRRJ),,https://sol.sbc.org.br/index.php/wit/article/view/15881
2021: Anais do XV Women in Information Technology,Artigos Curtos,Um Curso Mooc de Pensamento Computacional contextualizado no Cotidiano Feminino,Vânia Silvares Marquiori (IFES); Márcia Gonçalves de Oliveira (IFES),,https://sol.sbc.org.br/index.php/wit/article/view/15882
2021: Anais do XV Women in Information Technology,Artigos Curtos,"""Vai, Meninas!""- Uma iniciativa para fomentar a participação das mulheres nos cursos da área de tecnologia da informação",Suelen M. de Paula (IFMG); Raylla L. S. Gama (IFMG); Isabella A. D. Melo (IFMG); Adrielly C. E. Dias (IFMG); Daniela C. Terra (IFMG); Leticia M. M. S. Cheloni (IFMG),,https://sol.sbc.org.br/index.php/wit/article/view/15883
2020: Anais do XIV Women in Information Technology,Artigos Completos,Despertando Vocações Através da Capacitação em Tecnologia: Experiências com Alunas do Ensino Médio da ECI EEFM Professor Celestin Malzac,Giorgia O. Mattos (UFPb); Josilene A. Moreira (UFPb); Laura L. A. O. Campos (UFPb); Luyza E. D. Nascimento (UFPb); Maria L. M. Calixto (UFPb); Vanessa G. L. Pessoa (UFPb); Tiago E. S. Araujo (Escola Cidadã Integral Estadual de Ensino Fundamental e Médio Professor Celestin Malzac),"Este trabalho apresenta as iniciativas desenvolvidas com alunas do 1º ano do ensino médio da ECI EEFM Professor Celestin Malzac na cidade de João Pessoa/PB durante o ano de 2019. As iniciativas incluíram a computação desplugada, minicurso de desenvolvimento de aplicativos para dispositivos móveis, além de palestras e debates sobre as personalidades femininas de destaque bem como a inserção feminina na tecnologia. Ao final das atividades foi aplicado um questionário de avaliação onde os dados obtidos são também apresentados, analisados e discutidos.",https://sol.sbc.org.br/index.php/wit/article/view/11270
2020: Anais do XIV Women in Information Technology,Artigos Completos,Elas na Ciência: Website com Jogos para Divulgar Personalidades Femininas,Ana Luíza S. Milson (IFMG); Indra  Matsiendra C. D. Ribeiro (CEFET-MG); Izabela A.  Andrade (CEFET-MG); Julia  M. M. Gonçalves (CEFET-MG); Luísa  M. Laboissiere (IFMG); Marcella  D. Ferreira (IFMG); Daniel  H. Dalip (CEFET-MG); Michele A. Brandão (IFMG); Mirella M. Moro (UFMG),"Existe uma grande diferença na participação de homens e mulheres em diferentes setores da sociedade, incluindo acadêmico, mercado e doméstico. Por isso, diferentes estudos têm sido desenvolvidos para entender os principais fatores e soluções para tal cenário. Este trabalho contribui para minimizar essa discrepância ao desenvolver um website com jogos que permitem a divulgação de personalidades femininas das Ciências. Um teste de usabilidade foi conduzido, e os resultados mostram que o site e os jogos são atrativos e realmente capazes de ensinar sobre o tema abordado.",https://sol.sbc.org.br/index.php/wit/article/view/11271
2020: Anais do XIV Women in Information Technology,Artigos Completos,Elas: introdução à engenharia da computação e além,Thiago Luís Lopes Siqueira (IFSP),"""Elas"" é um conjunto de intervenções educacionais e de apoio a mulheres no ensino superior em Computação. As intervenções incidem tanto nas atividades curriculares (aula de um componente curricular) quanto nas extracurriculares (mesa-redonda e evento) do curso de bacharelado em Engenharia de Computação. Neste artigo são descritas as intervenções e relatadas as experiências. Em particular, os relatos se referem a uma turma ingressante no primeiro ano de oferecimento do curso.",https://sol.sbc.org.br/index.php/wit/article/view/11272
2020: Anais do XIV Women in Information Technology,Artigos Completos,Espaço infantil em eventos da Sociedade Brasileira de Computação: uma necessidade ou não?,Leticia Santos Machado (UFPA); Silvia Amélia Bim (UTFPR); Karen da Silva Figueiredo Medeiros Ribeiro (UFMT); Luciana Bolan Frigo (UFSC); Cristiano  Maciel (UFMT),"Um dos direitos almejados pelas inúmeras iniciativas para a equidade de gênero é o da parentalidade responsável. Neste contexto, dentre as demandas de mães e pais que atuam na pesquisa científica está a participação em eventos com apoio para o cuidado de crianças. Neste artigo, são apresentados dados de um levantamento realizado pelo Programa Meninas Digitais sobre a necessidade de oferecer um espaço infantil que possa acolher as crianças de mães, pais e responsáveis que estejam participando dos eventos científicos organizados e apoiados pela Sociedade Brasileira de Computação.",https://sol.sbc.org.br/index.php/wit/article/view/11273
